place_id,place_name,review_id_hash,rating,review_text,published_at,published_at_date,response_from_owner_text,response_from_owner_ago,response_from_owner_date,review_likes_count,total_number_of_reviews_by_reviewer,total_number_of_photos_by_reviewer,is_local_guide,review_translated_text,response_from_owner_translated_text
ChIJZzeRDkBZwokRODxBJ-bYauA,Skirt Steak,a629ddfc38a9c4acf5263153ab900d28,5,,8 months ago,2023-07-02 11:29:25.159801,Thanks so much for joining us!,8 months ago,2023-07-02 11:29:25.159801,0,61,21,True,,
ChIJZzeRDkBZwokRODxBJ-bYauA,Skirt Steak,5eb745432cf592496ded22a45deb3470,5,"This was my first time at Skirt Steak and I would definitely go back! Its a prefixe menu all the time for $40 per person and that includes salad, steak and the endless fries. There is a guy that goes around periodically with a bowl of fries and tongs to fill up your plate when getting low :) they had a menu with a few side dishes you can order at an additional cost and we got the garlic bread, it was pretty tasty. There are no reservations just walk ins. Definitely recommend!",8 months ago,2023-07-02 11:29:25.946348,"Thanks so much! This is very meaningful, and we loved having you guys! Hope to see you back!",8 months ago,2023-07-02 11:29:25.946348,0,19,17,False,,
ChIJZzeRDkBZwokRODxBJ-bYauA,Skirt Steak,9057af0faaf62d137da8308b4ae76f64,5,,8 months ago,2023-07-02 11:29:25.949886,Thanks for the positive review! Much appreciated.,8 months ago,2023-07-02 11:29:25.949886,0,1,,False,,
ChIJZzeRDkBZwokRODxBJ-bYauA,Skirt Steak,8627f8a8be70a03f1ba7d9e6cd20fa69,1,"Horrible service and overhyped food. We got seated before the two tables next to us, yet they were served first. The person who refills the fries kept coming to them. When we got served, the person who refills the fries didn t come to us once. Didn t matter since the fries weren t good anyway and you could get better packaged frozen ones at any grocery store. They also tried to charge us for an appetizer we never got. And when we wanted dessert, they ignored us. Ridiculous tik tok fad that isn t worth it.",8 months ago,2023-07-02 11:29:25.953530,,,,1,5,,False,,
ChIJZzeRDkBZwokRODxBJ-bYauA,Skirt Steak,b02b931454f79e2bb0bfd7cca6f5a298,4,The best skirt i ever taste,8 months ago,2023-07-02 11:29:25.957234,Thanks for the kind review! So glad you enjoyed everything.,8 months ago,2023-07-02 11:29:25.957234,0,207,1232,True,,
ChIJZzeRDkBZwokRODxBJ-bYauA,Skirt Steak,bd97e678bf12df06d8630dc09e398cfc,2,"Overhyped. Steaks were small, salad - just green leaves, fries ok. The only good thing is pepper sauce. Way too expensive for what you get Food",8 months ago,2023-07-02 11:29:25.961042,"Thanks for the feedback. Yes, we use locally-sourced and expensive greens, so sometimes that s missed. The skirt steak is prime, so that s what we spend the most money on for the price. We will continue to adjust as time goes on and hope to see you back to see your feedback next time.",8 months ago,2023-07-02 11:29:25.961042,0,9,2,False,,
ChIJZzeRDkBZwokRODxBJ-bYauA,Skirt Steak,3de5cdd7ea6c29948c2de4bb57e3f8ba,5,"Great meat. Great dessert. Well, the salad was average. You should do it. Thumbs up.",8 months ago,2023-07-02 11:29:25.965091,Thank you so much!,8 months ago,2023-07-02 11:29:25.965091,1,48,,False,"Super Fleisch. Super Dessert. Gut , der Salat war durchschnittlich. Sollte man machen. Daumen hoch.",
ChIJZzeRDkBZwokRODxBJ-bYauA,Skirt Steak,c45c7493ddcf9c3a1999afd20163d475,2,"Very beautiful restaurant, but beneath average food. I was highly disappointed by this place. The French fries were hot, but the steak was not. We had about a long wait and our steak arrived cold. There wasnt much seasoning on the steak either and the serving was minute. Additionally, the salad that they offered was salty and ordinary. This menu was mediocre and limited for its pricey value. The food was not seasoned well either. You can prepare this at home for less. Essentially customers are just paying for the fries.",8 months ago,2023-07-02 11:29:25.969352,"Thanks for letting us know about this. We would love to invite you back, as that s not the experience we are looking for. Please let the reservations team know next time you re coming in so we can look after you properly.",8 months ago,2023-07-02 11:29:25.969352,9,164,496,True,,
ChIJZzeRDkBZwokRODxBJ-bYauA,Skirt Steak,c590a8c7263aca3200c36dad6d7b3622,3,,8 months ago,2023-07-02 11:29:25.974461,,,,0,18,25,True,,
ChIJZzeRDkBZwokRODxBJ-bYauA,Skirt Steak,d1e7845274bcaf37e2acdb390da1dd25,4,,8 months ago,2023-07-02 11:29:25.977537,Thanks so much for the feedback! Glad you enjoyed yourself.,8 months ago,2023-07-02 11:29:25.977537,0,69,124,True,,
ChIJZzeRDkBZwokRODxBJ-bYauA,Skirt Steak,3a850ce0ce837c4473d34b9781b43682,5,"The steak was top notch: tender, juicy, and tasty; melting in the mouth. The unlimited fries came with it were also crunchy and delicious.",8 months ago,2023-07-02 11:29:25.981209,Thanks so much for the kind words! It was a pleasure serving you all.,8 months ago,2023-07-02 11:29:25.981209,0,35,53,True,,
ChIJZzeRDkBZwokRODxBJ-bYauA,Skirt Steak,32ed2ec749d2cfcc08b6599fcbf5994a,5,We are just coming back from the Skirt Steak and the place was fabulous all wood work great food great service and a great atmosphere as well,8 months ago,2023-07-02 11:29:26.948404,,,,1,142,378,True,,
ChIJZzeRDkBZwokRODxBJ-bYauA,Skirt Steak,c659b15b8ba41ea1aa25e5b4340841aa,5,,8 months ago,2023-07-02 11:29:26.952894,,,,0,7,,True,,
ChIJZzeRDkBZwokRODxBJ-bYauA,Skirt Steak,3de13f8d7388e04a62c121200e28ff83,5,"They only offer pre fixe menu at $39+ depending on how many add ons you get (used to be $28+ I believe). The steak wasnt the best cut but they cooked/seasoned it well. Salad was good both in its taste and portion size. The bottomless fries were the highlight of our meal, however, as they were so crispy and aromatic.",8 months ago,2023-07-02 11:29:26.956935,,,,1,122,107,True,,
ChIJZzeRDkBZwokRODxBJ-bYauA,Skirt Steak,dc844c5e2c8bc1d758a40776b7cf0ec6,5,,8 months ago,2023-07-02 11:29:26.966903,,,,0,27,75,True,,
ChIJZzeRDkBZwokRODxBJ-bYauA,Skirt Steak,ac086952da95eaa499fea4440b40187b,5,"Great service, great food. The rhubarb cheese was amazing.",8 months ago,2023-07-02 11:29:26.977703,,,,0,60,2,True,,
ChIJZzeRDkBZwokRODxBJ-bYauA,Skirt Steak,d358eb0a0d63dc10d476cb03e4f1172a,5,,8 months ago,2023-07-02 11:29:26.986086,,,,0,9,79,True,,
ChIJZzeRDkBZwokRODxBJ-bYauA,Skirt Steak,36f43129dcf3c1dfb50afd8a3c3953b8,5,Fixed menu with great steaks and French fries. Also reasonable prices,8 months ago,2023-07-02 11:29:26.989381,,,,0,64,34,False,,
ChIJZzeRDkBZwokRODxBJ-bYauA,Skirt Steak,013ecf8bc89c2ff60fa4f05c45a7a847,5,Great service and great food. Desserts are amazing,8 months ago,2023-07-02 11:29:26.996876,,,,0,2,,False,,
ChIJZzeRDkBZwokRODxBJ-bYauA,Skirt Steak,9bb8c3bb29e44af3ced18bec8ae0fb5e,5,Outstanding food from Chef Laurent Tourendel,8 months ago,2023-07-02 11:29:26.999911,,,,1,37,13,False,,
ChIJZzeRDkBZwokRODxBJ-bYauA,Skirt Steak,ad8cebdd105f4df4562b393298127c4a,4,"Steak was good, better than it looked. The fries were as good as it gets, the salad basic & pretty bland. The Spinach pretty terrible, greasy & tough. Garlic bread is excellent if very expensive.",9 months ago,2023-06-02 11:29:27.003257,,,,1,344,1138,True,,
ChIJZzeRDkBZwokRODxBJ-bYauA,Skirt Steak,ef7026101bfec9d66b890cf1ac8984a6,5,Amazing steak and great staff!,9 months ago,2023-06-02 11:29:27.926402,,,,0,1,,False,,
ChIJZzeRDkBZwokRODxBJ-bYauA,Skirt Steak,3a4dcf852009ba7e68d417eefa628309,4,Good food.  Good drinks.  Great service.  Sit at the bar and dont wait outside.,9 months ago,2023-06-02 11:29:27.930122,,,,0,28,9,True,,
ChIJZzeRDkBZwokRODxBJ-bYauA,Skirt Steak,bdeaa7f7fd426cabccc480741f5c4d59,4,,9 months ago,2023-06-02 11:29:27.933477,,,,0,60,154,True,,
ChIJZzeRDkBZwokRODxBJ-bYauA,Skirt Steak,481c3d7987dd15f9b84677bd3ffa7a35,5,Its worth waiting in line in front of the place,9 months ago,2023-06-02 11:29:27.938715,,,,0,24,4,True,Warto czeka  w kolejce przed lokalem,
ChIJZzeRDkBZwokRODxBJ-bYauA,Skirt Steak,8b23be3fc8cdc215ed93860420137a35,5,,9 months ago,2023-06-02 11:29:27.942557,,,,0,46,11,True,,
ChIJZzeRDkBZwokRODxBJ-bYauA,Skirt Steak,9c3a9355d44a4ef9c99d4d6faa7bce8d,5,One Price two terms of meat and all the fries you can get. Simple and great.,9 months ago,2023-06-02 11:29:27.946195,,,,0,280,379,True,,
ChIJZzeRDkBZwokRODxBJ-bYauA,Skirt Steak,3292c8ea3c666347b582257974ee8222,5,,9 months ago,2023-06-02 11:29:27.949574,,,,0,196,84,True,,
ChIJZzeRDkBZwokRODxBJ-bYauA,Skirt Steak,7fc6ff9ba116de518e6158feb120398f,5,,9 months ago,2023-06-02 11:29:27.952754,,,,0,23,1,True,,
ChIJZzeRDkBZwokRODxBJ-bYauA,Skirt Steak,7160677249178d41598e6b7437d07166,3,was ok! i like the concept. steak was a bit too fatty and oily though. fries were good,9 months ago,2023-06-02 11:29:27.956873,,,,0,53,25,True,,
ChIJZzeRDkBZwokRODxBJ-bYauA,Skirt Steak,d1b9d8478c43dbd90b71faec68d4a1b7,5,,9 months ago,2023-06-02 11:29:27.960266,,,,0,24,,True,,
ChIJZzeRDkBZwokRODxBJ-bYauA,Skirt Steak,fb6b2c4604f2c0c5653b6ed9f59fbe65,5,"Super simple pre fix menu. Steak cooked perfectly, the fries were SOOOOO good, and service was quick. Will definitely come back!",9 months ago,2023-06-02 11:29:28.801358,,,,0,20,,True,,
ChIJZzeRDkBZwokRODxBJ-bYauA,Skirt Steak,33a09636e6093d63cb8fd67434b9938c,5,Great atmosphere. Excellent service. Superb food.  Loved it!,9 months ago,2023-06-02 11:29:28.804814,,,,0,30,163,True,,
ChIJZzeRDkBZwokRODxBJ-bYauA,Skirt Steak,7db84b8549868abb1632b938fd87c371,5,Loved the walk up concept and simple menu. Steak was perfection.,9 months ago,2023-06-02 11:29:28.808052,,,,0,5,,False,,
ChIJZzeRDkBZwokRODxBJ-bYauA,Skirt Steak,7d57a4730bdd46b04fd813d80d800f22,5,"Amazing menu, short & tasty!",9 months ago,2023-06-02 11:29:28.811961,,,,0,25,,False,,
ChIJZzeRDkBZwokRODxBJ-bYauA,Skirt Steak,f2d4cd7572f2fa0893a9e1aae8fad045,5,"Stopped in here for dinner after seeing many good things about the place online. No time was wasted in getting us seated, explaining the menu to us and the first course arrived with very little wait. All the staff were attentive and very helpful, we werent left waiting for anything during our evening. The novelty of the desert cart was a nice touch!",9 months ago,2023-06-02 11:29:28.815289,,,,1,13,7,True,,
ChIJZzeRDkBZwokRODxBJ-bYauA,Skirt Steak,de49747f39f1b70448cea4ff0d95d7ed,5,"Outstanding food, limited choices, but if youre interested in skirt strak like I was, it did not matter!",9 months ago,2023-06-02 11:29:28.818579,,,,1,95,3,False,,
ChIJZzeRDkBZwokRODxBJ-bYauA,Skirt Steak,f695bb4d491c3794023919cbcd15e478,5,This is a great place. Price is right. Steak was absolutely delicious.,9 months ago,2023-06-02 11:29:28.822907,,,,0,219,692,True,,
ChIJZzeRDkBZwokRODxBJ-bYauA,Skirt Steak,c360aa069cc0ee87f56352b7084027f1,3,"Ok so this is a very limited menu restaurant. Skirt steak Only its small about a fist size, must be for skinny girls  !!!!! Comes with unlimited fries ( fries are very salty,  hint to owner if one item is salty then dont add salt to meat !!!!) The garlic bread is excellent  and i couldnt stop eating it, its a must try ! Salad, and you can order side veggies 2 choices. Thats all she wrote it must be a Millennial thing !!!! Dessert is wheeled around on a glass enclose tray they look very good and the strawberry cake was very good. Drinks are small very small you can get very drunk without realizing it !!!!",9 months ago,2023-06-02 11:29:28.826540,,,,0,90,1,True,,
ChIJZzeRDkBZwokRODxBJ-bYauA,Skirt Steak,abbbcbd8b9acf60538b6e0cdfb9f6f7a,5,excellent skirt steak and service!,9 months ago,2023-06-02 11:29:28.829797,,,,0,74,645,True,,
ChIJZzeRDkBZwokRODxBJ-bYauA,Skirt Steak,bca50cb2e84c96770003a133a5d74f49,5,,9 months ago,2023-06-02 11:29:28.832524,,,,0,44,179,True,,
ChIJZzeRDkBZwokRODxBJ-bYauA,Skirt Steak,91e89cff8fe67d6b3c7b99a31b71574e,5,It s was amazing excellent service and place,9 months ago,2023-06-02 11:29:29.647372,,,,0,13,5,False,,
ChIJZzeRDkBZwokRODxBJ-bYauA,Skirt Steak,778053451caf0d22cb8c6856eb1e0626,5,Great skirt steak and fries,9 months ago,2023-06-02 11:29:29.650293,,,,0,44,8,False,,
ChIJZzeRDkBZwokRODxBJ-bYauA,Skirt Steak,decb0b7c4b1c20318716ef55e36755cd,5,"Great vibe, fixed price (no suprise) and employers super kind",9 months ago,2023-06-02 11:29:29.654463,,,,0,347,671,True,,
ChIJZzeRDkBZwokRODxBJ-bYauA,Skirt Steak,d3eaad4b032ce56be1c03505ec715f62,5,,9 months ago,2023-06-02 11:29:29.658335,,,,0,1,,False,,
ChIJZzeRDkBZwokRODxBJ-bYauA,Skirt Steak,34d5c11240e88ef53710e521508d8826,5,The steak was a bit different than I expected. They came in some pieces but they were nonetheless delicious! I really loved the smooth yet crunchy garlic bread and the color they gave the inside of it!,9 months ago,2023-06-02 11:29:29.661477,,,,0,173,1,True,,
ChIJZzeRDkBZwokRODxBJ-bYauA,Skirt Steak,322fd3c6d324240d06706b2b4f016556,5,Great deal on steak only $40 can have unlimited fries and peppercorn sauce on steak is great,9 months ago,2023-06-02 11:29:29.665377,,,,0,80,338,False,,
ChIJZzeRDkBZwokRODxBJ-bYauA,Skirt Steak,f65e313737e16263ce437ec5199d606b,5,,9 months ago,2023-06-02 11:29:29.669178,,,,0,26,5,True,,
ChIJZzeRDkBZwokRODxBJ-bYauA,Skirt Steak,11ff80a5aad6b5ef82eb4f0809d46172,1,"This place is a rip off. I wouldn t mind getting ripped off if the food was amazing. We ordered 2 skirt steaks which looked like 1 skirt steak, side of asparagus which was the tiniest side I ve ever seen. Do not go by the pictures and videos on Instagram, 100% misleading. The salad is just a plate of huge uncut pieces of lettuce with mint and a dressing. We paid $170 for fries. I love the business concept, but if you are going to serve skirt steak only, it has to be the best skirt steak out there and it doesn t come close to even good.",9 months ago,2023-06-02 11:29:29.673516,,,,1,4,,False,,
ChIJZzeRDkBZwokRODxBJ-bYauA,Skirt Steak,97e4aa027813b3cb75e1b5fa2fa21c67,5,Amazing steak and fries. The dessert cart wasn t as good but it s ok.,9 months ago,2023-06-02 11:29:29.677377,,,,0,43,,True,,
ChIJZzeRDkBZwokRODxBJ-bYauA,Skirt Steak,9be5de435a06fbdb1066cb9b3cff966f,1,"My salad was DIRTY. Crunchy unwashed and gross. It ruined the meal and made me question the cleanliness of the place. Its been a week and Im cautiously eating my salad from a totally different place. I have dirty salad PTSD. Unbelievable lol. Wash the lettuce please. This place reminds you of the Parisian restaurant, Le Relais de l Entrecote but they may need to slow down a bit and take care of the basics.",9 months ago,2023-06-02 11:29:29.680676,,,,1,6,,False,,
ChIJZzeRDkBZwokRODxBJ-bYauA,Skirt Steak,198b396c658e835de7c8f5ad413e332b,3,"The steak is very good with the fillet inside. Salads have the disadvantage of not being washed well, so the dirt gets chewy... Steak is highly recommended. Add asparagus and eat it",9 months ago,2023-06-02 11:29:30.888438,,,,0,14,1,False,,
ChIJZzeRDkBZwokRODxBJ-bYauA,Skirt Steak,2420dc87d4ba8eeb3e67ca1ed20b49b4,5,,9 months ago,2023-06-02 11:29:30.891696,,,,0,3,,False,,
ChIJZzeRDkBZwokRODxBJ-bYauA,Skirt Steak,9ee8b824ee952436a1e9e5cec6ba3616,5,Great food and service,9 months ago,2023-06-02 11:29:30.894874,,,,0,75,23,True,,
ChIJZzeRDkBZwokRODxBJ-bYauA,Skirt Steak,9bbbea863bd72c73ffce4296281470c5,5,,9 months ago,2023-06-02 11:29:30.897924,,,,0,3,,False,,
ChIJZzeRDkBZwokRODxBJ-bYauA,Skirt Steak,fcf2dec2bc13877f8700899219ea31f5,5,"Menu is simple, but the food is *excellent*. Our server was very friendly, as was the rest of the staff. The ambiance is charming. We made the mistake of ordering a couple of extra items (including their delicious garlic bread), and thus were too full to take advantage of the dessert cart afterward. Well know better next time! :-)",9 months ago,2023-06-02 11:29:30.900196,,,,0,202,270,True,,
ChIJZzeRDkBZwokRODxBJ-bYauA,Skirt Steak,8e17ec98204aded9668fd96d0b104b3c,5,"American cultural take on traditions French.  Just the right amount of steak.  All you can eat fries, but we couldnt finish other first serving.  We also used the asparagus which is amazing. Atmosphere is relaxed   decorated with exposed wood framing like a house under construction. Cost - For 40 bucks in New York City, its the right price. Service was excellent.  Fast and friendly. We had a short wait to get in, but once we left, the was a line.",10 months ago,2023-05-02 11:29:30.903446,,,,1,219,1722,True,,
ChIJZzeRDkBZwokRODxBJ-bYauA,Skirt Steak,6639b8e71e92b1bf672bb46fa4fda3e0,3,"We went here for lunch - Sunday - didn t have a reservation and there was no line. Service was friendly and quick. It was an okay experience. Expected more from a $40 steak - yes, you get some greens (just lettuce with some weird dressing that we didn t much like) and all you can eat fries - but honestly what you are really paying for is the steak. Not sure I would go back. Including a soft drink and a desert (shared) ended up at $65 per person. For a simple Sunday lunch, it felt a bit overpriced for what you get. The steak could be tastier and fries could be crispier.",10 months ago,2023-05-02 11:29:30.907085,,,,0,327,325,True,,
ChIJZzeRDkBZwokRODxBJ-bYauA,Skirt Steak,3e45d07eb49546124d5299d5e1f885fa,5,We came around 5:30 when it was raining outside and were seated immediately - on a Saturday no less! Our group was really impressed with the steak and fries and for a good price too. The dessert cart was cute too!,10 months ago,2023-05-02 11:29:30.910307,,,,0,24,11,True,,
ChIJZzeRDkBZwokRODxBJ-bYauA,Skirt Steak,5313490affd5caa2f840bf279dabee27,4,"Sat at the bar, was enjoyable, but needs a little work",10 months ago,2023-05-02 11:29:30.913506,,,,0,312,479,True,,
ChIJZzeRDkBZwokRODxBJ-bYauA,Skirt Steak,df639e29f2dbfcc0ee26f979763a2d17,5,The Bartender Sarah was amazing! She really went above and beyond with the customer service!,10 months ago,2023-05-02 11:29:30.917344,,,,0,82,35,True,,
ChIJZzeRDkBZwokRODxBJ-bYauA,Skirt Steak,97fa9f3783847a1f4eeb153d99e39cb1,4,"Came on a quick solo date around 6pm on a Wednesday & service was really good. I was sat immediately. Received my salad & classic martini (strong in the good way) within minutes of sitting. Steak was ok, unlimited fries were amazing, the garlic bread worth the extra charge. The strawberry shortcake was DELICIOUS. By the time I was leaving there was a line forming of people trying to get in. Overall a good deal to split with a friend.",10 months ago,2023-05-02 11:29:31.735788,,,,2,33,,True,,
ChIJZzeRDkBZwokRODxBJ-bYauA,Skirt Steak,97dae73c9ca6a363fd5c09a6328b0390,5,"Great steaks, super friendly staff, highly recommended!",10 months ago,2023-05-02 11:29:31.740181,,,,0,6,28,True,,
ChIJZzeRDkBZwokRODxBJ-bYauA,Skirt Steak,f9927fb6181af1f47ad2fa3dfc0e2058,5,,10 months ago,2023-05-02 11:29:31.743649,,,,0,4,,True,,
ChIJZzeRDkBZwokRODxBJ-bYauA,Skirt Steak,edccc69a61cb5c84c0fefe785971eb39,5,This is my go to place for steak in nyc!,10 months ago,2023-05-02 11:29:31.747132,,,,0,53,145,True,,
ChIJZzeRDkBZwokRODxBJ-bYauA,Skirt Steak,68723007f931a89d04c3142498851270,5,"Its the New York version of Le Relais de l Entrecote in Paris. This restaurant serves Steak, salad, and all-you-can-eat fries for $39 They served the steak with a delicious peppercorn sauce. There is a list of additional sides that you can choose from. The meal was delicious and filling. I was very impressed with the service.  Our fry plates never went empty. This is a great spot for someone indecisive.",10 months ago,2023-05-02 11:29:31.750568,,,,0,93,240,True,,
ChIJZzeRDkBZwokRODxBJ-bYauA,Skirt Steak,b08c451f39c97535f005684054aad001,4,The service was excellent and food was delicious.,10 months ago,2023-05-02 11:29:31.754667,,,,0,23,49,True,,
ChIJZzeRDkBZwokRODxBJ-bYauA,Skirt Steak,db3b5bcbc85d53ae9076a2b4c9235209,5,Loveee it with 39$,10 months ago,2023-05-02 11:29:31.759891,,,,0,8,3,False,,
ChIJZzeRDkBZwokRODxBJ-bYauA,Skirt Steak,908b9a6322581e787c3acad3bc91cf2d,5,Great quick meal...bottomless fries were amazing and if course the steak was perfectly cooked.,10 months ago,2023-05-02 11:29:31.763158,,,,0,4,,False,,
ChIJZzeRDkBZwokRODxBJ-bYauA,Skirt Steak,fc8c08101aea8576a87ff96a4c73ce70,1,Usually this is a great spot and we love the experience. But this was ruined last night. We waited 1 hour after ordering before complaining to the server and manager because the people next to us were nearly done with their meal and had arrived 20 minutes after us. We were only two and the group next to us were three so regardless our order should have been out well in advance. Manager was very rude and said  you can leave.  We have dined here 3 times and this will be the last.   This was last night: 4/18/2023 at 9pm-10pm.,10 months ago,2023-05-02 11:29:31.766971,,,,1,4,,False,,
ChIJZzeRDkBZwokRODxBJ-bYauA,Skirt Steak,b87f07ffaeae4b04ca797d3d8f875b7a,4,Steak was good and worth it if you can eat a lot of fries and salad. Everything was salad but the place has no hot sauce! Craziness. We also got a side of garlic bread which was tasty and very garlicky.,10 months ago,2023-05-02 11:29:31.771178,,,,0,71,221,True,,
ChIJZzeRDkBZwokRODxBJ-bYauA,Skirt Steak,1eb1faa94db7f70a576b67f616cf7476,3,"No frills steak spot for a great price. Salad, steak & unlimited fries. Wish they had more sauce options for the steak. Just some steak sauce would do.",10 months ago,2023-05-02 11:29:32.963668,,,,0,60,55,True,,
ChIJZzeRDkBZwokRODxBJ-bYauA,Skirt Steak,5088ba928e5c5ae1c25de91aadb0c7cb,4,"Really good food, as well as the service. The interior gave a sense of Nordic design.",10 months ago,2023-05-02 11:29:32.967219,,,,0,453,303,True,,
ChIJZzeRDkBZwokRODxBJ-bYauA,Skirt Steak,c08e89db94e656173eb77780227fa2a0,4,,10 months ago,2023-05-02 11:29:32.972620,,,,0,1,4,False,,
ChIJZzeRDkBZwokRODxBJ-bYauA,Skirt Steak,6a2de5352793f302e2ce5ae1376f1075,4,"Great atmosphere, but you have to wait in line because reservations are not possible. There is no menu and you have to make a decision directly at the table from the service staff. Very loud, so its not easy to understand everything acoustically... Overall, our dining experience was partly very good and partly not so good: There is only a pre-fixed menu with two price ranges ($39 or $69). You dont find out anything about the origin or weight of the steak in question... it tasted good, although it didnt contain much meat, but the worry of eating the cheapest hormonal meat clouded my joy (I didnt find out). Sauce, green salad and fries were super good! Ive rarely eaten such good fries, these are available with any second helping... The dessert, a strawberry cake, however, was expensive and had no flavor whatsoever. Side dish spinach (extra $12) very salty. I found the service unpleasantly pushy and condescending, and using the credit card not at the table but in a secluded corner wasnt ideal either. My conclusion: because of service and unclear origin: information about the food 1-2 points deducted.. In total",10 months ago,2023-05-02 11:29:32.974855,,,,0,7,,False,"Tolles Ambiente, man steht aber erst mal an, weil Reservieren nicht moglich ist. Es gibt keine Speisekarte und man muss sich direkt und sofort am Tisch beim Servicepersonal entscheiden. Sehr laut, deshalb ist es nicht einfach akustisch alles zu verstehen . Insgesamt waren wir beim Essen bei einer teils sehr guten teils weniger guten Erfahrung: Es gibt nur ein Pre fixed Menu mit zwei Preisklassen (39 oder 69 $). Man erfahrt nichts uber Herkunft und Gewicht des jeweiligen Steaks  geschmacklich war es gut, wenngleich wenig Fleisch, aber die Sorge billigstes Hormonfleisch zu essen hat meine Freude getrubt (ich hab es nicht herausgefunden). Sauce, gruner Salat und Pommes waren mega gut ! Selten hab ich so gute Pommes gegessen, diese gibt es mit beliebigen Nachschlag Das Dessert, eine Erdbeertorte hingegen teuer und ohne irgendeine Geschmacksrichtung. Side Dish Spinat (extra 12$) sehr salzig. Den Service fand ich unangenehm pushy und herablassend, Kreditkarte nicht am Tisch, sondern in einer uneinsehbaren Ecke zu verwenden auch nicht optimal. Mein Fazit: wegen Service und unklarer Herkunft:Informationen uber das Essen 1-2 Punkte Abzug.. Insgesamt",
ChIJZzeRDkBZwokRODxBJ-bYauA,Skirt Steak,b5b85b0442fa27462e4d764d049af41c,5,,10 months ago,2023-05-02 11:29:32.978444,,,,0,7,65,True,,
ChIJZzeRDkBZwokRODxBJ-bYauA,Skirt Steak,799047b78fde69f6134629a4ba9c436a,4,,10 months ago,2023-05-02 11:29:32.981670,,,,0,5,3,False,,
ChIJZzeRDkBZwokRODxBJ-bYauA,Skirt Steak,baa6660ccf25accc8538a5e511fd2cfd,5,"No clue guy was great! I have no clue what his name was but he came to us, told us the service and they make amazing streak, fries, and Long Island Ice Tea. I 100% recommend it.",10 months ago,2023-05-02 11:29:32.984692,,,,0,18,60,True,,
ChIJZzeRDkBZwokRODxBJ-bYauA,Skirt Steak,dc99241f587bcb667520849567ad2b96,4,,10 months ago,2023-05-02 11:29:32.990529,,,,0,24,1,True,,
ChIJZzeRDkBZwokRODxBJ-bYauA,Skirt Steak,cc1a707df89fb7c89c904bb5d59ae2ea,5,,10 months ago,2023-05-02 11:29:32.993219,,,,0,5,,False,,
ChIJZzeRDkBZwokRODxBJ-bYauA,Skirt Steak,2e21dad4aa3b10f09fe7d4ad68dbe826,5,great place. can get really crowded though,10 months ago,2023-05-02 11:29:32.995611,,,,0,4,,False,,
ChIJZzeRDkBZwokRODxBJ-bYauA,Skirt Steak,b062dabf7d0da46e0039bf80ba0daa8e,4,I went there with a group of 7. The skirt steak was cooked to perfection as it was juicy and tender. The butter sauce took to to other level when applied to the steak. The fries were crispy and fresh. One of my friend ordered the cauliflower steak which was surprisingly delicious as well. The salad was sadly disappointing and I personally didn t like it. Total for me was $62 after tax and tip.,10 months ago,2023-05-02 11:29:34.139657,,,,1,31,78,True,,
ChIJZzeRDkBZwokRODxBJ-bYauA,Skirt Steak,96d2e918986b14ef77312d573e4cb764,5,Best skirt steak I ve ever had and the sauce it comes with is heavenly. The unlimited fries is my favorite part. Salad is good too.,10 months ago,2023-05-02 11:29:34.143384,,,,0,42,15,True,,
