place_id,place_name,review_id_hash,rating,review_text,published_at,published_at_date,response_from_owner_text,response_from_owner_ago,response_from_owner_date,review_likes_count,total_number_of_reviews_by_reviewer,total_number_of_photos_by_reviewer,is_local_guide,review_translated_text,response_from_owner_translated_text
ChIJZzeRDkBZwokRODxBJ-bYauA,Skirt Steak,763168c2fd6122d4efee47f9d8d69f06,4,New concept for me it have a fixed menu and it was recommended by friend. The steak was small for my preference but it was tasty. The salad was normal nothing special and the fries were little too much and salty.,a year ago,2023-03-02 11:30:41.851833,,,,0,69,113,False,,
ChIJZzeRDkBZwokRODxBJ-bYauA,Skirt Steak,950e1933f83e79fd98a5017ed5c1412a,5,Out of this world excellent  svc..everyone so nice,a year ago,2023-03-02 11:30:41.854770,,,,0,632,15817,True,,
ChIJZzeRDkBZwokRODxBJ-bYauA,Skirt Steak,09d6578e25555450994ceaaf3310e485,5,Great for a steak night. Simply delicious! Food,a year ago,2023-03-02 11:30:41.858288,,,,0,53,222,True,,
ChIJZzeRDkBZwokRODxBJ-bYauA,Skirt Steak,fa4f9a4c6b8ad4dd32d04fc4a5b5ac91,5,,a year ago,2023-03-02 11:30:41.861652,,,,0,1,,False,,
ChIJZzeRDkBZwokRODxBJ-bYauA,Skirt Steak,62385bff0f6d5d57a0703bddacd2cc15,5,"We came on a Tuesday, after 5pm opening time.  No wait time.  Sat at the bar.   Thumbs up for the decor.  Clean exposed wood. T  at the bar is rocking,  2nd bartender a no show.  5   just for T One dish (bread, salad, skirt steak, and fries).. No sharing The skirt steak, choices are rare, medium, or well done. The fries are all you can eat.  Couldn t eat past a plate  skirt steak was juicy.  Although stuffed, couldn t pass on dessert.  The chocolate cake was  light and sweet.   If in NYC, stop by, worth it.",a year ago,2023-03-02 11:30:41.864046,,,,0,39,83,False,,
ChIJZzeRDkBZwokRODxBJ-bYauA,Skirt Steak,216b94cfce12bbc3c424682491e9bfab,1,"If a restaurant can t accommodate more than 14 people in a 15 min slot, literally what are you doing? We were trying to make reservations here as we really like their food (rushed service but still good for the price) and these people can t make changes to their  rule  for a Christmas family dinner of 17 ppl that is being requested WEEKS in advance  it s a shame but we ll take our business elsewhere.",a year ago,2023-03-02 11:30:43.063726,,,,0,2,,False,,
ChIJZzeRDkBZwokRODxBJ-bYauA,Skirt Steak,558615e43beac0f48662dc1c90d89e5a,1,"The only good part was the staff. They were really kind, thank you! But the steak has nothing special. You can eat much better steak in the city without paying 65 bucks. No worth it!",a year ago,2023-03-02 11:30:43.066109,,,,0,5,,False,,
ChIJZzeRDkBZwokRODxBJ-bYauA,Skirt Steak,a6de18d16aa1c269995ba0efc699f95c,4,"Steak was good, but like mediam rare, asked for medium and was a bit over.  May ask for rare next time and see.",a year ago,2023-03-02 11:30:43.070553,,,,0,73,11,True,,
ChIJZzeRDkBZwokRODxBJ-bYauA,Skirt Steak,e324a7c48961560ebaa17ce81d90b02e,5,"Really tasty steak, generous portions at a reasonable price.",a year ago,2023-03-02 11:30:43.076925,,,,0,31,22,False,,
ChIJZzeRDkBZwokRODxBJ-bYauA,Skirt Steak,3580988144fee7ea9e28c841cc1267ed,5,,a year ago,2023-03-02 11:30:43.081765,,,,0,38,113,True,,
ChIJZzeRDkBZwokRODxBJ-bYauA,Skirt Steak,a4b691acf485fb706def560d433964aa,5,"Skirt steak is amazing for meat and fries lovers exclusively. There is no diversity of options but the skirt steak is very good and the fries are delicious! The hazelnut dessert was also very good. Dont come at rush hour to avoid waiting in line for long (they dont take reservations). If possible, better to go on weekdays!",a year ago,2023-03-02 11:30:43.084893,,,,0,154,211,True,,
ChIJZzeRDkBZwokRODxBJ-bYauA,Skirt Steak,044ff79a8d8ddb5d648983db1bc8efb6,3,,a year ago,2023-03-02 11:30:43.087797,,,,0,49,1547,True,,
ChIJZzeRDkBZwokRODxBJ-bYauA,Skirt Steak,78187eadfeff3c4e8a1bdaf1a60a1444,5,,a year ago,2023-03-02 11:30:43.090849,,,,0,1,,False,,
ChIJZzeRDkBZwokRODxBJ-bYauA,Skirt Steak,2777b37e16e38fdecec353158a6525bb,5,"Very cool, worth the wait in line. ( if you are solo or a two top and do not wish to wait for a table the Host (Hostess) walks the line regularly, let them know you can eat at the bar and you will not have to wait in line if there is room at the bar). Awesome service and great drinks!",a year ago,2023-03-02 11:30:43.093051,,,,1,6,6,False,,
ChIJZzeRDkBZwokRODxBJ-bYauA,Skirt Steak,779b3ae9840e2e3d1f21aea3004b1dac,3,"Definitely overhyped. Not worth the wait. Got served cold fries, steak wasn t done as asked. Understand that the place is busy and staff is not able to do everything right, but expected more.",a year ago,2023-03-02 11:30:43.095622,,,,0,19,7,True,,
ChIJZzeRDkBZwokRODxBJ-bYauA,Skirt Steak,fd7a964cc3eface012b05f1c658eb74c,4,"Its a decent place for a quick meal. The line outside moved quickly and the servers inside are moving very quickly throughout the restaurant to take orders, replenish food or bring drinks. Prices are reasonable but options are limited and sides are overpriced (yes, even at $12 its too much). Overall the steak cook times were disappointing as there are only 3 options, but I fortunately was able to get mine closer to what I would usually want.",a year ago,2023-03-02 11:30:44.269931,,,,0,85,26,True,,
ChIJZzeRDkBZwokRODxBJ-bYauA,Skirt Steak,94cae1dd89453d1870b5a8df083db971,1,"Not great the steak was very small and only tasted of burnt meat, the only flavour was that of burnt meat nothing else. They also wouldnt cook it any other way than rare, medium or well done. The garlic bread was alright very tough and not enjoyable to fight through but tasted good. Overall I would not recommend this place, well maybe but only to someone I didnt like.",a year ago,2023-03-02 11:30:44.275160,,,,1,2,,False,,
ChIJZzeRDkBZwokRODxBJ-bYauA,Skirt Steak,a3a244528967248723d5d27ae96e4f2c,2,The only good thing about this spot is the steak and fries the drinks were subpar and the salad was abysmal,a year ago,2023-03-02 11:30:44.279025,,,,0,4,3,False,,
ChIJZzeRDkBZwokRODxBJ-bYauA,Skirt Steak,10e567ffca9f7dd34ff9bb819fdabf55,5,Food was delicious! the staff are very friendly.,a year ago,2023-03-02 11:30:44.282852,,,,0,2,,False,,
ChIJZzeRDkBZwokRODxBJ-bYauA,Skirt Steak,601a0fbf2f8727d56d0590486ebe09fd,3,,a year ago,2023-03-02 11:30:44.286682,,,,0,,,,,
ChIJZzeRDkBZwokRODxBJ-bYauA,Skirt Steak,97c243bef9fc5919180128858139eaa5,1,"Not worth it. Long line to get a table, bland fries, horrid sauce, a boring bowl of lettuce.  And even though we said yes when asked if we wanted dipping sauce for the fries, we never got it. The steak was ok, but nothing special. Absolutely not worth it.",a year ago,2023-03-02 11:30:44.290704,,,,1,4,,False,,
ChIJZzeRDkBZwokRODxBJ-bYauA,Skirt Steak,a917007ec83105c7b06b6a9e9237586d,5,"Delicious, perfectly done simple menu. Garlic bread, salad, medium-rare skirt steak with peppercorn sauce, bottomless crispy seasoned fries, and a cold beer!",a year ago,2023-03-02 11:30:44.293686,,,,0,47,56,True,,
ChIJZzeRDkBZwokRODxBJ-bYauA,Skirt Steak,7b00ee882eea0a893bdcd8279eb826cf,5,,a year ago,2023-03-02 11:30:44.296559,,,,0,3,,False,,
ChIJZzeRDkBZwokRODxBJ-bYauA,Skirt Steak,f7e9983298cf7ecb3b67c18ba7d459b3,4,"No line since we went for 6pm dinner, not sure I wouldve waited in line but did enjoy the steak and bottomless fries, very simple menu and straight forward food. Friends steak was overcooked. Only offer rare, medium and well done, we all went with medium. Great service and atmosphere, staff didnt try to rush us out. Decent selection of desserts.",a year ago,2023-03-02 11:30:44.298608,,,,0,92,146,True,,
ChIJZzeRDkBZwokRODxBJ-bYauA,Skirt Steak,9ad4d2948990a0b3687fbbcf8dc2fa94,5,"I loved their fries! Their steak was to my taste and the sauce that came with it went perfectly with the fries, which are arguably better than any other fries Ive tried. The salad was a bit meh, but it was just an appetizer anyway. Our fries took a little while to refill, but the waiter and busser were really attentive.",a year ago,2023-03-02 11:30:44.301408,,,,0,45,87,True,,
ChIJZzeRDkBZwokRODxBJ-bYauA,Skirt Steak,62dbcabb22a3f81336e489d185c33109,3,Fries cold        steak warm and garlic bread was served in a bag with no plate   and the time spent with no food after the salad was given is crazy.  Staff needs to be more attentive than only offer crunchy warm or cold fries . And a dinner for 2  yes I said 2 was ...$140 dollars . ..... and this was THEIR  FIRST IMPRESSION  GIVEN .   WILL SEE WHAT HAPPENS ON MY NEXT TRIP  .,a year ago,2023-03-02 11:30:45.322422,,,,0,46,,True,,
ChIJZzeRDkBZwokRODxBJ-bYauA,Skirt Steak,a19a58ae1eb65f6ad4670785884258ce,4,"We went around 6:25pm and were seated by 6:57. Service was fast the menu was simple. The salad was fresh and full of different lettuce, fresh herbs, onions and a creamy vinegarette.. the steak was perfect! So tender and juciy. The fries were slightly overdone and I feel like the oil needed to be changed. However, they have potential to be perfect. For dessert we had the Black Forrest cake and it was delicious. The ambiance was great the staff was friendly. Overall an awesome experience. I will dream about the steak.",a year ago,2023-03-02 11:30:45.325405,,,,0,11,91,False,,
ChIJZzeRDkBZwokRODxBJ-bYauA,Skirt Steak,501c3c14c84b5e1a40ce23f66ad7f7ef,5,,a year ago,2023-03-02 11:30:45.328185,,,,0,6,24,True,,
ChIJZzeRDkBZwokRODxBJ-bYauA,Skirt Steak,3a542c94241d0b2f0cf047cc140bfa0a,5,"This is a popular place for a reason. The service is top notch with constant care and general kindness. We went all out: garlic bread, a regular steak meal for me and the wagyu upgrade for my husband. Both our meals included an appetizer salad plus some seriously delicious fries to accompany the steaks. The cooks here know how to cook meat. This is among the best we ve had in a restaurant. Then there is the dessert. There is a dessert cart that abounds with sweet wonders. I had to choose two: the Paris-Brest and the Black Forest Cake. Oh my. What a brilliant finish for the meal.",a year ago,2023-03-02 11:30:45.330687,,,,0,350,1226,True,,
ChIJZzeRDkBZwokRODxBJ-bYauA,Skirt Steak,04a04fe15ec13f7def1590e4d2fbc170,3,Liked the concept and service but the steak was smaller than expected and the food didn t taste that good,a year ago,2023-03-02 11:30:45.333520,,,,0,115,84,False,,
ChIJZzeRDkBZwokRODxBJ-bYauA,Skirt Steak,a94b718582b77c55bfb1c95072502a4b,5,,a year ago,2023-03-02 11:30:45.337863,,,,0,38,,True,,
ChIJZzeRDkBZwokRODxBJ-bYauA,Skirt Steak,5fdb6f90b60c102c6e3254826f2161dc,5,,a year ago,2023-03-02 11:30:45.341985,,,,0,5,,False,,
ChIJZzeRDkBZwokRODxBJ-bYauA,Skirt Steak,be3159dbb4b6a5636ef6070f97e45336,5,,a year ago,2023-03-02 11:30:45.346286,,,,0,115,31,False,,
ChIJZzeRDkBZwokRODxBJ-bYauA,Skirt Steak,9cae37c4230f35ae2edeb36d2eee6da1,5,From the moment I heard about this place I thought to myself if they only serve one thing they better be the best at it and my god they are. Salad was the only mediocre thing we had. Garlic bread was life changing. The fries were SO good. The skirt steak was the 2nd best steak Ive ever ordered from a restaurant and the first best cost $150. I understand reviews that knock off stars for a long wait since they dont take reservations but we went on a Tuesday at 7pm and only had to wait for a table to be cleaned. HIGHLY RECOMMEND.,a year ago,2023-03-02 11:30:45.349672,,,,1,5,5,False,,
ChIJZzeRDkBZwokRODxBJ-bYauA,Skirt Steak,fc295d7a0217007439d440717b95896d,5,,a year ago,2023-03-02 11:30:45.352642,,,,0,5,1,False,,
ChIJZzeRDkBZwokRODxBJ-bYauA,Skirt Steak,79ba5595a34b3f8b1c9ae226db874852,1,Food is ok but the lady seating people is very un professional  and she is very ignorant  ..She should not be working Here.,a year ago,2023-03-02 11:30:46.430854,,,,0,3,,False,,
ChIJZzeRDkBZwokRODxBJ-bYauA,Skirt Steak,8e6918e6e3f2c9b3d162ed1dedf4fa1a,5,,a year ago,2023-03-02 11:30:46.433550,,,,0,37,10,True,,
ChIJZzeRDkBZwokRODxBJ-bYauA,Skirt Steak,f8d81ea87b1ef7d3ed341618de3e807a,4,"Place was good. Staff friendly. Limited menu was well prepared, but not great value for money. By the time we were done we could have eaten at Ruth Chris or a high end Brazilian steakhouse for less money.",a year ago,2023-03-02 11:30:46.438873,,,,0,47,5,True,,
ChIJZzeRDkBZwokRODxBJ-bYauA,Skirt Steak,ae08a419e22fd00016ecece8b38ac0bb,4,"Well executed simple menu. The steak melts in your mouth, the fries were crunchy with the right amount of salt and the dessert was delicious. You receive green salad, skirt steak and endless fries for $35. You can order additional sides and dessert at cost (We got the brussel sprouts with bacon and banana cream pie).",a year ago,2023-03-02 11:30:46.445657,,,,1,107,316,True,,
ChIJZzeRDkBZwokRODxBJ-bYauA,Skirt Steak,d2289aa708f6d746bb60dcb6f2870ca1,5,,a year ago,2023-03-02 11:30:46.451046,,,,0,18,1,True,,
ChIJZzeRDkBZwokRODxBJ-bYauA,Skirt Steak,18dc8be1d795f8ae274195c49179ca76,4,,a year ago,2023-03-02 11:30:46.453798,,,,0,59,8,True,,
ChIJZzeRDkBZwokRODxBJ-bYauA,Skirt Steak,d3368093aaf63909139b2b4b9d76b0d2,4,"OK, so I was there on a Saturday 12:30 pm, no line and pretty much empty, I guess because it was early, first the salad, there was too much dill, and the taste was off, the STEAK  was delicious, I had mine medium, it was melt in your mouth steak, the fries was tiny and alot, asking for more would be a bit too much, overall steak for 2, glass of wine, dessert and glass of soda $111.00.",a year ago,2023-03-02 11:30:46.456501,,,,0,126,83,False,,
ChIJZzeRDkBZwokRODxBJ-bYauA,Skirt Steak,16a2a3803080d1eb0c82bea46708bab4,5,,a year ago,2023-03-02 11:30:46.459732,,,,0,36,22,True,,
ChIJZzeRDkBZwokRODxBJ-bYauA,Skirt Steak,ee8c34f32dc120702a202b166a2fcc58,5,"The steak was nice and had this sauce that was succulent. Also, got the tater tots with jalapeno and it was tasty",a year ago,2023-03-02 11:30:46.462829,,,,0,19,18,True,,
ChIJZzeRDkBZwokRODxBJ-bYauA,Skirt Steak,80ddac2921ef6ea7974feb0dab460f90,5,I love this place be$t steak since tads steak house close,a year ago,2023-03-02 11:30:46.465724,,,,0,1,1,False,,
ChIJZzeRDkBZwokRODxBJ-bYauA,Skirt Steak,09477997ba5cb2923c80cddcd9ee5001,5,,a year ago,2023-03-02 11:30:47.886521,,,,0,34,3,False,,
ChIJZzeRDkBZwokRODxBJ-bYauA,Skirt Steak,efc025eb018dac1fddc7061d0ce56ad1,5,,a year ago,2023-03-02 11:30:47.888982,,,,0,14,,False,,
ChIJZzeRDkBZwokRODxBJ-bYauA,Skirt Steak,2176eb81ed4cd64429dc6dd15a1a885f,2,"Meat was tasty, but 40 dollars (including tax) is really excessive! You only get a bowl of lettuce and fries. Fries are unlimited.",a year ago,2023-03-02 11:30:47.892811,,,,0,6,,False,"Vlees was lekker, maar 40 dollar(inclusief tax) is echt overdreven! Je krijgt er alleen een bakje sla en friet bij. Friet is dan wel onbeperkt.",
ChIJZzeRDkBZwokRODxBJ-bYauA,Skirt Steak,badecfacde709d46f540a0dc1d570340,4,,a year ago,2023-03-02 11:30:47.896393,,,,0,15,55,True,,
ChIJZzeRDkBZwokRODxBJ-bYauA,Skirt Steak,bdf19fb2252c1d4ec7a35950e9c8c780,4,"Steak is great!! Room for improvement for the salad and fries (first round of fries was great, second round was somehow tasteless and a bit mushy). Room for improvement on the service also. But overall a great experience. We ll come back!",a year ago,2023-03-02 11:30:47.899946,,,,1,172,,True,,
ChIJZzeRDkBZwokRODxBJ-bYauA,Skirt Steak,01e1330f22f17113d296fb24c7b2c52a,1,this was a huge scam 35 dollars for a two gram steak and it was COAL. My mouth is burning from the unlimited salty fries.,a year ago,2023-03-02 11:30:47.902815,,,,0,1,,False,,
ChIJZzeRDkBZwokRODxBJ-bYauA,Skirt Steak,735ba4786fc7dccf15f4bcc1d49bfb3f,5,,a year ago,2023-03-02 11:30:47.905427,,,,0,243,1056,True,,
ChIJZzeRDkBZwokRODxBJ-bYauA,Skirt Steak,7cad9258f59f4a1011274069ad472102,3,"The meat portion is way too small, it was tasty tho.",a year ago,2023-03-02 11:30:47.908678,,,,0,5,,False,,
ChIJZzeRDkBZwokRODxBJ-bYauA,Skirt Steak,30fb07ed129cd7775633f487c5f3498f,5,"Excellent fixed priced dinner - salad, skirt steak and all you can eat fries = $35, great appetizers, desserts and drinks are extra. You usually have a short wait to get in as no reservation for parties under 6 but the wait is well worth it! Just tried it last Saturday and Ill definitely be back often! Though meals can be fast as they have the service down, I didnt feel rushed. If I was going to the theater I would definitely consider catching dinner at Skirt Steak!",a year ago,2023-03-02 11:30:47.911389,,,,0,14,57,True,,
ChIJZzeRDkBZwokRODxBJ-bYauA,Skirt Steak,f183830a176806358fb7c4d13854a706,4,,a year ago,2023-03-02 11:30:47.913981,,,,0,23,4,True,,
ChIJZzeRDkBZwokRODxBJ-bYauA,Skirt Steak,60c5ac39929e83376b015cafc42f499e,3,,a year ago,2023-03-02 11:30:48.709916,,,,0,7,,True,,
ChIJZzeRDkBZwokRODxBJ-bYauA,Skirt Steak,5faeb12e257df49d0094f54abdbb24ce,5,Excellent meat at a fair price!,a year ago,2023-03-02 11:30:48.714850,,,,0,8,,False,Carne ottima prezzo giusto!,
ChIJZzeRDkBZwokRODxBJ-bYauA,Skirt Steak,a246d0e6d08fc147019ab29140b0e7ed,5,"Was invited by friends to hang out and I really enjoyed it - 5/5 recommend. Good place to chill and hang out. The staff were super friendly and attentive. The food was delicious! We came on a Saturday afternoon and were able to get seated asap. Although, we did hear there would be a line to get seated and I could see why.",a year ago,2023-03-02 11:30:48.718621,,,,0,1,2,False,,
ChIJZzeRDkBZwokRODxBJ-bYauA,Skirt Steak,63a05ec6da47d8563670e9579693d557,4,"This place was new to me. Super cute, chilled atmosphere. The menu is very straight to the point, salad, skirt steak and unlimited french fries. 4 stars only because the steak was so good I wish the serving was a lil bigger... other then that I will definitely return.",a year ago,2023-03-02 11:30:48.721681,,,,0,26,3,True,,
ChIJZzeRDkBZwokRODxBJ-bYauA,Skirt Steak,70d5bb43dfaf20fe334369e39514968f,1,"The prix fixe is now $35 instead of $28, that s a 25% increase in less than a year! And nothing changed beside the line being shorter  . I don t think it s worth going anymore, this place was worth it for the price but now it s just expensive for what it is. If you re ok paying that price, then give it a try. Also please don t wait in line, it s not worth it.",a year ago,2023-03-02 11:30:48.726064,"Something did change: what we pay for the ingredients. We don t expect everyone to understand inflation at a time like this, but it s still a great value for the quality of ingredients we use and the amount of food received for the cost.",a year ago,2023-03-02 11:30:48.726064,2,47,217,True,,
ChIJZzeRDkBZwokRODxBJ-bYauA,Skirt Steak,a0fb8ff0061a3a2b207abeea598b1164,5,,a year ago,2023-03-02 11:30:48.729469,,,,0,1,,False,,
ChIJZzeRDkBZwokRODxBJ-bYauA,Skirt Steak,58d90c8b055515138eb34f07960fcc46,3,Meh. The portions were really small. Could ve a better dinner for the same price somewhere else. The service was the only good thing.,a year ago,2023-03-02 11:30:48.731645,,,,0,56,76,True,,
ChIJZzeRDkBZwokRODxBJ-bYauA,Skirt Steak,8c2c1c181d79ef843eb545dfbf7a7317,2,Not worth the hype.,a year ago,2023-03-02 11:30:48.734313,,,,0,61,3,True,,
ChIJZzeRDkBZwokRODxBJ-bYauA,Skirt Steak,df9a3efe269a3eaf96d0400ad9d1b8d5,4,"Saw this restaurant on tic tick so I decided to try it out the service overall was very good I bought two servings the steak, French fries and salad I ordered two drinks total was $91.46 (tip not included in this cost). It s a nice little spot staffs are very friendly. This restaurant is really a one time experience for me don t think I will go back though.",a year ago,2023-03-02 11:30:48.738030,,,,0,150,120,True,,
ChIJZzeRDkBZwokRODxBJ-bYauA,Skirt Steak,4d3a2e14c8dfb0ac3591bec447de5fd2,3,Maybe it was the overhype from social media. Maybe it was the increase in prices from when it opened this earlier this year. But I was a bit underwhelmed. Drinks were solid and that garlic bread was on point. Steak was fine but can only choose 3 temps and portions definitely were not filling (for me at least). Id rather spend extra and goto a real steakhouse. Service was much slower than I expected. I wouldnt go out of my way to go back or wait in a long line.,a year ago,2023-03-02 11:30:48.742312,,,,0,139,103,True,,
ChIJZzeRDkBZwokRODxBJ-bYauA,Skirt Steak,eb538b6820a74b50b350daf8b2a47d83,4,"$35 you get salad, steak and unlimited fries. The food overall is good but not great and you get decent worth for your money. One thing to note you get two pieces of steak on top of each other, the one above was cooked to perfection, however the one below was slightly over cooked because of the hot pan. We had to wait 25 mins on Saturday evening around 7PM, which the waiter mentioned is quick for Saturday generally much more busy. Recommend the place, however doubt I ll be visiting again anytime soon. 3.5/5",a year ago,2023-03-02 11:30:49.701102,,,,1,106,25,True,,
ChIJZzeRDkBZwokRODxBJ-bYauA,Skirt Steak,4b5c1375ff5f44a39c50d042526b868d,4,,a year ago,2023-03-02 11:30:49.706557,,,,0,27,460,True,,
ChIJZzeRDkBZwokRODxBJ-bYauA,Skirt Steak,9c8cb29f2fff4f6a815aff129a0558e5,4,"Did not have to wait long, as we got here about 30 mins before opening. The steak is a small portion it s was okay. Drinks are okay as well. Amazing desert was really the icing on the cake I sure did enjoy the chocolate cake and the banana cake as well.",a year ago,2023-03-02 11:30:49.712199,,,,0,62,22,False,,
ChIJZzeRDkBZwokRODxBJ-bYauA,Skirt Steak,f25e20856ba5cc2d60d407763c4fe0ab,4,,a year ago,2023-03-02 11:30:49.717115,,,,0,8,,False,,
ChIJZzeRDkBZwokRODxBJ-bYauA,Skirt Steak,cc683bb05f657aa646c913f1c8934065,4,Nice place. Not worth the wait time and line. Come back if they ever do reservations.,a year ago,2023-03-02 11:30:49.720030,,,,0,237,156,True,,
ChIJZzeRDkBZwokRODxBJ-bYauA,Skirt Steak,e61c306451165ca9fd6d7ad83350ee6e,5,,a year ago,2023-03-02 11:30:49.723641,,,,0,,,,,
ChIJZzeRDkBZwokRODxBJ-bYauA,Skirt Steak,2acf1c0204f9d9f70f73c4f55190f0e1,4,,a year ago,2023-03-02 11:30:49.725930,,,,0,23,2,True,,
ChIJZzeRDkBZwokRODxBJ-bYauA,Skirt Steak,d51c1621c36d9714af17cca13f515321,5,,a year ago,2023-03-02 11:30:49.728572,,,,0,5,12,False,,
ChIJZzeRDkBZwokRODxBJ-bYauA,Skirt Steak,41193f7e1715873354e84efec6c981c6,1,"I was going to write a review immediately after I came out from this place. My husband, a friend and I went to this place on Aug 12. We all had been wanting  to try this place for a while and that day was the day. So, a long line outside should be a good indicator, but once we were seated, the waiter gave us only the drunk list and start telling us in speed of a roadrunner of all items on the menu, not offering any other menu, not trying to tell us to look at the board above our table. Was he expecting us to remember the 1st item he mentioned when he finished his 15th items? Hellll no. He tried to upsell and maybe trying to use the confusion strategy to get peoplenot, mostly are tourists, to nod...get $$$$. Most importantly, if he had to talk that much trying to upset his items, he should have worn a mask. I know its not mandatory anymore for COVID. But there are other things beside COVID that come with the saliva. ....thats to me was the 1st red flag. So, we ended up getting their basic set. It started with the salad. A generous amount of salad which was unedible. We all had a bit or two and we put our fork down. It didnt look fresh. My husband and our friend said it was bitter. I said the veggies look old and the salad dressing is horrible. When the meat came with fries, the meat portion was smaller than what we expected, not like Les Venise steak house on Lexington. The fries was oily. So, we just finished the meat, paid and leave. Beside food, my husband ordered a coke, they brought Diet Coke. I normally would order an alcoholic drink and dessert when dinning out, but not this time. I dont feel like giving more money to support the poor services. I would give a 3 stars to one of the food runner...he did a great job in serving us and he should be promoted as a main waiter.",a year ago,2023-03-02 11:30:49.730894,,,,0,30,150,True,,
ChIJZzeRDkBZwokRODxBJ-bYauA,Skirt Steak,8b49d1903cc9048d49da19d7e72bbe5e,5,,a year ago,2023-03-02 11:30:49.733680,,,,0,2,,False,,
ChIJZzeRDkBZwokRODxBJ-bYauA,Skirt Steak,b2d235dcb3df624d36244a12569823e3,5,"Quality eats! Perfect steak, fries and drinks. Went here after a party and had great vibes. Top notch social media engagement too. Would come here with a big fun group.",a year ago,2023-03-02 11:30:50.585503,,,,0,312,428,True,,
ChIJZzeRDkBZwokRODxBJ-bYauA,Skirt Steak,a090b18db60ceeb66e9a423294e2c62c,4,"If you want a small but good quality piece of meat with fries and green salad for USD30, this is the place. The rest, everything is charged separately (even the bread). Excellent attention from the staff. You have to arrive at 5 p.m. to have a place in the restaurant, otherwise you can wait up to 60 minutes in line to enter.",a year ago,2023-03-02 11:30:50.588965,,,,0,17,17,False,"Si quieres un trozo de carne pequeno pero  de buena calidad con papas fritas y ensalada verde por USD30, este es el lugar. Lo demas, todo lo cobran aparte (hasta el pan). Excelente atencion del personal. Hay que llegar a las 17 hrs  para tener un lugar en el restaurant, de lo contrario puedes esperar hasta 60 min en la fila para entrar.",
ChIJZzeRDkBZwokRODxBJ-bYauA,Skirt Steak,4be0cd540923c3f433122edfc5d7ea4b,5,"Good value  30 dollar steak dinner if you dont  want to spend 90 bucks per person, The skirt steak meat cut is a little chewy but prepared to  order and tasty.",a year ago,2023-03-02 11:30:50.593101,,,,0,179,136,True,,
ChIJZzeRDkBZwokRODxBJ-bYauA,Skirt Steak,c5218b4dde4f71a28c28ca6829cd8436,4,,a year ago,2023-03-02 11:30:50.596407,,,,0,,,,,
ChIJZzeRDkBZwokRODxBJ-bYauA,Skirt Steak,b70af42e64d182eb74c18960ea2f1390,5,"Delicious, fast and efficient service.",a year ago,2023-03-02 11:30:50.598516,,,,0,9,,False,",               .",
