place_id,place_name,review_id_hash,rating,review_text,published_at,published_at_date,response_from_owner_text,response_from_owner_ago,response_from_owner_date,review_likes_count,total_number_of_reviews_by_reviewer,total_number_of_photos_by_reviewer,is_local_guide,review_translated_text,response_from_owner_translated_text
ChIJM3elBidawokRJKPC55N6pQI,Mei Lai Wah,216b854ecb41956175c1ad8b800cbea4,5,Best Roast Pork Buns in town! Order dimsun here as well.,an hour ago,2024-03-28 17:44:46.795169,,,,0,44,25,True,,
ChIJM3elBidawokRJKPC55N6pQI,Mei Lai Wah,c8412e93a276cdd4442562732b09a471,1,"There s a big pc meat bone in the roast pork buns I just ordered , which almost crashed my teeth. The quality of this restaurant is sadly going south nowadays ! Watch out your teeth  , it s my warning !",an hour ago,2024-03-28 17:44:46.804498,,,,0,1,1,False,,
ChIJM3elBidawokRJKPC55N6pQI,Mei Lai Wah,3e802f645e5d66278fe5f13c986e38cf,5,"Very nice! The buns are soft and full of meat, and the meat is flavorful and tender. Service is pretty fast and everything is really fresh.",2 hours ago,2024-03-28 16:44:46.808813,,,,0,13,25,True,,
ChIJM3elBidawokRJKPC55N6pQI,Mei Lai Wah,78befa6441ef4c1d4a92460fe873da35,4,"Great spot to grab cheap, delicious and fulfilling Chinese food. Its always so crowded so it loses points for service. I hope they can expand or have a way to deal with this crazy demand. All the items I had were great. Pineapple bun was great, all the buns were great. If you are going to get some rice/noodle roll be expected to wait around 15 mins. Everything else is instant.",2 hours ago,2024-03-28 16:44:46.813084,,,,0,137,73,True,,
ChIJM3elBidawokRJKPC55N6pQI,Mei Lai Wah,598ac7730ccd4d38fee74b2e2bf0e010,4,Very packed and good pineapple buns. The tea was nice and price was reasonable!,2 hours ago,2024-03-28 16:44:46.816795,,,,0,449,1164,True,,
ChIJM3elBidawokRJKPC55N6pQI,Mei Lai Wah,fca970a9a3adbb54f15c936be9f3d2df,5,Love their roast pork buns!,a day ago,2024-03-27 18:44:46.819836,,,,0,31,28,True,,
ChIJM3elBidawokRJKPC55N6pQI,Mei Lai Wah,fe40d0b371ef5d6c2ef48c7ca3e6de1f,5,,2 days ago,2024-03-26 18:44:46.823663,,,,0,4,20,False,,
ChIJM3elBidawokRJKPC55N6pQI,Mei Lai Wah,dab42393c077f9d498f01d040982aa26,4,"Signature pineapple roast pork buns - they came out nice and warm, and had a great crispy exterior. My only gripe was that the meat filling was too fatty for my liking. Be prepared to wait around 30+ mins as it gets very crowded",3 days ago,2024-03-25 18:44:46.826169,,,,0,58,,True,,
ChIJM3elBidawokRJKPC55N6pQI,Mei Lai Wah,92f23362f6dea69d23340aea26ed491b,5,,3 days ago,2024-03-25 18:44:46.828980,,,,0,2,,False,,
ChIJM3elBidawokRJKPC55N6pQI,Mei Lai Wah,cf317b82186419a346767b3d2720097f,3,"The combination steamed pork bun price got double but the bun got smaller at 1/3 less, less meat, they put more cabbage unlike the way they were before. Same with coconut bun, the price doubled and size got smaller.",4 days ago,2024-03-24 18:44:46.832327,,,,0,2,,False,,
ChIJM3elBidawokRJKPC55N6pQI,Mei Lai Wah,4859d9a390d503509e93a7def67b3714,2,"Although service was very quick, I went for roast pork buns based on reviews. The contents inside the pork bun was mostly FAT not pork and I caught food poisoning! Not saying this will be everyones experience this was just mine",4 days ago,2024-03-24 18:44:47.777094,,,,0,21,,True,,
ChIJM3elBidawokRJKPC55N6pQI,Mei Lai Wah,ae379bbbadb86c6445065fe7fe8d8a16,5,,4 days ago,2024-03-24 18:44:47.780413,,,,0,1,,False,,
ChIJM3elBidawokRJKPC55N6pQI,Mei Lai Wah,53e0c50c002ad7105676c97b009ee530,5,Super fresh tasty food!!! Great quick food stop,5 days ago,2024-03-23 18:44:47.782736,,,,0,13,2,False,,
ChIJM3elBidawokRJKPC55N6pQI,Mei Lai Wah,8d75d87a3f47c72692284d4ad504e702,5,Make sure to build in some extra time to recover emotionally if you get the pork buns. Simply delectable,5 days ago,2024-03-23 18:44:47.785809,,,,0,12,,False,,
ChIJM3elBidawokRJKPC55N6pQI,Mei Lai Wah,cc73393bc39575c7fb8cc8b3a318a0b3,5,"Quick, tasty, and simple!",5 days ago,2024-03-23 18:44:47.789052,,,,0,60,94,True,,
ChIJM3elBidawokRJKPC55N6pQI,Mei Lai Wah,2753cb83485cef6735a77cea5fcf707f,5,Phenomenal. The bolo chasiu bao is one of the best things I ve ever eaten,6 days ago,2024-03-22 18:44:47.792755,,,,0,7,10,False,,
ChIJM3elBidawokRJKPC55N6pQI,Mei Lai Wah,2230b8c7b0b6b2294e52660b3c19fb02,1,"Got sick the whole night after eating at this place. I don t recommend it. Plus the meat is just fat, I ve been pretty disappointed",a week ago,2024-03-21 18:44:47.796117,,,,0,1,,False,,
ChIJM3elBidawokRJKPC55N6pQI,Mei Lai Wah,0bad43459491c676ba29f8b4bd4fd5de,5,,a week ago,2024-03-21 18:44:47.798611,,,,0,3,,False,,
ChIJM3elBidawokRJKPC55N6pQI,Mei Lai Wah,0a4c8e42ba32652a84a8b1d23ec0d756,4,,a week ago,2024-03-21 18:44:47.800787,,,,0,5,,False,,
ChIJM3elBidawokRJKPC55N6pQI,Mei Lai Wah,982cf923c68e9d91f0165b198324a0d4,5,i go here every week,a week ago,2024-03-21 18:44:47.803076,,,,0,24,2,True,,
ChIJM3elBidawokRJKPC55N6pQI,Mei Lai Wah,22c5744106adbeed3e623c46fb57f098,5,"Excellent pork buns, but sometimes you get chunks of fat.",a week ago,2024-03-21 18:44:48.576834,,,,0,61,15,True,,
ChIJM3elBidawokRJKPC55N6pQI,Mei Lai Wah,09aec1dea00174b13b9ff45d65562fec,4,Love the crispy and sweet pineapple bun! Not a big fan of the filling though as it was rather greasy for me.,a week ago,2024-03-21 18:44:48.580664,,,,0,49,5,False,,
ChIJM3elBidawokRJKPC55N6pQI,Mei Lai Wah,b84013a9a3a810ff32f98d0f2ef6f40c,5,,a week ago,2024-03-21 18:44:48.584253,,,,0,43,1,True,,
ChIJM3elBidawokRJKPC55N6pQI,Mei Lai Wah,3a8b05c875702700c02e700375331abe,5,"I had the roast pork bun and the BBQ pork rice roll, both were delicious and cheap!",a week ago,2024-03-21 18:44:48.587472,,,,0,28,43,True,,
ChIJM3elBidawokRJKPC55N6pQI,Mei Lai Wah,4a852d91f2496a23af6d37dff3529017,5,Generous amount of meat as always! Amazing breakfast for cheap price! Real good! Always come back here!!,a week ago,2024-03-21 18:44:48.590908,,,,0,8,5,False,,
ChIJM3elBidawokRJKPC55N6pQI,Mei Lai Wah,793721cebacd1c2237420775aefb92c9,5,Love the pineapple pork bun! I always get em when I m in town.,a week ago,2024-03-21 18:44:48.594304,,,,0,3,4,False,,
ChIJM3elBidawokRJKPC55N6pQI,Mei Lai Wah,d8750cc35b74e29aaace773e54ec2a71,5,Fantastically good!,a week ago,2024-03-21 18:44:48.597752,,,,0,227,484,True,Fantastiskt gott!,
ChIJM3elBidawokRJKPC55N6pQI,Mei Lai Wah,ef9406002338d7009e84bcf2309db3eb,5,Literally the best buns I ve ever had!! Very affordable and the service is so quick!,a week ago,2024-03-21 18:44:48.601196,,,,0,145,149,True,,
ChIJM3elBidawokRJKPC55N6pQI,Mei Lai Wah,bac06f4cee6c59f1f53035b371c6efdb,2,Meat in pork buns is nearly tasteless and all fat. Not sure what everybody else is talking about.,a week ago,2024-03-21 18:44:48.604707,,,,0,9,2,False,,
ChIJM3elBidawokRJKPC55N6pQI,Mei Lai Wah,c0a7510c7f2d02242cc4e526e055be15,5,"The roasted pineapple pork bun was delicious and affordable. It is definitely on the sweeter side, so if you don t like sweet then try the steamed pork bun. Went on a rainy Tuesday afternoon and there was no wait :)",a week ago,2024-03-21 18:44:48.608018,,,,0,25,22,True,,
ChIJM3elBidawokRJKPC55N6pQI,Mei Lai Wah,60a1a8966be58f5d85d7009d3437d4f4,5,,2 weeks ago,2024-03-14 18:44:49.367398,,,,0,22,3,True,,
ChIJM3elBidawokRJKPC55N6pQI,Mei Lai Wah,cba2d9996233e47e391fd4aee3bff7fa,4,Good but they could do a better job of taking out some of the fat pieces,2 weeks ago,2024-03-14 18:44:49.370458,,,,0,18,19,False,,
ChIJM3elBidawokRJKPC55N6pQI,Mei Lai Wah,d55c39850c8351dbabdedf1be022d941,4,Pork bun was good,2 weeks ago,2024-03-14 18:44:49.373980,,,,0,26,30,True,,
ChIJM3elBidawokRJKPC55N6pQI,Mei Lai Wah,db55e9fae67d7def602bd14c19fad550,3,"Personally, as an Italian, I do not really understand the hype. I mean, it is an original concept with great prices but the taste of those buns is just completely unbalanced and felt kinda weird. It is a sweet bun with a thin sugary glaze with a sweet and sour filling with is really flavourful as itself. The problem is that the overall flavour seems to sweet, at least for me. Smiley quick and precise service raised a bit the review",2 weeks ago,2024-03-14 18:44:49.377194,,,,0,22,12,True,,
ChIJM3elBidawokRJKPC55N6pQI,Mei Lai Wah,6127d33444b9d369ac9e4cfdd0d50087,5,"Pork buns are out of this world. Everyone loves the pineapple bun, its good. But I prefer the regular pork buns, its less sweet. The buns here are soooo chewy and soft. Even warmed up in the microwave, it still had the same great bite.",2 weeks ago,2024-03-14 18:44:49.380005,,,,0,17,15,True,,
ChIJM3elBidawokRJKPC55N6pQI,Mei Lai Wah,846f4031ae8daf65a118d7fdc0aa7cab,5,,2 weeks ago,2024-03-14 18:44:49.383186,,,,0,16,143,False,,
ChIJM3elBidawokRJKPC55N6pQI,Mei Lai Wah,5d5d07f446678123f1bf1da3ff442d43,5,"The food was very tasty, and affordable. The pork buns are sooooooo good. Service was fast and the employees were friendly. Overall a nice, quick place to grab a bite to eat.",2 weeks ago,2024-03-14 18:44:49.386184,,,,0,2,,False,,
ChIJM3elBidawokRJKPC55N6pQI,Mei Lai Wah,3ab120f15d92c7ebbc6d49b878e01d7b,5,,2 weeks ago,2024-03-14 18:44:49.389389,,,,0,3,,False,,
ChIJM3elBidawokRJKPC55N6pQI,Mei Lai Wah,6be578d83e8b1123e60556146c20809a,4,,2 weeks ago,2024-03-14 18:44:49.392205,,,,0,,,True,,
ChIJM3elBidawokRJKPC55N6pQI,Mei Lai Wah,41560f1c694bb9cdf165687720f66e95,5,,2 weeks ago,2024-03-14 18:44:49.395116,,,,0,148,206,True,,
ChIJM3elBidawokRJKPC55N6pQI,Mei Lai Wah,35595ea4483f3afa3128a1d165cd1bec,5,"Got to know about the baked roast pork bun thru my nephew, so I went to Chinatown (nyc) looking for the shop and found it and got me a lot of them, I also got the pineapple bun with roast pork which looks delicious!. It s a super tiny place ( and you know what they say about tiny places..best everything ) no seats   you ask and you leave and eat it somewhere. 3 star for service .. those women are not that friendly but hey! You can t go without the merchandise for it is that good   otherwise I ll leave  letting them know what they are going to die of!     and 3 star for atmosphere cause too tiny it gets crowded like hell.. if you go by 8-9 am is heaven! Otherwise endure it and get your buns  . I have posted a review on MEI LAI WAH NOODLES BAR as well. Don t know if they are the same owners or different ones but they have the same name . The noodles are on Pell St. ENJOY!",3 weeks ago,2024-03-07 18:44:50.179372,,,,0,2,2,False,,
ChIJM3elBidawokRJKPC55N6pQI,Mei Lai Wah,84538a088782aae2bd37aa1a6ae31fa2,4,Pineapple pork bun - 4/5 - Excellent value for money. Theres a lot of meat in it and its really delicious! Shrimp dumpling - 3/5 - Average taste,3 weeks ago,2024-03-07 18:44:50.183630,,,,0,39,6,False,,
ChIJM3elBidawokRJKPC55N6pQI,Mei Lai Wah,1bdfc335d0d6d62f6e1a25b228094ca0,5,The pork buns were so good!!! Super tasty and flavorful! I got like 6 and the price was great!,3 weeks ago,2024-03-07 18:44:50.187521,,,,0,2,,False,,
ChIJM3elBidawokRJKPC55N6pQI,Mei Lai Wah,379d3269f42817b1c25d02c563af0495,5,,3 weeks ago,2024-03-07 18:44:50.191578,,,,0,4,159,True,,
ChIJM3elBidawokRJKPC55N6pQI,Mei Lai Wah,cfb5a6ef7d3dff99a1a7d108df44a668,5,"Fast and efficient service, very good food. For those who want to learn more about Chinese cuisine, this place is highly recommended. Wonton, bun, dumplings and etc. Everything can be found there. Also noteworthy is the impeccable cleanliness of the place, considering that the kitchen is visible to customers.",3 weeks ago,2024-03-07 18:44:50.195490,,,,0,291,1175,True,"Atendimento rapido e eficiente, comida muito boa. Pra quem deseja conhecer mais da culinaria chinesa, esse lugar e super indicado. Wonton, bun, dumplings e etc. Tudo pode ser encontrado ai. Destaque, ainda, para a limpeza do local, impecavel, considerando que a cozinha fica a vista dos clientes.",
ChIJM3elBidawokRJKPC55N6pQI,Mei Lai Wah,9c06eafd6c12006e767a114471e25b7a,5,Tolerating the bad attitude and laziness with which they serve you is worth it because the food is very good so my 5 stars are because of the food but for the service I would give a minus -3 stars.,3 weeks ago,2024-03-07 18:44:50.199337,,,,0,11,1,False,,
ChIJM3elBidawokRJKPC55N6pQI,Mei Lai Wah,b08b1cbd95ebf123ff7c3fb7b2d157a0,4,"Pineapple pork buns are good. Nice flaky crust. Salty, sweet. Nice meaty texture. Their other stuff is average. Take out only. They need a larger awning so that people can eat under it.",3 weeks ago,2024-03-07 18:44:50.203054,,,,0,361,435,True,,
ChIJM3elBidawokRJKPC55N6pQI,Mei Lai Wah,ce59f508ba24f8b121b6f34925ae629e,5,"The pork and pineapple bun + pork bun were both so, SO good! No seating is available, so be prepared to stand outside.",3 weeks ago,2024-03-07 18:44:50.207179,,,,0,32,19,True,,
ChIJM3elBidawokRJKPC55N6pQI,Mei Lai Wah,801015ede7d4e0781cdc338408de6339,5,Pretty popular place. My wife love it. The meat is a bit too sweet for me but that s about personal preferences.,3 weeks ago,2024-03-07 18:44:50.210677,,,,0,10,1,False,,
ChIJM3elBidawokRJKPC55N6pQI,Mei Lai Wah,6d4ba1e3de7e254d87d98ee5a8b5e7df,5,Pork bun is the best and so tasty Shumai taste good Affordable Food : 5/5,3 weeks ago,2024-03-07 18:44:50.214028,,,,0,21,64,True,,
ChIJM3elBidawokRJKPC55N6pQI,Mei Lai Wah,a0b069deab2a72e5c1b5736dfce22174,5,"Tried the infamous pineapple and roasted pork bun and I now know why it is so famous. Its so good, fresh and juicy. Ill definitely go there again",3 weeks ago,2024-03-07 18:44:51.009782,,,,0,36,131,True,,
ChIJM3elBidawokRJKPC55N6pQI,Mei Lai Wah,ae8dae57f9d0e4995fd4e323c04b60f8,5,"It s a must visit place, I was not sure about trying the pineapple pork bun but I did give it a try and mann it was perfect I even went to same place again just for eating that!",3 weeks ago,2024-03-07 18:44:51.014796,,,,0,21,36,True,,
ChIJM3elBidawokRJKPC55N6pQI,Mei Lai Wah,e9dcda66a41aeebad3afa226a0c68bb8,5,"Paid for a steamed bun and baked bun. Together it was around $5 something. Good taste, good texture. Not gummy and chewy but firm and fluffy. Use the kiosk and the beat the line.",4 weeks ago,2024-02-29 18:44:51.019292,,,,1,1,1,False,,
ChIJM3elBidawokRJKPC55N6pQI,Mei Lai Wah,e7bf59c12024aa7c7fe55d662b2e5857,4,,4 weeks ago,2024-02-29 18:44:51.022384,,,,0,166,1627,True,,
ChIJM3elBidawokRJKPC55N6pQI,Mei Lai Wah,82a49d082fa2c459fcdb590e09e42ec6,5,"Alas, with Hop Shing gone, Mei Lai Wah is now the undisputed char siu bao king of Chinatown. Big fatty, fully stuffed baos is what you get. Get two or three and you can be big, fat and fully stuffed too.",a month ago,2024-02-28 18:44:51.026016,,,,0,60,95,True,,
ChIJM3elBidawokRJKPC55N6pQI,Mei Lai Wah,9650a018bb6db910555071dcefca3798,5,"I went on purpose to try the meat bun, it was very good and it cost $1.95 for the super small place and the line was impressive",a month ago,2024-02-28 18:44:51.030309,,,,0,23,38,True,"Fui adrede a probar el bollo de carne,estaba muy bueno y costaba 1,95 dolares el local super pequeno y la cola impresionante",
ChIJM3elBidawokRJKPC55N6pQI,Mei Lai Wah,3c5ec291c8436a42873b8d5d8b77679e,5,,a month ago,2024-02-28 18:44:51.035011,,,,0,,,,,
ChIJM3elBidawokRJKPC55N6pQI,Mei Lai Wah,691dd595a6d5fe56fcc10fb89c0929f5,4,,a month ago,2024-02-28 18:44:51.037625,,,,0,2,,True,,
ChIJM3elBidawokRJKPC55N6pQI,Mei Lai Wah,ea9d0c1c9ed0101a76ad2d741778f4f9,3,,a month ago,2024-02-28 18:44:51.041417,,,,0,71,1278,True,,
ChIJM3elBidawokRJKPC55N6pQI,Mei Lai Wah,1e4b5fed5b8846d67f2769ac2e263ddb,5,"Since this place has blown up due to some viral videos, be prepared for at least a 20-30 minute wait. Also, be prepared to be yelled at by the owners of the surrounding businesses, the line blocks their store fronts, and Mei Lai Wah needs to manage the line better to prevent this from happening. The buns are absolutely divine. The breading is just so YUM! Its absolutely worth the wait! Its super affordable as well.",a month ago,2024-02-28 18:44:51.044955,,,,0,146,157,True,,
ChIJM3elBidawokRJKPC55N6pQI,Mei Lai Wah,d42f88aa913fe881cfee6024a0c22160,1,"only fat, we threw away the 3, there are much better elsewhere, I advise against it",a month ago,2024-02-28 18:44:51.992032,,,,0,12,4,False,"que du gras, on a jete les 3, il y a bien meilleur ailleurs, je vous deconseille",
ChIJM3elBidawokRJKPC55N6pQI,Mei Lai Wah,6c758758d097eae2763c2b189a912286,5,,a month ago,2024-02-28 18:44:51.996862,,,,0,6,,False,,
ChIJM3elBidawokRJKPC55N6pQI,Mei Lai Wah,696c47e138a3ac5fe2c4e8c0f0357c25,5,,a month ago,2024-02-28 18:44:52.000758,,,,0,27,12,False,,
ChIJM3elBidawokRJKPC55N6pQI,Mei Lai Wah,f91dbf070fc69ec4d59fa144cb1720b3,4,,a month ago,2024-02-28 18:44:52.004148,,,,0,64,70,True,,
ChIJM3elBidawokRJKPC55N6pQI,Mei Lai Wah,449307a21426b486f9c46bb03cde1e91,5,"The absolutely best Roast Pork Bun I have ever eaten. I ordered two and left, they were so delicious, I went back for two more.  There is usually a long line, but it goes very quickly. You can order at the cashier or there are two computer screens inside to order from, very easy.  There is no parking in front, very difficult to park.  I highly recommend stopping here for a bite to eat.   I will definitely go back again.",a month ago,2024-02-28 18:44:52.008318,,,,0,352,3327,True,,
ChIJM3elBidawokRJKPC55N6pQI,Mei Lai Wah,25fae31fc9154abc6d0fa4ee912a34f6,5,The 8th Wonder of the World,a month ago,2024-02-28 18:44:52.012412,,,,0,118,97,True,,
ChIJM3elBidawokRJKPC55N6pQI,Mei Lai Wah,0553f5ff5ec711353e9d6288b3041c0f,5,"Extremely crowded. Dont wait in the long line. If you have cash you can go right to the inside and order. Also there are 2 more kiosk right inside the door. The pineapple bum was good, but the Sam wai was amazinggggg.",a month ago,2024-02-28 18:44:52.016677,,,,0,18,31,True,,
ChIJM3elBidawokRJKPC55N6pQI,Mei Lai Wah,8552e09bc57611598942380640305443,5,,a month ago,2024-02-28 18:44:52.020567,,,,0,2,,False,,
ChIJM3elBidawokRJKPC55N6pQI,Mei Lai Wah,40600a57ab90e395af775417c553c945,5,,a month ago,2024-02-28 18:44:52.023697,,,,0,158,215,True,,
ChIJM3elBidawokRJKPC55N6pQI,Mei Lai Wah,d7175d0db2f63d08bf4aaa5916d3f07d,1,"This place bun used to be so good. Now, the meat inside is all fat. Cant believe people in the line and pay $2 for this.",a month ago,2024-02-28 18:44:52.026792,,,,0,1,1,False,,
ChIJM3elBidawokRJKPC55N6pQI,Mei Lai Wah,7f2e446e4a5932e3336a28878653e07b,3,,a month ago,2024-02-28 18:44:52.807674,,,,0,94,140,True,,
ChIJM3elBidawokRJKPC55N6pQI,Mei Lai Wah,58816690840634239763efd12d6df24d,5,The pineapple pork buns are so yummy and cheap. You can skip the long line usually if u pay cash and order inside. Although sometimes the kiosk orders seem to come out pretty quick too but you save a little on the card fee by using cash,a month ago,2024-02-28 18:44:52.812571,,,,0,10,4,True,,
ChIJM3elBidawokRJKPC55N6pQI,Mei Lai Wah,c8aafc4568b6d3dd3abf79ee25d4d208,5,,a month ago,2024-02-28 18:44:52.817456,,,,0,361,632,True,,
ChIJM3elBidawokRJKPC55N6pQI,Mei Lai Wah,0d6d9116ef8eff3eb8e97deed608bbef,5,,a month ago,2024-02-28 18:44:52.822001,,,,0,146,45,True,,
ChIJM3elBidawokRJKPC55N6pQI,Mei Lai Wah,e6f639ba5b516be03184c1e7f2bbeff9,5,We ordered some pineapple bun with pork and it was delicious! The line was long but there s a kiosk outside to order (which I highly recommend bc I feel like that was faster than ordering inside). The kiosk is card only so be mindful of that. We wanted to try out the pineapple bun with the custard inside but it was sold out sadly. Will definitely stop by again!,a month ago,2024-02-28 18:44:52.825630,,,,1,159,265,True,,
ChIJM3elBidawokRJKPC55N6pQI,Mei Lai Wah,60354221345543e5e3c74376e6a03770,5,,a month ago,2024-02-28 18:44:52.829341,,,,0,32,872,True,,
ChIJM3elBidawokRJKPC55N6pQI,Mei Lai Wah,3f3551b2a101a44d1b2b1f084cbc7b1b,4,,a month ago,2024-02-28 18:44:52.832907,,,,0,15,,True,,
ChIJM3elBidawokRJKPC55N6pQI,Mei Lai Wah,48e49ce2d13bb3e1df84245dd9f88846,5,Quick service and great prices. The pork buns were tasty,a month ago,2024-02-28 18:44:52.836539,,,,0,88,21,True,,
ChIJM3elBidawokRJKPC55N6pQI,Mei Lai Wah,d9abeab7fde209e8ed1fe1e155a29941,5,Great takeaway bakery with pork and other lovely buns.,a month ago,2024-02-28 18:44:52.840296,,,,0,502,684,True,,
ChIJM3elBidawokRJKPC55N6pQI,Mei Lai Wah,0f4a83c570bfe9f7dde839b7ba2e2a89,5,,a month ago,2024-02-28 18:44:52.843813,,,,0,8,6,False,,
ChIJM3elBidawokRJKPC55N6pQI,Mei Lai Wah,6d04f241e52a1412fd82dbbee817471e,5,,a month ago,2024-02-28 18:44:53.624362,,,,0,1,,False,,
ChIJM3elBidawokRJKPC55N6pQI,Mei Lai Wah,cb6d0ed1671872ed841c5987ff389121,3,"Mmmkay, usually Everytime id try this place there s a long line. But today at around 11 am there was no line outside so I was like here s my chance!! Finally! well inside was tiny and chaotic..people literally walking all over eachother. The staff were very fast which was good. Over all, not a pleasant ordering or dining experience. I ordered the famous pineapple pork bun the pineapple bun itself is DIVINE!!!! sweet flaky and one of a kind..one I hadn t had before. So that gets a 10/10. But despite the Pork sauce was delicious- the pork was mainly chunks of fat!!! I spit out most of it has it actually been meat? Would have been 10/10 for the whole thing. Overall will not come here again but dang was that pineapple bun amazing",a month ago,2024-02-28 18:44:53.629297,,,,0,16,9,True,,
ChIJM3elBidawokRJKPC55N6pQI,Mei Lai Wah,6f78906a015fe6d214c02e979292dd3a,3,,a month ago,2024-02-28 18:44:53.633356,,,,0,26,30,True,,
ChIJM3elBidawokRJKPC55N6pQI,Mei Lai Wah,2f62b7665a3602fad475a0bd13aa2dcc,5,always loved this place the best pork buns,a month ago,2024-02-28 18:44:53.637511,,,,0,12,9,False,,
ChIJM3elBidawokRJKPC55N6pQI,Mei Lai Wah,1cf45d7b64b219448e8cb4c18ed96b0c,5,,a month ago,2024-02-28 18:44:53.641880,,,,0,4,,False,,
ChIJM3elBidawokRJKPC55N6pQI,Mei Lai Wah,f2e6a4bd937e261cf955e2c918805962,5,,a month ago,2024-02-28 18:44:53.644550,,,,0,3,2,False,,
ChIJM3elBidawokRJKPC55N6pQI,Mei Lai Wah,dc70c03e28159a60834c378a0590734b,5,Got a pork bun here and it was SO GOOD. Easily the best Ive ever had. So melt in your mouth. Totally worth trying.,a month ago,2024-02-28 18:44:53.648298,,,,0,8,,True,,
ChIJM3elBidawokRJKPC55N6pQI,Mei Lai Wah,1369f5c87778f6ec0f6f1eda3c65c59c,5,"Best pineapple pork buns around, pay with cash and skip the line",a month ago,2024-02-28 18:44:53.652226,,,,0,23,14,True,,
ChIJM3elBidawokRJKPC55N6pQI,Mei Lai Wah,97de9e8665bd898b91273a2fea168cca,5,Pineapple pork bun is amazing! So is the roast pork bun. Line moves fast.,a month ago,2024-02-28 18:44:53.656595,,,,0,12,2,False,,
ChIJM3elBidawokRJKPC55N6pQI,Mei Lai Wah,8b0ac102f11fea13f7c87bf0fd18925e,5,I gotta say if you re in CHINATOWN YOU NEED TO STOP HERE!! Pineapple pork buns for $2.50 are not only cheap but taste amazing. Worth the wait in line I promise you ! Parking: Go with someone so you don t have to struggle with finding parking!!!,a month ago,2024-02-28 18:44:53.660026,,,,0,6,5,False,,
ChIJM3elBidawokRJKPC55N6pQI,Mei Lai Wah,d0197c5dfc43ebff87c24f90fb8bbaad,5,I paid with cash and didnt have to wait in the long line.,a month ago,2024-02-28 18:44:54.663876,,,,0,16,336,True,,
ChIJM3elBidawokRJKPC55N6pQI,Mei Lai Wah,1bd29f917ca5da1aa9e1950f4dd2df8b,5,,a month ago,2024-02-28 18:44:54.669016,,,,0,1,,False,,
ChIJM3elBidawokRJKPC55N6pQI,Mei Lai Wah,653e64beec8a1cb410284c15e3c78494,5,,a month ago,2024-02-28 18:44:54.673572,,,,0,13,502,True,,
ChIJM3elBidawokRJKPC55N6pQI,Mei Lai Wah,4a2e3614a34e6cab799b32fbd32fe09a,5,Many vegetarian options and yummy pineapple buns! We went on LNY and had to wait around thirty mins to order but was worth it and good price (:,a month ago,2024-02-28 18:44:54.677071,,,,0,122,418,True,,
ChIJM3elBidawokRJKPC55N6pQI,Mei Lai Wah,88c75ca5f3dfc2b83531975b97b636d1,5,Pork bun is our favorite,a month ago,2024-02-28 18:44:54.680848,,,,0,63,379,True,,
ChIJM3elBidawokRJKPC55N6pQI,Mei Lai Wah,73a327cde322b74568a89a57e89f53ef,2,"They seemed super busy and it took a while just to get a few pork buns that I preordered for pickup. The fat in every pork bun was gross but the sauce they used with it was tasty. It would be so much better if they used lean meats but the texture of the fat is disgusting. The pineapple pork bun was the best.. but I had to remove the filling because there was way too much fat. The big bun was the worst.. it says the filling contains chicken, pork, and egg but there s this random dark chunk of mystery meat.. My cat won t even eat the filling inside these buns. Good bread though.",a month ago,2024-02-28 18:44:54.684345,,,,1,4,1,False,,
ChIJM3elBidawokRJKPC55N6pQI,Mei Lai Wah,4596af00894c275dfe6a1e3968f4b463,5,The buns are worth the hype and worth the wait! My only complaint (which doesnt affect my rating because I came for the buns which were excellent!) is the congee with chicken. The flavor was tasty but what I ordered wasnt good because it wasnt actual chicken but some kind of flavored substitute. I wasnt expecting the not-real consistency so it threw me off. I would not order it again and instead I would get more buns!,a month ago,2024-02-28 18:44:54.688267,,,,0,2,,False,,
ChIJM3elBidawokRJKPC55N6pQI,Mei Lai Wah,db971cfef854024832c7b4f3c60625be,4,,a month ago,2024-02-28 18:44:54.691785,,,,0,107,5,False,,
ChIJM3elBidawokRJKPC55N6pQI,Mei Lai Wah,7ca518d7784fe2b4746c3bf7e8942029,4,,a month ago,2024-02-28 18:44:54.694474,,,,0,11,6,True,,
ChIJM3elBidawokRJKPC55N6pQI,Mei Lai Wah,f154fee6c46f6a6743f525e761e66734,4,,a month ago,2024-02-28 18:44:54.697171,,,,0,2,,False,,
ChIJM3elBidawokRJKPC55N6pQI,Mei Lai Wah,10dc050cc3e21818d97489fed99a8c68,5,The roast pork bun and pineapple pork bun are absolutely amazing. Incredibly efficient even with the long lines,a month ago,2024-02-28 18:44:55.422393,,,,0,38,15,True,,
ChIJM3elBidawokRJKPC55N6pQI,Mei Lai Wah,6b051ffabadb7479e4f4490a5b39a530,5,,a month ago,2024-02-28 18:44:55.427526,,,,0,6,,False,,
ChIJM3elBidawokRJKPC55N6pQI,Mei Lai Wah,72ba8060c73c14197b1e3482b2b320f5,5,,a month ago,2024-02-28 18:44:55.430774,,,,0,109,21,True,,
