place_id,place_name,review_id_hash,rating,review_text,published_at,published_at_date,response_from_owner_text,response_from_owner_ago,response_from_owner_date,review_likes_count,total_number_of_reviews_by_reviewer,total_number_of_photos_by_reviewer,is_local_guide,review_translated_text,response_from_owner_translated_text
ChIJM3elBidawokRJKPC55N6pQI,Mei Lai Wah,27f98317246dbcc2f7d0069c2ab1f19e,3,,8 months ago,2023-07-28 18:45:30.286686,,,,0,29,82,True,,
ChIJM3elBidawokRJKPC55N6pQI,Mei Lai Wah,5bce56ae881bcec3c6da3c2431f90c25,5,"If youre looking for a tasty bite in Chinatown, you cant go wrong with Mei Lai Wah. They have a huge menu with all kinds of yummy dishes, like rice noodles, dim sum, dumplings, shumai, and more. But the star of the show is their pineapple pork buns. They are so soft and sweet, with a juicy filling that melts in your mouth. Trust me, youll want to order a dozen of them. Dont worry about the long line outside, it moves fast and the staff is friendly and efficient. Mei Lai Wah is a must-stop for anyone who loves good food and good vibes.",8 months ago,2023-07-28 18:45:30.290739,,,,0,52,1275,True,,
ChIJM3elBidawokRJKPC55N6pQI,Mei Lai Wah,df4b241c320b65bb7c8bc3f1cfcd39a7,1,"I dont know why they have good reviews. The food was so bad, the duck was disgusting, and that duck had days there because of the flavor and texture, even the duck had feathers, The mushrooms no way!!!... simple NO GOOD FOOD AT ALL!",8 months ago,2023-07-28 18:45:30.294495,,,,1,50,41,True,,
ChIJM3elBidawokRJKPC55N6pQI,Mei Lai Wah,a5eaca13ce27244dd4972a499a8aa5bb,5,Best Roast Pork bun ever! They just need to improve with the customer service.,8 months ago,2023-07-28 18:45:30.298406,,,,0,79,,False,,
ChIJM3elBidawokRJKPC55N6pQI,Mei Lai Wah,15fd1a40a713a4fd068750d109ed96b5,5,Pineapple buns are goated,8 months ago,2023-07-28 18:45:30.301849,,,,0,1,,False,,
ChIJM3elBidawokRJKPC55N6pQI,Mei Lai Wah,1d24814b5abe1d78786a588fa4eb868c,5,,8 months ago,2023-07-28 18:45:30.305107,,,,0,168,6,True,,
ChIJM3elBidawokRJKPC55N6pQI,Mei Lai Wah,580e33b268ecaa858f5fbdd8e66c1085,5,"I have never seen the concept of a pork bun with pineapple bread before until now. I have to say.. it s really good. The way they combined the two concepts with the mastering of the flavor makes the bun so delicious. I went back to the restaurant multiple times for their pork pineapple buns and every time they live up to the standards. I definitely would recommend giving it a try, it s not overrated, it deserves the reputation and recognition.",8 months ago,2023-07-28 18:45:30.308162,,,,0,77,14,True,,
ChIJM3elBidawokRJKPC55N6pQI,Mei Lai Wah,a0517ec61c55e6e8cba521e8a1e11454,5,Visiting NYC and had to try the pineapple bun with roast pork. Everyone said to go here and they were right!!!! SOOOO GOOOOOD!!! There is a lot of pork filling and you can taste the sweetness from the crust on-top. You definitely need to get this bun!!!,8 months ago,2023-07-28 18:45:30.311163,,,,0,317,969,True,,
ChIJM3elBidawokRJKPC55N6pQI,Mei Lai Wah,8e91a80366a4eab2c909db463703ee5d,3,The pork bun are Too Fatty!!!!! On average theres 10+ large pieces of fatty meat in every bun which I have to take out. Everything else about the bun is excellent.  I just cant stand loads of these fatty meat in every bun..totally killed it for me for otherwise an exceptional pork bun.,8 months ago,2023-07-28 18:45:31.088209,,,,1,25,6,True,,
ChIJM3elBidawokRJKPC55N6pQI,Mei Lai Wah,0b90f53a03baafe9b60f9099c20180df,5,,8 months ago,2023-07-28 18:45:31.093068,,,,0,5,,True,,
ChIJM3elBidawokRJKPC55N6pQI,Mei Lai Wah,d80e83a0c8c8fc67a3f4afffe1907641,5,Such good buns! Cannot recommend enough.,8 months ago,2023-07-28 18:45:31.096920,,,,0,20,3,False,,
ChIJM3elBidawokRJKPC55N6pQI,Mei Lai Wah,a333c3d5f919902a5efd59e332988446,5,"A wide variety of frozen, fresh and retort packed vegan food.  The frozen packs from Taiwan are delicious.  Fussy grandchildren gobble this stuff up.",8 months ago,2023-07-28 18:45:31.100990,,,,0,111,9,False,,
ChIJM3elBidawokRJKPC55N6pQI,Mei Lai Wah,6a2526e23f8ad8f66d26b487a2c8b363,5,"I came there 3 times with my friend and all I have to say is that they have the best pork buns in Chinatown. Definite spot for baked buns and their specialty pineapple buns for cheap. Great spot, and easy access to multiple subway lines.",8 months ago,2023-07-28 18:45:31.104746,,,,1,3,,False,,
ChIJM3elBidawokRJKPC55N6pQI,Mei Lai Wah,77e57960913697665c485ec7d66bb2bd,4,"I think I understand the hype, but I m not sure I will stand in line again. The pineapple bun with roasted pork has a bun that s as good as it gets. Some other bakeries in Chinatown offer pineapple buns of the same quality, but not as consistently, because you really ever only want a freshly baked crunchy topping. The ever busy Mei Lai Wah easily offers that. The roasted pork filling I liked much less. It was at least 70% fatty, and the sauce and my concern for my cholesterol were so overpowering that I couldn t really properly enjoy the excellently baked bun itself. Overall, it is less than the sum of its parts. The egg yolk bun was just OK, and shouldn t be anyone s reason for waiting any amount of time in line. Also, it s worth nothing that the line is as long as it is, just because people take their time to order at the kiosk, not entirely sure what they want. You can always just order on Snackpass to skip the line.",8 months ago,2023-07-28 18:45:31.108345,,,,0,45,286,True,,
ChIJM3elBidawokRJKPC55N6pQI,Mei Lai Wah,43908dcfafde1cf952217596e08bd3b8,5,"I specifically came here to try the pineapple bbq pork bun, and mannnn it didn t disappoint. I ve never had the one with the pineapple before. I ve only had the regular baked and steamed pork bun at other places. It was AMAZING. I ordered at the touch screen to the left of the door and waited for them to call my name out. It was pretty quick. The line to order was about 5 mins and then waiting for the order was another 5-10 mins on a Friday afternoon.",8 months ago,2023-07-28 18:45:31.111961,,,,0,39,37,False,,
ChIJM3elBidawokRJKPC55N6pQI,Mei Lai Wah,b46911dc80c7a8706505f02b82fa7466,5,"portion of gyoza for $5. I ordered fries and they were very tasty, I recommend them.",8 months ago,2023-07-28 18:45:31.115115,,,,1,39,101,True,"porcao de guioza por $5. pedi fritas e estavam muito saborosas, recomendo.",
ChIJM3elBidawokRJKPC55N6pQI,Mei Lai Wah,2a9486b41845e0e7d0d3b6a911ad1240,5,"Best damn pork buns in the city. Pineapple bun or die. Usually there is a line, sometimes the kiosk doesn t work outside. Don t complain, don t cause a ruckus, and make sure you TIP. The business keeps low prices and makes such quality food. Gem of a place and hope that they continue to get all the love.",8 months ago,2023-07-28 18:45:31.118693,,,,1,220,320,True,,
ChIJM3elBidawokRJKPC55N6pQI,Mei Lai Wah,b42ae6b5eb085c8cea8d6e958565b2d0,5,It was good place,8 months ago,2023-07-28 18:45:31.121772,,,,1,508,41,True,,
ChIJM3elBidawokRJKPC55N6pQI,Mei Lai Wah,1285d7e475e1df3de7d2fbdbf147a2a9,5,I really liked the place,8 months ago,2023-07-28 18:45:32.125759,,,,0,100,193,True,Me gusto mucho el lugar,
ChIJM3elBidawokRJKPC55N6pQI,Mei Lai Wah,c2ac60c5c548d4da7c3e741d88d1aff8,5,Best pork buns in the city.,8 months ago,2023-07-28 18:45:32.130901,,,,0,42,11,True,,
ChIJM3elBidawokRJKPC55N6pQI,Mei Lai Wah,6bb646fddbcc78625261ed91bbfe9746,5,You cannot find a better pork bun in NYC. Can t say this is a hidden gem considering that they always have such a long line outside of the store all the time,8 months ago,2023-07-28 18:45:32.135383,,,,0,54,1,False,,
ChIJM3elBidawokRJKPC55N6pQI,Mei Lai Wah,a35d0ccfc93e909288f87b6638218368,5,"There s always a line out the door and for good reason. This place makes the best pork buns you can get your hands on. I tried a few things of their menu and it was all good, but the star of the show is the pineapple pork bun. The dough was crispy yet soft. The filling blended together so well with the perfect combo of flavors. I could ve eaten 100 of these. A must stop in Chinatown!",8 months ago,2023-07-28 18:45:32.139456,,,,7,288,1191,True,,
ChIJM3elBidawokRJKPC55N6pQI,Mei Lai Wah,9bdac146fe768f06cbe1a0aa2353603a,5,The best pork buns you will ever have!!! Fast service and always fresh...not everyone knows about this gem and thats what makes it even more special!!,8 months ago,2023-07-28 18:45:32.143454,,,,0,47,28,True,,
ChIJM3elBidawokRJKPC55N6pQI,Mei Lai Wah,ee0b044aac62531cd5aac356015123f2,5,"Excellent bun with pork , and cheap . One of The Best one in chinatown. The roasted ( favorite )  is a bit more sweet than steamed ( also delicious)",8 months ago,2023-07-28 18:45:32.147144,,,,0,143,34,True,,
ChIJM3elBidawokRJKPC55N6pQI,Mei Lai Wah,08aeb39dbf426397b6627bd486378c62,5,"Glad I was able to visit this place, long line outside BUT if you have cash go straight inside, window to the right, I was in and out quick, no long wait. Look over the menu before getting to the window,, know what you are going to order and do it quick   There is no seating so order and go. I tried the Baked roast pork bun, pineapple bun and pineapple pork,, Baked Roast Pork bun was the best, warm and soft nicely filled yum! I wouldn t order the Pineapple bun again. Should ve listened to a local and tried the coconut bun! Will be back",8 months ago,2023-07-28 18:45:32.150662,,,,0,3,3,False,,
ChIJM3elBidawokRJKPC55N6pQI,Mei Lai Wah,f4f57270e3d37d0aa6a3f788ba88f3b6,5,"Best buns I ve ever had. The pineapple pork buns are SO good! I was blown away. Expect a short wait to order. No place to dine in when I went, so it is a carry out spot only. Well worth the hype",8 months ago,2023-07-28 18:45:32.153815,,,,0,21,10,True,,
ChIJM3elBidawokRJKPC55N6pQI,Mei Lai Wah,79a1d321ac293c84344b3cba45ff2a5a,5,,8 months ago,2023-07-28 18:45:32.157003,,,,0,3,,False,,
ChIJM3elBidawokRJKPC55N6pQI,Mei Lai Wah,de1e848ba82cfbfa30b0ee50d66f67e4,5,You must try!,8 months ago,2023-07-28 18:45:32.159672,,,,0,43,32,False,,
ChIJM3elBidawokRJKPC55N6pQI,Mei Lai Wah,fbad1bb19129297b5e23b109ccf3b81c,5,Delicious food and super cheap- but dont count on eating there unless you wait in line at least 1/2 an hour.  People are always lined up,8 months ago,2023-07-28 18:45:32.921871,,,,0,56,69,True,,
ChIJM3elBidawokRJKPC55N6pQI,Mei Lai Wah,78998dcc959bde6436d472b70e8d7b9c,3,"I think this is partially my fault for only looking at the positive reviews, but the pork buns have a lot of fatty bits and it just wasn t to my liking.",8 months ago,2023-07-28 18:45:32.926758,,,,0,49,66,False,,
ChIJM3elBidawokRJKPC55N6pQI,Mei Lai Wah,87cf5a7a0695b4f44c8e021d5d147f37,5,A good place to eat something on the way We took a bun filled with sweet egg that was absolutely perfect! In addition we took a bun stuffed with pineapple and meat which was less good but still excellent There is nowhere to sit and must be taken An oriental and very tasty place,8 months ago,2023-07-28 18:45:32.931018,,,,0,51,58,True,!,
ChIJM3elBidawokRJKPC55N6pQI,Mei Lai Wah,06d48976fffb5855d8e02a8071219a93,4,,8 months ago,2023-07-28 18:45:32.935928,,,,0,69,11,True,,
ChIJM3elBidawokRJKPC55N6pQI,Mei Lai Wah,c9f5a79bd5f9818b5d2d4125a7371c61,5,,8 months ago,2023-07-28 18:45:32.939528,,,,0,3,14,False,,
ChIJM3elBidawokRJKPC55N6pQI,Mei Lai Wah,af8e315705316fb262f63c56ebfb5385,5,amazing pork buns and definitely try the red bean buns as well,8 months ago,2023-07-28 18:45:32.943002,,,,0,10,12,False,,
ChIJM3elBidawokRJKPC55N6pQI,Mei Lai Wah,0b4552beda71478568d8cc50cfc80b3d,5,Great food,8 months ago,2023-07-28 18:45:32.946443,,,,0,149,285,True,,
ChIJM3elBidawokRJKPC55N6pQI,Mei Lai Wah,bfe4813fb04c1e92825e697b59d9bd67,5,Best of the best,8 months ago,2023-07-28 18:45:32.949915,,,,0,5,,False,,
ChIJM3elBidawokRJKPC55N6pQI,Mei Lai Wah,010e16a5fa31604e7a675554fe94fdac,5,We were only able to get there near end of day when the only had pork buns left. But even those were amazingly seasoned and fresh. Definitely worth the line up.,8 months ago,2023-07-28 18:45:32.953034,,,,0,137,1741,True,,
ChIJM3elBidawokRJKPC55N6pQI,Mei Lai Wah,51dd732587edac763d94fab56f504cc4,5,"I only have the pineapple pork bun pictured, but we had both the pineapple pork bun and the roast pork bun as well, and two chrysanthemum teas. This place had delicious pork buns that are definitely worth the hype if you like roast pork/char siu flavors! It s great as a breakfast or afternoon snack!",8 months ago,2023-07-28 18:45:32.956221,,,,0,68,162,True,,
ChIJM3elBidawokRJKPC55N6pQI,Mei Lai Wah,98dd23adc4296e94f04023641c9d962e,5,"the line is insane at this joint... good to see classic places like this are still thriving in the wake of the pandemic. as a local, ill only go when on the off chance there isnt an insane wait. cocktail buns, baked charsiu bao, and of course, their pineapple charsiu bao are my go-tos. get a dozen to go, which comes in a box, and be the popular guy back at the office",8 months ago,2023-07-28 18:45:33.689449,,,,0,4,,False,,
ChIJM3elBidawokRJKPC55N6pQI,Mei Lai Wah,ece070c8c7bacb7ea2fbb7a710793a38,5,,9 months ago,2023-06-28 18:45:33.693842,,,,0,5,,False,,
ChIJM3elBidawokRJKPC55N6pQI,Mei Lai Wah,9c70d95c13c57a0b9f857b8944964432,5,"The pineapple bun w/ roast pork is the only reason I go to this place. It s the only bakery you ll find that sells it and it s absolutely amazing. I took my siblings here months ago to try it and they love it. I took my girlfriend here 4 days ago, and we walked all the way back from Chelsea just to have it again for dinner. It s savory from the pork and slightly sweet from the bun, but it s also just so soft, chewy and filling for such a cheap price. Honestly the best bakery item, because it s the baby of the two most popular bakery items you can find at any Asian bakery.",9 months ago,2023-06-28 18:45:33.697533,,,,0,28,196,True,,
ChIJM3elBidawokRJKPC55N6pQI,Mei Lai Wah,84c1d602f878585040a8ab13b3893ccc,3,,9 months ago,2023-06-28 18:45:33.701571,,,,0,41,8,False,,
ChIJM3elBidawokRJKPC55N6pQI,Mei Lai Wah,e0410df9a0ed7892afb1c7bb494527ff,5,"The pineapple pork buns are to die for! Highly recommend it,if you are near. The wait can be a bit annoying but that is because of how many people they serve. 10/10",9 months ago,2023-06-28 18:45:33.704886,,,,0,14,3,True,,
ChIJM3elBidawokRJKPC55N6pQI,Mei Lai Wah,83f2c89f085c216ccc4afbfee3cdb93f,5,Reliable and delicious cha siu bao!,9 months ago,2023-06-28 18:45:33.708773,,,,0,75,90,True,,
ChIJM3elBidawokRJKPC55N6pQI,Mei Lai Wah,89368be6c63024d40e3454ca81439286,1,"Went there to eat a beef tripe noodle soup. It was great but they added another dollar to my already generous tip and that messed up my entire credit card payment and now I have a  late payment mark  on my statement. Great food, but will not come back because their money handling is frustratingly unreliable. I can t trust they input it correctly next time.",9 months ago,2023-06-28 18:45:33.712379,,,,0,9,2,False,,
ChIJM3elBidawokRJKPC55N6pQI,Mei Lai Wah,9eb811b1e896ab2d004d7e5f1acffa68,5,Best steamed BBQ bun.,9 months ago,2023-06-28 18:45:33.715535,,,,0,72,4,False,,
ChIJM3elBidawokRJKPC55N6pQI,Mei Lai Wah,eb4b5a11eac272054d5dacd16c2ee2d7,5,Amazing pineapple pork buns,9 months ago,2023-06-28 18:45:33.718797,,,,0,107,13,True,,
ChIJM3elBidawokRJKPC55N6pQI,Mei Lai Wah,1ce669848fe094c15c6c816f4c4c2e35,3,"This is not HK style wonton noodles if that s what you re looking for. The noodles are not as thin, nor alkali based to have that chewy texture. The soup is also not hk styled. The wontons themselves are fresh and tasty. Everything came in disposable plastic tableware.",9 months ago,2023-06-28 18:45:33.721956,,,,0,1,2,False,,
ChIJM3elBidawokRJKPC55N6pQI,Mei Lai Wah,9f4f451e2ac08a83c755bd6cfec380c7,5,Delicious buns! 10/10 recommend! The Pineapple bbq pork is the best.,9 months ago,2023-06-28 18:45:34.469519,,,,0,127,18,True,,
ChIJM3elBidawokRJKPC55N6pQI,Mei Lai Wah,d5f89bb53e01ad069eb89accd1cfc613,5,Great pork buns.,9 months ago,2023-06-28 18:45:34.472264,,,,0,16,,False,,
ChIJM3elBidawokRJKPC55N6pQI,Mei Lai Wah,f7b3764c87a449978f25fb720b97a559,3,The barbecued pork buns are delicious! The stir-fried beef rice noodles are expensive and taste bad.,9 months ago,2023-06-28 18:45:34.474649,,,,0,28,15,False,"!            ,",
ChIJM3elBidawokRJKPC55N6pQI,Mei Lai Wah,2dc0d8d3dae8b04cbc987dfc6ab8fd3b,5,"This place is the bomb as far as baked roast pork buns are concerned. Its always crowded but the staff is very efficient. We ordered the baked roast pork buns and the pineapple roast pork buns. Both were so yummy and LOADED with meat. We liked it so much, we bought 16 buns on our morning of departure to bring home!",9 months ago,2023-06-28 18:45:34.477328,,,,0,38,37,False,,
ChIJM3elBidawokRJKPC55N6pQI,Mei Lai Wah,f036acf4cafda17f1b6f5d489a6e5287,5,BEST PLACE to buy pork buns!! thats all I go there for.,9 months ago,2023-06-28 18:45:34.479757,,,,0,116,1,True,,
ChIJM3elBidawokRJKPC55N6pQI,Mei Lai Wah,fe868c652b132d93db7393d41825eb87,4,,9 months ago,2023-06-28 18:45:34.482263,,,,0,75,6,True,,
ChIJM3elBidawokRJKPC55N6pQI,Mei Lai Wah,e45462fe6e4143eef79bf84956071222,5,Line was long but moved pretty quickly. Highly recommended the pineapple bun with chashu and rice rolls ( I got the beef one). They were worth the wait,9 months ago,2023-06-28 18:45:34.484470,,,,0,53,114,True,,
ChIJM3elBidawokRJKPC55N6pQI,Mei Lai Wah,448acd810d2dfeeae8a397092da75a9f,5,Go for the pork buns and order some other dishes while youre there.,9 months ago,2023-06-28 18:45:34.486962,,,,0,96,313,True,,
ChIJM3elBidawokRJKPC55N6pQI,Mei Lai Wah,6f45321bf6528ed914c4d84e9c8e119f,1,"Roasted Pork Pineapple Bun The cracked golden toppings of the pineapple bun was perfect, nearly the best and the freshest one I have ever had in NYC so far. It was still served warm when I ate it. It looked and tasted exactly like the ones I could buy in Hong Kong. However, the roasted pork filling was too fat and greasy for my liking. There was too much belly fat...... I had to keep spitting the fat out. I wish they could add replace the fat jelly with more meat. Worth a try for the bun though! Cocktail Bun (Coconut) I didnt take any photos of it as it was too disappointing. It looked different from the menu photo, and tasted nothing like the Cantonese / Hong Kong style cocktail bun. Roasted Pork Pineapple Bun The cracked golden toppings of the pineapple bun was perfect, nearly the best and the freshest one I have ever had in NYC so far. It was still served warm when I ate it. It looked and tasted exactly like the ones I could buy in Hong Kong. However, the roasted pork filling was too fat and greasy for my liking. There was too much belly fat...... I had to keep spitting the fat out. I wish they could add replace the fat jelly with more meat. Worth a try for the bun though! Cocktail Bun (Coconut) I didnt take any photos of it as it was too disappointing. It looked different from the menu photo, and tasted nothing like the Cantonese / Hong Kong style cocktail bun. Worth Returning ? Maybe no. Its a pity that they dont sell plain pineapple bun, otherwise I will definitely come back for the bun. *** Pay by cash inside the store is cheaper than paying at the card machine",9 months ago,2023-06-28 18:45:34.490044,,,,2,165,750,True,,
ChIJM3elBidawokRJKPC55N6pQI,Mei Lai Wah,48b0a5e193eccc802686703672ec4ffb,5,,9 months ago,2023-06-28 18:45:34.493066,,,,0,11,,False,,
ChIJM3elBidawokRJKPC55N6pQI,Mei Lai Wah,497c3bf7943308d88adfe81d688c9596,5,,9 months ago,2023-06-28 18:45:35.261859,,,,0,7,,False,,
ChIJM3elBidawokRJKPC55N6pQI,Mei Lai Wah,d43240e98d12e99b8b5b71a1f74e478e,5,Good bun,9 months ago,2023-06-28 18:45:35.264225,,,,0,24,3,True,,
ChIJM3elBidawokRJKPC55N6pQI,Mei Lai Wah,c71481c338387846bc1b6b7945fd3a46,4,,9 months ago,2023-06-28 18:45:35.266905,,,,0,2,1,False,,
ChIJM3elBidawokRJKPC55N6pQI,Mei Lai Wah,f8ebb3966cbb46b4f97379431d3dbfb0,5,"I usually see a line out the door with tourists, but went before noon on a weekday and it wasnt busy at all. This place is best known for their roast pork buns which was selling under $2.00. Upon entering, what was once a sit down restaurant was reduced to take out only so I get why the lines are outside. Ordered one of their famous pork buns which was pleasantly warm to the touch. Once I unwrapped the wax paper and examined it a bit, you can see that the filling was overflowing on the back of the bun. When I took the first bit, the skin was still a bit crispy and its chock full of bbq pork with a good amount of glutinous filling along with some pieces of pork fat. It was quite delicious so bring cash.",9 months ago,2023-06-28 18:45:35.269518,,,,1,1043,8258,True,,
ChIJM3elBidawokRJKPC55N6pQI,Mei Lai Wah,9b4172eb7bea6732fd02491428aef6b9,5,Get the BBQ Pork Pineapple Bun,9 months ago,2023-06-28 18:45:35.272616,,,,0,3,,False,Get the,
ChIJM3elBidawokRJKPC55N6pQI,Mei Lai Wah,c17bc0c4b27a640682d7c632442188a4,5,"Ive been going here for over 50 years. Always great food. Usually, I go for breakfast on Sunday. Or we pick up pork buns whenever we go into the city. Definitely worth the trip.",9 months ago,2023-06-28 18:45:35.275542,,,,0,17,,False,,
ChIJM3elBidawokRJKPC55N6pQI,Mei Lai Wah,02babf7eebe6179b5e4a025096ea93e3,1,Quality control very poor. I ve had OK buns here but sometimes they are inedible. Often burnt and once the pork was rancid. Don t know what the fuss is about. Almost every bakery in Chinatown offers the same pork buns usually with better quality. I never see Chinese people waiting on line which is very telling.,9 months ago,2023-06-28 18:45:35.278061,,,,1,7,,False,,
ChIJM3elBidawokRJKPC55N6pQI,Mei Lai Wah,dd050b3f572c8dc29cd639200cd79b2d,5,Pineapple bun out of control,9 months ago,2023-06-28 18:45:35.280451,,,,0,105,45,True,,
ChIJM3elBidawokRJKPC55N6pQI,Mei Lai Wah,e8043e869111af242185d1a3a6c02f63,5,"The meat buns are all really good, but expect a line.",9 months ago,2023-06-28 18:45:35.283030,,,,0,233,17,True,,
ChIJM3elBidawokRJKPC55N6pQI,Mei Lai Wah,7efc8a9c1c87206f6b8b6e4a1b51de5d,5,These guys are the best and now they got a spot in the West Village and they serve alcohol,9 months ago,2023-06-28 18:45:35.285589,,,,0,11,21,True,,
ChIJM3elBidawokRJKPC55N6pQI,Mei Lai Wah,3b2ab1afec0011948d647fd920b08e1e,4,,9 months ago,2023-06-28 18:45:36.058988,,,,0,16,12,True,,
ChIJM3elBidawokRJKPC55N6pQI,Mei Lai Wah,ad042fa331ad44b662d51df99e566a7a,2,"Too slow, long line",9 months ago,2023-06-28 18:45:36.061382,,,,0,66,101,True,,
ChIJM3elBidawokRJKPC55N6pQI,Mei Lai Wah,5cf3dd7688999fa271fc3c169850bd4b,4,,9 months ago,2023-06-28 18:45:36.063852,,,,0,13,811,True,,
ChIJM3elBidawokRJKPC55N6pQI,Mei Lai Wah,1ef83d5d77494fe4fde6005da37fa240,5,,9 months ago,2023-06-28 18:45:36.066038,,,,0,40,24,True,,
ChIJM3elBidawokRJKPC55N6pQI,Mei Lai Wah,3341ea920460fadb11bff9c98d3dc850,5,The pineapple BBQ buns are so delicious,9 months ago,2023-06-28 18:45:36.068231,,,,1,127,7152,True,,
ChIJM3elBidawokRJKPC55N6pQI,Mei Lai Wah,47a5880c213d8f767c052159613bbb65,5,Delicious Chinese foods,9 months ago,2023-06-28 18:45:36.070691,,,,0,7,8,True,,
ChIJM3elBidawokRJKPC55N6pQI,Mei Lai Wah,4844be17ae714f34a6500cbda19479db,2,"It was great at first taste. The bun was soft and sauce was tasty. But as soon as I eat fillings, there was too much lumps of meat fat not the actually meat. I couldnt eat it all because it was not for me that it only had fat in it. I ordered pineapple pork bun but the lady gave me normal pork bun which is cheaper than what I paid. Still confused about what food they have and customer ordered doesn t make sense",9 months ago,2023-06-28 18:45:36.073267,,,,2,14,,False,,
ChIJM3elBidawokRJKPC55N6pQI,Mei Lai Wah,179e6d2073518f2e4a2ad319de183013,5,,9 months ago,2023-06-28 18:45:36.075465,,,,0,30,76,True,,
ChIJM3elBidawokRJKPC55N6pQI,Mei Lai Wah,d279c10fd279ceb7ee906b5ccb72ebed,5,,9 months ago,2023-06-28 18:45:36.077651,,,,0,54,10,True,,
ChIJM3elBidawokRJKPC55N6pQI,Mei Lai Wah,ec0b5ecd651bd596a92890c2b062cfce,5,,9 months ago,2023-06-28 18:45:36.079867,,,,0,116,4,True,,
ChIJM3elBidawokRJKPC55N6pQI,Mei Lai Wah,1cf05cbf9ff70e540635832c08339722,5,The pineapple pork buns are fantastic and worth the stop,9 months ago,2023-06-28 18:45:36.806234,,,,0,79,63,True,,
ChIJM3elBidawokRJKPC55N6pQI,Mei Lai Wah,3dfa6bac9850e196d9e8d9ada36b5e81,5,,9 months ago,2023-06-28 18:45:36.809008,,,,0,29,6,True,,
ChIJM3elBidawokRJKPC55N6pQI,Mei Lai Wah,243fc2b8a98ff221973dc0d0889eaaec,3,,9 months ago,2023-06-28 18:45:36.811229,,,,0,16,41,True,,
ChIJM3elBidawokRJKPC55N6pQI,Mei Lai Wah,e763e1a07420d910dc0c496e75ba9d9a,5,,9 months ago,2023-06-28 18:45:36.813515,,,,0,3,77,False,,
ChIJM3elBidawokRJKPC55N6pQI,Mei Lai Wah,5c5421613f3ee0ee4926e610a231facc,5,The best pork buns and at a great price!,9 months ago,2023-06-28 18:45:36.815807,,,,0,140,270,False,,
ChIJM3elBidawokRJKPC55N6pQI,Mei Lai Wah,f7008260cb92cc13bc7f863e9d2da0c9,5,Long line but it moves very quickly!!,9 months ago,2023-06-28 18:45:36.818132,,,,0,29,77,True,,
ChIJM3elBidawokRJKPC55N6pQI,Mei Lai Wah,92c39f0d61005f4f086883a74ffbf94e,5,The buns here are the best in the area. Usually a short line. Bring cash the only other payment is using the self service kiosk. Don t go to counter and try and pay with a credit card.,9 months ago,2023-06-28 18:45:36.820652,,,,0,104,97,True,,
ChIJM3elBidawokRJKPC55N6pQI,Mei Lai Wah,60357aa6ae34df954f80652819a846d7,5,"Was skeptical that this place had the best char siu pineapple bun, Im a believer now. Crust is crispy and sweet, bread is soft, and the char siu is some of the best Ive had, just right amount of fat and tender meat and sauce is balanced. Their rice rolls are actually pretty good too.",9 months ago,2023-06-28 18:45:36.823397,,,,0,52,1,True,,
