place_id,place_name,review_id_hash,rating,review_text,published_at,published_at_date,response_from_owner_text,response_from_owner_ago,response_from_owner_date,review_likes_count,total_number_of_reviews_by_reviewer,total_number_of_photos_by_reviewer,is_local_guide,review_translated_text,response_from_owner_translated_text
ChIJM3elBidawokRJKPC55N6pQI,Mei Lai Wah,183a402043c640230eee1c26ffa9e0c2,5,"AMAZINGGG! I got 6 normal pork buns and 2 pineapple pork buns, and my total was $12.70. Honestly I don t think I m a huge fan of the pineapple ones because of the texture of the pineapple top, but the normal buns are still sooo good. The pork filling is so delicious and they really go ham with it. Look at all that meat inside! Trust me, you won t regret getting these buns.",a year ago,2023-03-28 18:47:53.826328,,,,0,66,177,True,,
ChIJM3elBidawokRJKPC55N6pQI,Mei Lai Wah,98267188de49541e2f1aa4147afbc2fe,5,06/12/22 HAFTA leave a comment cuz it s def the best pineapple pork bun I ve ever had  after trying the ones in Hk and bj. First had this in last December and cannot forget about it  keep telling my friend it s the best bun and finally we made it.,a year ago,2023-03-28 18:47:55.035304,,,,1,61,229,True,,
ChIJM3elBidawokRJKPC55N6pQI,Mei Lai Wah,c07acd1705da63af9665cfaf0b8694df,5,"Incredible pork buns!! I am so obsessed with their baked goods and probably consumed at least a thousand a calories because I lack self control, but no regrets. Also, no better meal than congee when your immune system is getting destroyed by Covid. Food is 11/10. I m in heaven.",a year ago,2023-03-28 18:47:55.040462,,,,1,308,690,True,,
ChIJM3elBidawokRJKPC55N6pQI,Mei Lai Wah,68bdde28397a2eada0e1c4d1a690b667,5,Those pork buns!! Affordable and yummy.,a year ago,2023-03-28 18:47:55.044944,,,,0,96,1,True,,
ChIJM3elBidawokRJKPC55N6pQI,Mei Lai Wah,25b1409aea51dfe6ca1b17f4aa5b2483,5,,a year ago,2023-03-28 18:47:55.049122,,,,0,5,2,False,,
ChIJM3elBidawokRJKPC55N6pQI,Mei Lai Wah,3d5960043d80ec7e55ff675745033a5e,5,best roast pork buns in city,a year ago,2023-03-28 18:47:55.052441,,,,0,121,,False,,
ChIJM3elBidawokRJKPC55N6pQI,Mei Lai Wah,17a26e124481b77cfc0fbf66c735f7a2,5,"this place is known for their roast pork buns, and after trying it myself, I completely agree. sitting at 1.50 per bun it is served fresh out of the oven, steaming hot, and MOUTH WATERING DELICIOUS PORK BELLY !!! i came back for seconds and the cashier was like  another one????  yes m am, give me like 12 more pls. both times I went there was no line (I came around noon on a weekday). the pork and century egg congee was also yummy and super affordable (3.75) for a large container. ****BRING CASH, it s cheaper w/ cash (quicker check out in my opinion) and we gotta support the hustle!",a year ago,2023-03-28 18:47:55.056082,,,,0,58,174,True,,
ChIJM3elBidawokRJKPC55N6pQI,Mei Lai Wah,43df024b91d8e48d115f29ee0cf4ad44,5,Great pineapple pork buns.,a year ago,2023-03-28 18:47:55.059523,,,,0,254,90,True,,
ChIJM3elBidawokRJKPC55N6pQI,Mei Lai Wah,58a901fde5bbab85ab7323e20d1ca8bf,5,"Although there was a line, it was well worth the wait! These are the best pork buns Ive ever had! The pork is full of flavor, and the bun is sweet. I do wish the pork had a little bit more savoriness to balance with the sweetness of the bun, but as I said, its still the best pork bun Ive ever had!",a year ago,2023-03-28 18:47:55.062968,,,,2,40,183,True,,
ChIJM3elBidawokRJKPC55N6pQI,Mei Lai Wah,10ff24254dbfc5e9292c4f55388633de,4,Good pork buns,a year ago,2023-03-28 18:47:55.066367,,,,0,17,32,True,,
ChIJM3elBidawokRJKPC55N6pQI,Mei Lai Wah,c88eb10593da3797ef542e7830754004,5,Best pork buns in town.,a year ago,2023-03-28 18:47:55.069521,,,,0,27,6,True,,
ChIJM3elBidawokRJKPC55N6pQI,Mei Lai Wah,8497a2fb63bb8a1771c61de29921fc84,5,,a year ago,2023-03-28 18:47:56.595286,,,,0,21,40,True,,
ChIJM3elBidawokRJKPC55N6pQI,Mei Lai Wah,acfd1b0f0f1a7d3bcc659858b45d34a9,5,,a year ago,2023-03-28 18:47:56.597719,,,,0,5,13,False,,
ChIJM3elBidawokRJKPC55N6pQI,Mei Lai Wah,32536c1642ebdb3990aba2bee70f8251,5,Pineapple bun. Baked pork bun.,a year ago,2023-03-28 18:47:56.599925,,,,0,175,16,False,,
ChIJM3elBidawokRJKPC55N6pQI,Mei Lai Wah,8eb1cdb26c9c3e5281da54ebe6b36912,4,,a year ago,2023-03-28 18:47:56.602365,,,,0,97,83,True,,
ChIJM3elBidawokRJKPC55N6pQI,Mei Lai Wah,acd4233ead5b841932363a2eb68ec675,5,Best place for pork bun and steam bun. My fav. Sesame bun.  Bring cash its cheaper than card. Over all we try to hit up the place when we are here in the city.,a year ago,2023-03-28 18:47:56.604639,,,,0,157,424,True,,
ChIJM3elBidawokRJKPC55N6pQI,Mei Lai Wah,d9a7d08852d2c1c7fcc6cc5d0d39c971,5,Pork buns are pretty good!,a year ago,2023-03-28 18:47:56.607493,,,,0,1039,2239,True,,
ChIJM3elBidawokRJKPC55N6pQI,Mei Lai Wah,3d49067deaff710d4b31dda9af5495c2,5,So cheap and so filling! Definitely going back.,a year ago,2023-03-28 18:47:56.610212,,,,0,19,2,False,,
ChIJM3elBidawokRJKPC55N6pQI,Mei Lai Wah,9ee541622e0e0603a52ed9e47ab94a1d,5,"One of, if not the best pork buns I ve had. Worth a visit just to get a pork bun for sure. The bun was fluffy and the sweet/savory pork is something special. They are super affordable, too. Due to the pandemic there was no indoor seating but thankfully there is a park with benches less than 3 minutes away.",a year ago,2023-03-28 18:47:56.612865,,,,0,22,24,False,,
ChIJM3elBidawokRJKPC55N6pQI,Mei Lai Wah,3805cc75ac66da59a46f0b0d88377307,5,"I am half-Chinese, born and raised in Manhattan.  I can safely say that I have never had a better roast pork bun than those from Mei Lai Wah!  They are light on the bread, and super-filled with the classic sweet pork. Stunning.  You can also order delivery from Seamless/GrubHub. (Fair warning, even they will tell you that their Famous Bun is just bread, so dont buy one and be disappointed.)",a year ago,2023-03-28 18:47:56.615649,,,,1,14,4,False,,
ChIJM3elBidawokRJKPC55N6pQI,Mei Lai Wah,ebfd2f4bdceb942b72f414d87425d68c,4,The advertisement make me come in very quick! Very bussin! The food was very cream filled and it was overall a grand experience! Super Hot !!!!!!,a year ago,2023-03-28 18:47:56.618329,,,,0,4,2,False,,
ChIJM3elBidawokRJKPC55N6pQI,Mei Lai Wah,fb34967716e8c5241cdc1c16a3c9efb2,4,Delicious bou lo chasiu bao!! We got a variety of their bread Saturday morning. Everyday there is a line in the morning and if you get there too late they run out of the pineapple pork bun. Today they ran out after 10AM! The bread is perfectly sweet with a crisp pineapple crusting while the chasiu is delicately salty. My one issue is that there is a lot of fat inside each pork bun and you can feel it while you eat each bite that you are eating pork fat.,a year ago,2023-03-28 18:47:57.710560,,,,1,165,562,True,,
ChIJM3elBidawokRJKPC55N6pQI,Mei Lai Wah,ba1c2926c5161e2a58d19af7c893673b,5,It s definitely one of the best cheap eats in NYC! Home pf the famous roast pork bun. It s cheap and absolutely delicious and quite filling if you had at least 2 of it. It s always baked fresh and it s just the perfect balance of sweet and savory. Highly recommend when you re hitting Chinatown in NYC!,a year ago,2023-03-28 18:47:57.714971,,,,3,275,1404,True,,
ChIJM3elBidawokRJKPC55N6pQI,Mei Lai Wah,5cda2966dd270ebc207a444da34b3f86,5,"Had roast pork bun (baked), rice noodle wrap and congee. Bun exceeded all expectations, going here after Fay Da was like being at a Parisian boulangerie for the first time after only having ever experienced croissants at Costco. Other dim sum items were also high quality.",a year ago,2023-03-28 18:47:57.719296,,,,0,77,185,True,,
ChIJM3elBidawokRJKPC55N6pQI,Mei Lai Wah,45fc213fc59f37e30dcb672e0b138700,5,Best pork bun Ive ever had ( and Ive tried from many different places in the world)! All others disappoint after youve had it from this place. Lines may form outside the store but their service is pretty fast and good.,a year ago,2023-03-28 18:47:57.723247,,,,0,1,,False,,
ChIJM3elBidawokRJKPC55N6pQI,Mei Lai Wah,ae25f4e92e75c5ca266c085971152f1d,3,"Pork buns not as good as they used to be  or maybe there are just a lot of other places that do it just as good or better and MLW s don t impress me as much anymore. Pork filling is WAY too sweet (and such a small portion lol) and some mystery hard stuff inside as well, although bun still crusty and tasty (although also a little too sweet). Since Hop Shing closed I m on a quest for the sine qua non of pork buns and I m still searching. Buck fifty is cheap but that s pretty much the going price everywhere. Service always abrupt and cold and sometimes you end up with the wrong bun, but hey, a Buck fifty.",a year ago,2023-03-28 18:47:57.726983,,,,1,24,65,True,,
ChIJM3elBidawokRJKPC55N6pQI,Mei Lai Wah,2853618405063220c5aae9280daf70d5,3,Items are cheap and fresh.,a year ago,2023-03-28 18:47:57.730393,,,,0,99,1,False,,
ChIJM3elBidawokRJKPC55N6pQI,Mei Lai Wah,02f39ae9816f5beeb019229eaae8ce5d,5,"a must visit. the food is amazing, fresh, and quick",a year ago,2023-03-28 18:47:57.734140,,,,0,9,,False,,
ChIJM3elBidawokRJKPC55N6pQI,Mei Lai Wah,9e90fecf7b76b16c4bf622194761f462,5,This place is really nice.The baked roast pork buns are delicious!!,a year ago,2023-03-28 18:47:57.737276,,,,1,12,38,True,,
ChIJM3elBidawokRJKPC55N6pQI,Mei Lai Wah,ec87628263a046aeb884f75ea04d5fe3,3,,a year ago,2023-03-28 18:47:57.740444,,,,0,1,,False,,
ChIJM3elBidawokRJKPC55N6pQI,Mei Lai Wah,1329f2eff87d5fd6c3a160973f35cbd4,5,Great pork buns the steamed and the roasted ones were excellent and very cheap. A must try if in the area.,a year ago,2023-03-28 18:47:57.743087,,,,0,78,675,True,,
ChIJM3elBidawokRJKPC55N6pQI,Mei Lai Wah,3a33d5b97bc14e1e034e3f532a6a708b,5,"Great quality pork buns for less than $2 each! I tried the roasted pork (both steamed and baked) and the pineapple pork bun Personally Id skip the baked roasted pork the next time. It was good, but the other two were way better. If youre yolo-ing around Chinatown, then get all 3! Baked roasted pork bun- the bun was good, but the meat:bun ratio was significantly lower compared to the other two. Also, the meat in this one is sweet and savory, and though its not bad by any means, its kinda the middle child who isnt particularly great at anything. Steamed roasted pork bun- trusty spongy bun with a hefty amount of meat filling. The meat in this one isnt sweet, but savory and it goes really well with the rather bland bun. The texture profile of the spongy, slightly chewy bun with the melt-in-your-gob pork belly is phenomenal! Pineapple pork bun- honestly a great follow up to the steamed bun. This is the only one that had a sort of a crunchy layer on the top of the bun (think chunky glaze) and the meat:bun ratio is good. The sweet pineapple bun pairs really well with the savory pork. The slight crunchy texture is met with a dash of sweetness on your pallate which is followed by a hint of the savory melty pork which feels like a nice island in an ocean of sweetness which is followed by more sweetness, leaving a decisively sweet after taste, unlike the confused baked pork bun. Overall, great stuff. You could pay and go away with a decent snack and your wallet wont even realize what happened!",a year ago,2023-03-28 18:47:59.244410,,,,0,253,632,True,,
ChIJM3elBidawokRJKPC55N6pQI,Mei Lai Wah,56c7320b496bff7c402e4cab8b317b2f,5,"The pineapple pork bun lives up to its name as what they re famous for. It s SO GOOD! Instead of the usual pork buns you would usually get in restaurants where it s just the meat inside, you would get a bit of the sauce with the meat. It s a game changer. As someone with a small appetite, one bun does enough for me, but I would get 3 and save the two for later in the day. This with a little cold drink on a hot day, is amazing. I always order takeout and take it to the park and they re quick and easy. Paid in cash and good service.",a year ago,2023-03-28 18:47:59.249523,,,,0,52,19,True,,
ChIJM3elBidawokRJKPC55N6pQI,Mei Lai Wah,63f0747c93732a4ddd6fb7ebdb338629,5,Taste Authentic Guangdong pork buns; meanwhile try out roasted ducks at next door.,a year ago,2023-03-28 18:47:59.253860,,,,0,187,575,True,,
ChIJM3elBidawokRJKPC55N6pQI,Mei Lai Wah,187d1bee594563c6f8b5e3548f3e0337,4,Roast pork bun has too much fatty meat inside for my personal taste. This is the reason for the four star vs. five star review. The Big Buns are tasty and has the right ratio of different meats inside. The Famous Buns are very good for breakfast. I recommend going there early to get the buns fresh out of the oven and consume.,a year ago,2023-03-28 18:47:59.257979,,,,1,72,61,True,,
ChIJM3elBidawokRJKPC55N6pQI,Mei Lai Wah,a38e9231047205664555638f1e2d605d,5,My go to spot every time I m in Chinatown. The baked pork buns and the sticky rice are my favorite! Great service and bring cash!,a year ago,2023-03-28 18:47:59.261925,,,,1,41,16,False,,
ChIJM3elBidawokRJKPC55N6pQI,Mei Lai Wah,b38bf1f80ca62a26379a02af7003db99,5,"Awesome most Char siu bao!! This place and Hop Sing, Right around the corner, are so convenient to have close by and eat!! The bun is perfect  all year round!",a year ago,2023-03-28 18:47:59.265463,,,,0,88,279,True,,
ChIJM3elBidawokRJKPC55N6pQI,Mei Lai Wah,ddc78661993c1d05e8689c5fc6835990,5,Delicious food and good timing.,a year ago,2023-03-28 18:47:59.268938,,,,0,13,,False,,
ChIJM3elBidawokRJKPC55N6pQI,Mei Lai Wah,4ad62913e324c2b775c1e554ddf895ed,5,I learned about this place and heard the line is long everytime. Well it did not disappoint and the bun was great!,a year ago,2023-03-28 18:47:59.272141,,,,0,393,884,True,,
ChIJM3elBidawokRJKPC55N6pQI,Mei Lai Wah,b62959150d7582224893e0ba1e672bd5,1,Not sure if last week  was a off day but my roast pork pineapple bun was 90% fat. Totally disgusting I ate the bun and spit out the rest. We had purchased 6 of them so it was not just mine.,a year ago,2023-03-28 18:47:59.275308,,,,4,1,,False,,
ChIJM3elBidawokRJKPC55N6pQI,Mei Lai Wah,e06ad0110774fc83f1a7a2590c799262,5,Best pork buns!,a year ago,2023-03-28 18:47:59.278302,,,,0,98,157,True,,
ChIJM3elBidawokRJKPC55N6pQI,Mei Lai Wah,fd3cd4f3ade1076096f0d6a226d7d933,5,Excellent Roast Pork Buns,a year ago,2023-03-28 18:48:00.052344,,,,0,25,42,True,,
ChIJM3elBidawokRJKPC55N6pQI,Mei Lai Wah,3c76ed448d422d219b4b1bfcc249da81,5,"THE best baked pork bun to go in Chinatown, 5 stars! Bonus when they are served hot. The filling is the best and ratio with the bun. The pineapple pork bun is the exact same pork bun with added sweetness crust on the outside, also delicious. They freeze well. $1.50 for a pork bun in cash. You pay extra with the credit card kiosk. No eat in is available. Havent tried the rest of the food. This place is extremely busy on the weekends, youll see the line down the block.",a year ago,2023-03-28 18:48:00.056125,,,,0,329,1001,True,,
ChIJM3elBidawokRJKPC55N6pQI,Mei Lai Wah,cf244bc9f1e9b4a31df19b111a0bcf57,4,"got the roast bun, bao zi and pineapple bun. the filling is pretty similar across the different buns, its just the question of which type of bread you prefer. i personally love their classic roast bun the most. chewy, but not super thick.",a year ago,2023-03-28 18:48:00.059811,,,,0,175,329,True,,
ChIJM3elBidawokRJKPC55N6pQI,Mei Lai Wah,fbbda200adc22dd62e100db77d936b22,5,The roasted pork buns and the ones with pork and pineapple are just something out of this world. WOW! They are so delicious. We visited NY for a week and ended up going back three times to Mei Lai Wah to get more buns... A must-go!,a year ago,2023-03-28 18:48:00.063814,,,,0,69,30,True,,
ChIJM3elBidawokRJKPC55N6pQI,Mei Lai Wah,c4e00ef0babb596060470870ce0e10d6,3,"I am so disappointed in their BBQ pork buns. I was expecting delicious Chinese traditional char siu bao, I wanted that rich sweet meaty filling with hoisin and oyster sauce. The ones here are just asado buns. Moist and meaty, but missing that signature flavor. Mine were overcooked. Still looking for the perfect takeout bao. This isnt the place. Other items looked okay. Prices were decent. Cash discount at the window.",a year ago,2023-03-28 18:48:00.067978,,,,0,42,103,True,,
ChIJM3elBidawokRJKPC55N6pQI,Mei Lai Wah,3d8446f60765e5b581c9cddbfe036ac6,5,Excellent roast pork buns. Super fresh and tasty.,a year ago,2023-03-28 18:48:00.072157,,,,0,330,114,True,,
ChIJM3elBidawokRJKPC55N6pQI,Mei Lai Wah,e4e5ab59ed97d876a5617d2c201b6b23,3,"Was ok, nothing special. Price was good",a year ago,2023-03-28 18:48:00.076579,,,,0,41,49,True,,
ChIJM3elBidawokRJKPC55N6pQI,Mei Lai Wah,e608507d064f4c5911fffe673e5f5e1c,4,Take-out for Chinese Dim Sum selections.,a year ago,2023-03-28 18:48:00.080888,,,,0,372,12458,True,,
ChIJM3elBidawokRJKPC55N6pQI,Mei Lai Wah,da77a5f6dd3c655e99e9c697cd1212bd,5,,a year ago,2023-03-28 18:48:00.084923,,,,0,52,143,True,,
ChIJM3elBidawokRJKPC55N6pQI,Mei Lai Wah,6be63f9f6cba121de62a038c444f40ec,5,You get really good buns for such a great price! The service is fast as well.,a year ago,2023-03-28 18:48:00.088618,,,,0,101,249,True,,
ChIJM3elBidawokRJKPC55N6pQI,Mei Lai Wah,5661a0ed2b5ae0bbaa27bc1f0bfc1108,5,,a year ago,2023-03-28 18:48:00.863669,,,,0,15,2,True,,
ChIJM3elBidawokRJKPC55N6pQI,Mei Lai Wah,75e3329771481f42de896f33ba792d6e,5,Cash only at the counter but they do have a ordering kiosk that takes card for about 20 cents more per item Baked roast pork bun      : sweet baked bun with juicy fatty roast pork inside. The roast pork is lightly sweet and savory Fresh shrimp rice roll (not pictured)     : soft rice roll with shrimp with a good bounce to it. Not the best Ive had but comparable to some decent dim sum places,a year ago,2023-03-28 18:48:00.866433,,,,4,243,482,True,,
ChIJM3elBidawokRJKPC55N6pQI,Mei Lai Wah,f7f90e794811b49633d07c4b97b3cc9c,5,Delicious and inexpensive pork buns and shumai! Line moves quickly too!,a year ago,2023-03-28 18:48:00.869181,,,,2,58,88,True,,
ChIJM3elBidawokRJKPC55N6pQI,Mei Lai Wah,3e8260572d27cdfa04492bbf3e326c88,5,We went here on a foodie tour and had the pork bun. A yummy traditional pork bun that was fast and efficient. It was popular so we had to wait a little bit and the line is a long one. I though the bun was good and it was my favorite part of the foodie tour. Not a ton of indoor seating.,a year ago,2023-03-28 18:48:00.872297,,,,1,680,1236,True,,
ChIJM3elBidawokRJKPC55N6pQI,Mei Lai Wah,b4443fdaa0a54f94b6ed16136f23f041,5,"The pineapple pork buns are amazing here and an absolute steal. The sweetness from the pineapple bread and its crust really compliments the fatty, savory roast pork filling. They also have other pastries which are also good but the pineapple pork bun really stand out from the rest of the menu. All staff at the location were wearing masks but they dont check for vaccination status for guests. They only accept card and there is no seating on-site for dining.",a year ago,2023-03-28 18:48:00.875073,,,,15,93,184,True,,
ChIJM3elBidawokRJKPC55N6pQI,Mei Lai Wah,d60762ea057aa4a29b5115db435d360d,5,"What a wonderful place for buns! Have ordered their pineapple pork bun, their regular pork bun, their regular buns, all delicious -- perfect amount of sweetness for their bread. Their pork marinade is the perfect sauce -- sweet and salty and truly what char siu should taste like. Note: Bring cash.",a year ago,2023-03-28 18:48:00.877825,,,,0,380,1036,True,,
ChIJM3elBidawokRJKPC55N6pQI,Mei Lai Wah,31076ccc2642193f0a3334868b7327b4,5,,a year ago,2023-03-28 18:48:00.880444,,,,0,125,28,True,,
ChIJM3elBidawokRJKPC55N6pQI,Mei Lai Wah,8d82ce577c5fccb29d0cd1b93c7b3d44,5,,a year ago,2023-03-28 18:48:00.882819,,,,0,18,7,True,,
ChIJM3elBidawokRJKPC55N6pQI,Mei Lai Wah,e37701b8972ba085295815fc5e3b33ce,5,,a year ago,2023-03-28 18:48:00.885362,,,,0,30,75,True,,
ChIJM3elBidawokRJKPC55N6pQI,Mei Lai Wah,51f268038128f4ae1a221346e22cceec,3,Food is good but service is always below par,a year ago,2023-03-28 18:48:00.887716,,,,0,18,1,True,,
ChIJM3elBidawokRJKPC55N6pQI,Mei Lai Wah,a7a7f80337b8b0813260057a92ee1a7f,4,Unfortunately closed until 4/21/22. Review is mainly to notify future visitors planning to visit the restaurant. I was disappointed to learn that it was closed when I traveled to Chinatown just for the restaurant. Prior experience  best buns ever!,a year ago,2023-03-28 18:48:01.653946,,,,0,1,1,False,,
ChIJM3elBidawokRJKPC55N6pQI,Mei Lai Wah,475fb9b82978864899280165e0331d03,5,"Pineapple bun w roast pork was the best thing I ate during my entire trip to NY, highly recommend",a year ago,2023-03-28 18:48:01.658465,,,,0,6,1,False,,
ChIJM3elBidawokRJKPC55N6pQI,Mei Lai Wah,21c49c31157eedfb3afb50b929975316,2,My favorite baked roast pork bun place doesnt survive the pandemic unfortunately. Very sad about it.  This is left.  The chunks of fat is gross.,a year ago,2023-03-28 18:48:01.661743,,,,2,38,274,True,,
ChIJM3elBidawokRJKPC55N6pQI,Mei Lai Wah,08ffece62d5dad0af30e238bad47034d,5,Baked pork buns!,a year ago,2023-03-28 18:48:01.665072,,,,0,175,21,True,,
ChIJM3elBidawokRJKPC55N6pQI,Mei Lai Wah,65d0501f020bf2b196e54475b3484d0e,5,,a year ago,2023-03-28 18:48:01.668275,,,,0,9,,False,,
ChIJM3elBidawokRJKPC55N6pQI,Mei Lai Wah,7db70131c5cadf736679695ff90492fe,4,"Tried Mei Lai Wah for the first time. When I arrived there was a long line but it moved pretty fast. I only waited about 15min before placing my order. The takeout window was the only option for ordering and it was very fast and efficient. I ordered several buns including the baked pork roast bun, pineapple roast pork bun, coconut bun, famous bun, steamed roast pork bun, big bun with chicken and pork, and the egg yolk bun. The roast pork bun was by far the best! I give the pork roast bun 5 stars. The others were ok, the sweet ones were very very sweet. FYI the famous bun is just bread. Definitely cant beat the value here. I will for sure come back for the roast pork bun!",a year ago,2023-03-28 18:48:01.670932,,,,5,410,1956,True,,
ChIJM3elBidawokRJKPC55N6pQI,Mei Lai Wah,978d135ad4441528aea79420ff4faac0,5,,a year ago,2023-03-28 18:48:01.674344,,,,0,1,,False,,
ChIJM3elBidawokRJKPC55N6pQI,Mei Lai Wah,8cd9e8d85051954ae6cb11914f941cd1,5,The BBQ Pork buns here is by far top notch! Lots of flavoring and greatly marinated pork.,a year ago,2023-03-28 18:48:01.677373,,,,1,150,359,True,,
ChIJM3elBidawokRJKPC55N6pQI,Mei Lai Wah,f37177cbf10c74bafbe73c04ad8dad96,5,Best baked buns,a year ago,2023-03-28 18:48:01.682898,,,,0,7,12,False,,
ChIJM3elBidawokRJKPC55N6pQI,Mei Lai Wah,d591dae7488cb665ae365435f1c3db51,3,"Yummy bun, but a B sanitation rating umm",a year ago,2023-03-28 18:48:01.686037,,,,0,49,5,True,,
ChIJM3elBidawokRJKPC55N6pQI,Mei Lai Wah,8dd8cc47b04b09601f58bfa969b0bd49,5,Absolutely perfect pork buns! Easy ordering at the kiosk outside and super quick preparation.,a year ago,2023-03-28 18:48:02.748333,,,,0,666,4073,True,,
ChIJM3elBidawokRJKPC55N6pQI,Mei Lai Wah,a5cebe14b40c2762fb0c8447b123bab3,5,I ve been visiting this place since 1983!! Absolutely the best pork buns in Chinatown!!!,a year ago,2023-03-28 18:48:02.757647,,,,1,4,,False,,
ChIJM3elBidawokRJKPC55N6pQI,Mei Lai Wah,1c580970f24c0403a0f7c4c621111282,4,,a year ago,2023-03-28 18:48:02.764239,,,,0,2,,False,,
ChIJM3elBidawokRJKPC55N6pQI,Mei Lai Wah,7cce78ec7536bebe91da3d2897058051,2,I got the baked pork bun. The meat felt reheated and the bun was flavorless.,2 years ago,2022-03-28 18:48:02.768559,,,,0,48,,False,,
ChIJM3elBidawokRJKPC55N6pQI,Mei Lai Wah,dcfbdb374bfe7644e6a82312f19c68dc,2,,2 years ago,2022-03-28 18:48:02.774596,,,,0,16,3,True,,
ChIJM3elBidawokRJKPC55N6pQI,Mei Lai Wah,0b980e3b3455bb9b1ba4fadfbbe74485,5,"Yeah the roasted pork buns are excellent and a steal at $1.50 Giving five stars which is rare, and all I had was the roast pork bun, but Ill stand by the rating for the single item. Currently no indoor dinning so just rock up, order and pay cash and then take your delicious, fatty pork bun to go and devour it as you look for the next snack",2 years ago,2022-03-28 18:48:02.778906,,,,5,1270,3189,True,,
ChIJM3elBidawokRJKPC55N6pQI,Mei Lai Wah,63db325fb85d2f1e810802f8b91bf785,5,"3/16/22: Excellent baked roast pork bun and, if you dont mind the sweetness, the pineapple bun with roast pork is also great. The steamed roast pork bun is good, but for steamed buns I might give the edge to Golden Steamer down the street. They were out of the famous bun so Ill have to try that next time.",2 years ago,2022-03-28 18:48:02.782253,,,,7,783,1717,True,,
ChIJM3elBidawokRJKPC55N6pQI,Mei Lai Wah,ff1b3d53fbf556188ceba4d62078c9a6,5,Part of my usual rotation every time I visit NYC. The yummiest roast pork buns in the city. I always get the roast pork buns and the roast pork with pineapple. Definitely worth getting in line for! You will not regret it.,2 years ago,2022-03-28 18:48:02.787618,,,,0,76,47,True,,
ChIJM3elBidawokRJKPC55N6pQI,Mei Lai Wah,3b24831499533b6c55bbbf10611067e2,4,,2 years ago,2022-03-28 18:48:02.792051,,,,0,134,1164,True,,
ChIJM3elBidawokRJKPC55N6pQI,Mei Lai Wah,ef87ba3dcf21735258e4a050ffdd7768,4,I like the shrimp fried rice better than my pork buns,2 years ago,2022-03-28 18:48:02.797051,,,,0,82,17,True,,
ChIJM3elBidawokRJKPC55N6pQI,Mei Lai Wah,13d0297a9f97e602c3a7677f3cf45105,5,,2 years ago,2022-03-28 18:48:03.590338,,,,0,2,,False,,
ChIJM3elBidawokRJKPC55N6pQI,Mei Lai Wah,fc90df1847aa565240188b9e943a72d2,5,Best pork bun in the city,2 years ago,2022-03-28 18:48:03.594060,,,,0,3,,False,,
ChIJM3elBidawokRJKPC55N6pQI,Mei Lai Wah,c311bf9076f49b3d91e78b8dcb1a1ebd,5,"Hands down the best BBQ pork buns in the city and maybe even anywhere else in the world. I always get those and the big steamed bun. Even after a day, popped into the microwave, they taste amazing.",2 years ago,2022-03-28 18:48:03.597783,,,,0,23,96,True,,
