place_id,place_name,review_id_hash,rating,review_text,published_at,published_at_date,response_from_owner_text,response_from_owner_ago,response_from_owner_date,review_likes_count,total_number_of_reviews_by_reviewer,total_number_of_photos_by_reviewer,is_local_guide,review_translated_text,response_from_owner_translated_text
ChIJzfG-8ahZwokR5FLB4KmxBXI,Woorijip,1e9687912477b6bbde063a4fd1dcb13d,4,"Honestly wanted to love this place until we witnessed some discrimination against black people. The cashier who helped us was very nice, but either the owner or the janitor was busy checking peoples receipts asking why their tray is not on the table total bs imo since nobody told us anything about it when checking out. If you look at our table photo, we purchased so many dishes we literally didnt have a place to put tray on the table and the place was really packed. So... Despite how much we enjoyed the concept of the store, I might pass going forward. Also, the street smells so bad probably rotten kimchi",a year ago,2023-04-24 16:08:40.729756,"Hi Rose, thanks for your sharing your experience with us. Were very sorry that you interpreted our tray system that way. Customers that choose to dine in here are given a specific type of tray after paying. This helps our staff identify between paying customers and those that come in with bad intentions. We hope you can appreciate how the latter is an ongoing problem for restaurants/delis/stores in Manhattan, especially for small family-owned businesses. Our staff are trained to approach anyone, with respect, politeness and regardless of race, that doesnt have the correct tray and ask to see their receipt. All customers are welcome at Our Home and we hope youll visit again to see that firsthand.",a year ago,2023-04-24 16:08:40.729756,4,50,88,False,,
ChIJzfG-8ahZwokR5FLB4KmxBXI,Woorijip,5700cc89c9951bba85ba8b67303e2c04,5,,a year ago,2023-04-24 16:08:41.287706,,,,0,10,,True,,
ChIJzfG-8ahZwokR5FLB4KmxBXI,Woorijip,0296e012ab03d5f8cd4d7fd1e2b32864,5,,a year ago,2023-04-24 16:08:41.289422,,,,0,42,295,True,,
ChIJzfG-8ahZwokR5FLB4KmxBXI,Woorijip,11132365ee1bf2a50b02284d5b6b76f2,2,"Good food, but could be better by using whole grains such as brown and black rice. Also, totally racist. They kicked a black patron out just a few minutes after he got his food for not buying anything despite him having a receipt and containers.",a year ago,2023-04-24 16:08:41.291256,,,,6,99,387,True,,
ChIJzfG-8ahZwokR5FLB4KmxBXI,Woorijip,257164006825019c316f64464d10a3d6,5,"Woorijip is definitely different in comparison to other places we have eaten at. It is kind of similar to a dining hall filled with home cooked meals and honestly we are all for it. We loved the ability to peruse all of our options rather than just looking at them through pictures. Our stopping point was when our tray got too heavy and we could not put anything more on it. Our favorite dish that we got here was the soondubu. Additionally, since everything already comes packaged it is so convenient to take out or eat there! We cannot wait to come back. Literally drooling thinking about our meal here.",a year ago,2023-04-24 16:08:41.292570,,,,0,109,12,True,,
ChIJzfG-8ahZwokR5FLB4KmxBXI,Woorijip,f30addd0584ab8fa4ad3a3ec8d8c6de3,5,You can get food really easily and just start eating.,a year ago,2023-04-24 16:08:41.293928,,,,0,13,5,False,,
ChIJzfG-8ahZwokR5FLB4KmxBXI,Woorijip,d8f146d197dd58538fb2124359e65b83,5,The food here is so on point and affordable. Everything is setup like a buffet so you can pick and choose which dishes youd like. Takeout or eat in at their dining area. There is a microwave to heat up your food if needed.,a year ago,2023-04-24 16:08:41.296063,,,,1,236,1330,True,,
ChIJzfG-8ahZwokR5FLB4KmxBXI,Woorijip,473eea2c648a7451c9bb268b56845082,5,Consistently delicious food. Love swinging by Woorijip for a quick meal.,a year ago,2023-04-24 16:08:41.298683,,,,0,18,11,True,,
ChIJzfG-8ahZwokR5FLB4KmxBXI,Woorijip,e21a895243e409b441278e80fd3c3098,4,Great place to grab soju while you wait for a table for BBQ.,a year ago,2023-04-24 16:08:41.300807,,,,0,13,15,False,,
ChIJzfG-8ahZwokR5FLB4KmxBXI,Woorijip,2a2404c6be6e2e17be7d9680d43aea58,5,"I had the gochujang chicken and kimchi fried rice here today, and it was very good. I love these sorts of korean grab and go hot meal restaurants, and theres so many choices, and so far theyre 2 for 2, but Ill be back to try other things soon!",a year ago,2023-04-24 16:08:41.302057,Please come back and try all of the rest Arthur. Happy to help find something you havent tried before. We appreciate your review and business. -Woorijip,a year ago,2023-04-24 16:08:41.302057,0,35,26,True,,
ChIJzfG-8ahZwokR5FLB4KmxBXI,Woorijip,aaede4667591e6828cdbe0c5e9bec83a,5,Love this place! Affordable and delish food. Staff are friendly too!,a year ago,2023-04-24 16:08:41.303675,"Nice review Jericho, thank you for taking a minute to leave it!",a year ago,2023-04-24 16:08:41.303675,0,45,517,True,,
ChIJzfG-8ahZwokR5FLB4KmxBXI,Woorijip,92c094c887fef469a66e50462f3d9ffd,3,,a year ago,2023-04-24 16:08:42.111380,,,,0,1,,False,,
ChIJzfG-8ahZwokR5FLB4KmxBXI,Woorijip,26ac0b23ff72a0d63187cddd02a133c8,4,Quick easy and inexpensive Korean comfort food.,a year ago,2023-04-24 16:08:42.114573,,,,0,7,4,False,,
ChIJzfG-8ahZwokR5FLB4KmxBXI,Woorijip,a23172befa4e87a60b689893b4dce82d,4,Been a solid take out place for cheap Korean eats since more than a decade,a year ago,2023-04-24 16:08:42.118326,"Thanks Nuri, more than 20 years now :) We appreciate your support!",a year ago,2023-04-24 16:08:42.118326,0,58,10,True,,
ChIJzfG-8ahZwokR5FLB4KmxBXI,Woorijip,edc553ecbd6d2624005818a290bbce32,5,"This place had the absolute best food, me and my brother had been touring the city and wanted to pickup something really quickly to take back to the hotel and call it a night, the service was friendly and very helpful, definitely going to become a regular once I move to Manhattan !!",a year ago,2023-04-24 16:08:42.121668,Whitney we look forward to having you as our regular after your move. Were thrilled to hear your first experience here was wonderful. Thank you for the 5 star review!,a year ago,2023-04-24 16:08:42.121668,1,2,6,False,,
ChIJzfG-8ahZwokR5FLB4KmxBXI,Woorijip,356abee2700c35ee4a18f5cb9977951f,2,,a year ago,2023-04-24 16:08:42.125135,,,,0,43,,False,,
ChIJzfG-8ahZwokR5FLB4KmxBXI,Woorijip,90b766385cf6e305f2b6857c4f1e812e,5,The gochujang chicken was definitely my favorite! Lots of options at affordable prices. Quick and friendly service It really is like a 7-11 in Asia. So many meals available to eat,a year ago,2023-04-24 16:08:42.127309,,,,0,238,284,True,,
ChIJzfG-8ahZwokR5FLB4KmxBXI,Woorijip,07632c91c690a4fecb0242d7ea45e3c3,5,,a year ago,2023-04-24 16:08:42.129718,,,,0,2,1,False,,
ChIJzfG-8ahZwokR5FLB4KmxBXI,Woorijip,52488e799004854f4c1418933da598b1,5,This has been one of my favorite go-to spots for over 10 years. Ive visited more times than I could count. The food is always delicious and extremely affordable. I love how everything is already packaged so you can choose to dine-in or take-out. This place is always reliable and convenient.,a year ago,2023-04-24 16:08:42.131817,"Hi Jenny, thanks for taking the time to write this review about our place and for your business over the past decade. We look forward to providing you with these affordable and delicious options for the next 10+++ years!",a year ago,2023-04-24 16:08:42.131817,4,91,660,True,,
ChIJzfG-8ahZwokR5FLB4KmxBXI,Woorijip,07c6a760707aeb1f38422b339db269f1,5,"Food is cheap and since all the food is prepared already, the wait time is super short. The line moves quickly as well. When its lunch time, all the tables are full so go during non-meal times to get a seat. Food was coming out of the kitchen often as well so I know the food is fresh.",a year ago,2023-04-24 16:08:42.134573,,,,0,81,197,True,,
ChIJzfG-8ahZwokR5FLB4KmxBXI,Woorijip,63cc8b586e27458bfc86ec01685bf405,5,Our favorite quick Korean food shop. Its Our House on 32nd St!,a year ago,2023-04-24 16:08:42.136834,Thanks Strick! Youre welcome back to Our Home anytime,a year ago,2023-04-24 16:08:42.136834,0,97,247,True,,
ChIJzfG-8ahZwokR5FLB4KmxBXI,Woorijip,611a80796fbab167244a97a08fc3dd51,5,Worth the price!!,a year ago,2023-04-24 16:08:42.724120,,,,0,5,,False,,
ChIJzfG-8ahZwokR5FLB4KmxBXI,Woorijip,7b7e1d1a3b4fb92ab0ab2d2d9d2d40ed,5,Amaaazing place! Authentic Korean food and affordable for NY. Went here twice during my trip!,a year ago,2023-04-24 16:08:42.727579,We appreciate your review Anna! Hope you had a nice visit to NY and please stop in next time youre in town again.,a year ago,2023-04-24 16:08:42.727579,0,25,35,False,,
ChIJzfG-8ahZwokR5FLB4KmxBXI,Woorijip,d9d23f432db95ed5b157c159173df963,5,,a year ago,2023-04-24 16:08:42.731069,,,,0,8,11,True,,
ChIJzfG-8ahZwokR5FLB4KmxBXI,Woorijip,40dd4a66e9ffa7ace6f8aae198493531,5,,a year ago,2023-04-24 16:08:42.733643,,,,0,196,1116,True,,
ChIJzfG-8ahZwokR5FLB4KmxBXI,Woorijip,4304f4b78eaa6e0684519f44853af9f3,5,"I love this place. Have been coming here for several years but decided to leave a review bc I was especially impressed by the lunch special boxes this time. I think that these lunch specials are very filling and the prices are so affordable. Mine came with chicken cutlet, pan fried kimchee, crab cakes and a bed of rice. It also comes with miso soup on the side. You can also never go wrong with the bulgogi kimbap. Thank you to woorijip for consistently providing good service and fresh packaged food.",a year ago,2023-04-24 16:08:42.736449,"Hi Angel, thank you for appreciating the work we put into our service and menu items. Were very grateful for your support over years and look forward to having you come in again to try our new lunchboxes.",a year ago,2023-04-24 16:08:42.736449,1,6,20,False,,
ChIJzfG-8ahZwokR5FLB4KmxBXI,Woorijip,e24190aeb78620389d776959133ca15e,4,"Given that you dont pay much its pretty alright, especially being a spot for food in NYC. Nice for a quick eats",a year ago,2023-04-24 16:08:42.739150,,,,0,51,,False,,
ChIJzfG-8ahZwokR5FLB4KmxBXI,Woorijip,c83bb0dbc0cf87fe3aaf2d6afe2e3895,5,,a year ago,2023-04-24 16:08:42.741701,,,,0,34,303,False,,
ChIJzfG-8ahZwokR5FLB4KmxBXI,Woorijip,61b97a2362b4748161778564f241e1b7,5,"Was able to get a delicious tofu seafood stew with white rice and a drink for under 10 dollars. It was super yum and very affordable, especially for NYC!",a year ago,2023-04-24 16:08:42.743764,Great combo Anouk! Thanks for leaving us this nice review!,a year ago,2023-04-24 16:08:42.743764,0,4,,False,,
ChIJzfG-8ahZwokR5FLB4KmxBXI,Woorijip,609a62ed21f6d60d568df45830e00047,5,This place is truly amazing. If you love having Korean sides in yiur fridge as much I do this place is a must. Check out with cash to get a discount,a year ago,2023-04-24 16:08:42.746269,,,,0,6,5,True,,
ChIJzfG-8ahZwokR5FLB4KmxBXI,Woorijip,dccb417679f0cacc6cbf4d1d89ede791,5,very convenient and yummy,a year ago,2023-04-24 16:08:42.748624,so glad you enjoyed! please come again soon,a year ago,2023-04-24 16:08:42.748624,0,1,,False,,
ChIJzfG-8ahZwokR5FLB4KmxBXI,Woorijip,f5d3912788d99575cc444fa04a2bb40b,5,This is like going to a Seven Eleven in Asia where the bento boxes of delicious meals can be picked up and devoured on the go or seat and enjoy! The price is very reasonable but the taste lunches above its weight! Excellent food at excellent price!!,a year ago,2023-04-24 16:08:43.324452,SG - Thanks for your time to leaving this kind review and capturing the core of what we have to offer - convenience and great food at great prices. Take care!,a year ago,2023-04-24 16:08:43.324452,9,335,3599,True,,
ChIJzfG-8ahZwokR5FLB4KmxBXI,Woorijip,ff52e59c499d712c72d6241cd20df6cf,4,,a year ago,2023-04-24 16:08:43.328433,,,,0,,,,,
ChIJzfG-8ahZwokR5FLB4KmxBXI,Woorijip,c1afed69d05993da35fc5c07cddf1f39,5,,a year ago,2023-04-24 16:08:43.331363,,,,0,24,12,True,,
ChIJzfG-8ahZwokR5FLB4KmxBXI,Woorijip,004c67d53bcf937c257aa398831c4dc0,5,A treasure-like place I found in New York. The price is reasonable and it feels like home cooking. I was able to taste a variety of different types of Korean food.,a year ago,2023-04-24 16:08:43.333950,,,,1,70,7,False,.                .                         .,
ChIJzfG-8ahZwokR5FLB4KmxBXI,Woorijip,36f4c1caa926f369a4b4af90551701bb,5,,a year ago,2023-04-24 16:08:43.337235,,,,0,,,,,
ChIJzfG-8ahZwokR5FLB4KmxBXI,Woorijip,6b73c20e427a53bde05e02fb649be91d,5,The food is good and the price is great,a year ago,2023-04-24 16:08:43.339609,,,,0,5,3,False,,
ChIJzfG-8ahZwokR5FLB4KmxBXI,Woorijip,2620acbc1bd426c7989a683bc8b32479,5,"A great spot for casual Korean food with plenty of food options. There are also alcohol/non-alcoholic drinks to go along with your meal. Price range for small appetizers: $4-7, lunch/dinner combo: $6-$12. There are at least 20-30 varieties daily with some seasonal menu items. I was delighted to find the Stir fried octopus with kimchee fried rice. True enough it tasted even better than it look. The octopus was so tender and flavorful. I also bought the spicy pork. It was very tasty but a bit too salty for me. The garlic fried chicken was good but I wish it was less oily. During my visit I noticed the staff regularly sanitize dining tables and seats for the diners. Kudos to the management for ensuring a safe and hygienic environment for everyone visiting! Its an eye opener seeing prepared food constantly strolled on a cart every few minutes from the kitchens doorway to the display rack. The kitchen staff here definitely can cook up a storm of Korean food. My family and I have been coming here for more than a decade. We know Covid has been extremely challenging for restaurant owners and their employees. Thank you for continuing to make delicious Korean food with great quality and striving to make it affordable to everyone!! I truly appreciate the 8% discount offered to diners who pay with Cash. THANKS!!",a year ago,2023-04-24 16:08:43.342217,"Hi Mandy, a heartfelt thank you to you and your family for your support for the past ten years and recognizing the hard work we put into our food and establishment. We wouldnt be here today without customers like you!",a year ago,2023-04-24 16:08:43.342217,0,155,1614,True,,
ChIJzfG-8ahZwokR5FLB4KmxBXI,Woorijip,251343c7c3bd958fc70fd36fa7e00dd6,5,"Fast service, under $8 grab and go, meal boxes. Great deal",a year ago,2023-04-24 16:08:43.345109,"Please come again soon, thanks for the great review!",a year ago,2023-04-24 16:08:43.345109,0,56,49,True,,
ChIJzfG-8ahZwokR5FLB4KmxBXI,Woorijip,cba51c7356a087b1087d42ec9fbfcc78,5,"Im happy I found this place. Such a nice selection of different main dishes and side dishes, portions were good and so affordable. I was also happy to find out that they had my favorite Korean grape juice :) definitely gonna visit again.",a year ago,2023-04-24 16:08:43.347928,Thank you for coming Steph! Were so glad you enjoyed the variety and drink selection,a year ago,2023-04-24 16:08:43.347928,0,9,,False,,
ChIJzfG-8ahZwokR5FLB4KmxBXI,Woorijip,8886f7cfcb92a6c248bd69ecd8c1e1e3,5,Woorijip is one of our favorite places in Koreatown for takeout. I love their kimchi jeon and kimchi fried rice. Everything is fresh and always delicious. They also have a great selection of Korean beverages. Prices are reasonable as well.,a year ago,2023-04-24 16:08:43.350493,"Thank you Meltem for your outstanding review, please come again soon",a year ago,2023-04-24 16:08:43.350493,0,47,19,True,,
ChIJzfG-8ahZwokR5FLB4KmxBXI,Woorijip,332fca3620cdacd79055f85e414e4f20,5,,a year ago,2023-04-24 16:08:43.902438,,,,0,1,14,False,,
ChIJzfG-8ahZwokR5FLB4KmxBXI,Woorijip,6af0b6e7a104f78fe6ea0843afcf5fc9,5,Amazing concept. Really liked the food!,a year ago,2023-04-24 16:08:43.905362,Thanks Frank! Appreciate the 5 stars and see you again soon,a year ago,2023-04-24 16:08:43.905362,0,7,2,False,,
ChIJzfG-8ahZwokR5FLB4KmxBXI,Woorijip,e60abf2b0b208a0aafba3c4d80f00d05,5,,a year ago,2023-04-24 16:08:43.908809,,,,0,9,80,True,,
ChIJzfG-8ahZwokR5FLB4KmxBXI,Woorijip,781b10d74d48f1c03474582c226f8a0d,5,My favorite place for lunch! So many great options to choose from and incredibly great value,a year ago,2023-04-24 16:08:43.911369,"Appreciate your time in reviewing Risha, stop by again soon!",a year ago,2023-04-24 16:08:43.911369,0,24,3,False,,
ChIJzfG-8ahZwokR5FLB4KmxBXI,Woorijip,b24d0095b30d64e948d0d5743276c305,5,,a year ago,2023-04-24 16:08:43.914690,,,,0,23,5,True,,
ChIJzfG-8ahZwokR5FLB4KmxBXI,Woorijip,ae911e697d1095c38dec8aa968d22527,5,,a year ago,2023-04-24 16:08:43.916897,,,,0,102,20,False,,
ChIJzfG-8ahZwokR5FLB4KmxBXI,Woorijip,f7b2d77bf92214168d8a3666d05529d5,4,,a year ago,2023-04-24 16:08:43.918990,,,,0,25,11,True,,
ChIJzfG-8ahZwokR5FLB4KmxBXI,Woorijip,6886b938f40fe11e8db2fe7ec18e9709,5,"The local Korean spot that has made a place in my inner circles heart. This place is very local so expect the kids coming out of school to head here or those coming out of work as well. If you ever need to get something to eat but dont want to sit down and be served, this is the perfect place for you! The Food does change everyday, and by the hour due to temperature danger zones. So expect something different from morning to night. Woorijip is a cafeteria type of establishment; you pick a tray and load it up with all the goodies your soul and wallet desire. Once done, you could either dine in after paying and heat up the food in their microwave or take out and enjoy it on your couch! If you pay cash, they do currently offer a discount, so I highly suggest doing so! If I lived in Manhattan, I would go here everyday lol. But I do come here at least once a month now!  Bring your closest homies and come here after your early Karaoke session :) Vegetarian options: Items like bok choy and miso soup! Kid-friendliness: Drinks and food the kids would enjoy! Including delicious soda milk",a year ago,2023-04-24 16:08:43.921616,"Hi Amanda, thank you for taking the time to share your thoughts about Woorijip and for visiting all the way from out of town! We have always and will continue to carry out the strictest quality control measures to ensure food is fresh no matter what time of the day you come in. See you during your next visit!",a year ago,2023-04-24 16:08:43.921616,0,139,631,True,,
ChIJzfG-8ahZwokR5FLB4KmxBXI,Woorijip,7314f67da47febd4c4532f3adabdc9fd,5,Came here three years ago late at night with friends and we grabbed food from a buffet and then we payed by weight. So cheap and so tasty. Will be back anytime I visit Manhattan.,a year ago,2023-04-24 16:08:43.924151,"Thank you for your 5 star review Mathusan, see you during your next visit to Ktown.",a year ago,2023-04-24 16:08:43.924151,1,172,126,True,,
ChIJzfG-8ahZwokR5FLB4KmxBXI,Woorijip,cdf154621ca56de5177f5024f26b138c,5,"You grab and go, very good and fast Korean food.",a year ago,2023-04-24 16:08:43.926577,Thank you so much for this 5-star review. We really appreciate you being a customer and helping to share the word about us. We re here for you anytime.,a year ago,2023-04-24 16:08:43.926577,1,47,17,True,"Agarras y te vas, comida coreana muy buena y rapido.",
ChIJzfG-8ahZwokR5FLB4KmxBXI,Woorijip,75880a042790abb2b1c71d609f030468,5,Good Place for quick take out. Food was okay and price are affordable,a year ago,2023-04-24 16:08:44.527492,We are so grateful for your 5-star review. Thanks for sharing your rating with us and the community.,a year ago,2023-04-24 16:08:44.527492,0,29,32,True,,
ChIJzfG-8ahZwokR5FLB4KmxBXI,Woorijip,890216948d58823f8fc7a7ce8ee6bd2c,5,"The best in the city! Cheap, immediate pick up and delicious",a year ago,2023-04-24 16:08:44.531097,Thank you so much for taking the time to leave us a 5 star rating - its much appreciated!,a year ago,2023-04-24 16:08:44.531097,1,115,99,True,,
ChIJzfG-8ahZwokR5FLB4KmxBXI,Woorijip,5a0e170f0a74c3ff18f8c826a2f5eb67,5,,a year ago,2023-04-24 16:08:44.534364,Thank you so much for taking the time to leave us a 5-star review.,a year ago,2023-04-24 16:08:44.534364,0,162,104,True,,
ChIJzfG-8ahZwokR5FLB4KmxBXI,Woorijip,30ff11c8a5754238c8ab39d1ccf98954,5,Wide variety of freshly made foods at good prices. We have tried multiple dishes and all of them were great. Staff is friendly and they make sure to keep things running clean and smooth. The $10-14 lunch combo is plenty for one person.,a year ago,2023-04-24 16:08:44.537229,Thanks so much for sharing your experience with us. We hope to see you again soon.,a year ago,2023-04-24 16:08:44.537229,1,10,,False,,
ChIJzfG-8ahZwokR5FLB4KmxBXI,Woorijip,aa48313d081f4c8d46133d19d49ab26b,5,Many different variety of food. Great place to get lunch.,a year ago,2023-04-24 16:08:44.540146,We really appreciate you taking the time to share your rating with us. We look forward to seeing you again soon.,a year ago,2023-04-24 16:08:44.540146,1,57,2,True,,
ChIJzfG-8ahZwokR5FLB4KmxBXI,Woorijip,e10334d11e94c82f1d4be2ae451cfee0,5,Good value!!!,a year ago,2023-04-24 16:08:44.542746,Thank you so much for taking the time to leave us a 5-star review.,a year ago,2023-04-24 16:08:44.542746,0,71,40,True,,
ChIJzfG-8ahZwokR5FLB4KmxBXI,Woorijip,7c046b54af56804bd0b915a1757cdc95,3,,a year ago,2023-04-24 16:08:44.545236,,,,0,542,1229,True,,
ChIJzfG-8ahZwokR5FLB4KmxBXI,Woorijip,0f08d05d7e6a49ceb129f870b49be3f0,5,"Great place. Everything is dished and all u do is take up as much as you like and head to the cashier. Very good prices, delicious food.",a year ago,2023-04-24 16:08:44.547184,Thank you so much for taking the time to leave an excellent rating. We really appreciate your business. Please let us know what we can do for you in the future.,a year ago,2023-04-24 16:08:44.547184,0,67,20,True,,
ChIJzfG-8ahZwokR5FLB4KmxBXI,Woorijip,675f9750affce64936e9529b66f54628,5,"Great little place to grab some quick variety of packaged dishes like seafood pancake, takoyaki, eel over rice, Bulgogi, banchan, hot soups, etc. There are high tables and seats for you to dine in after purchase and a cute little microwave in the back (pay to use). They offer 8% off if you pay in cash.",a year ago,2023-04-24 16:08:44.549864,We appreciate your review Karen. Youve mentioned some of our customer favorites from quick bites to lunchboxes. We look forward to continuing to provide that kind of variety and hope to see you soon.,a year ago,2023-04-24 16:08:44.549864,3,118,260,True,,
ChIJzfG-8ahZwokR5FLB4KmxBXI,Woorijip,99c39657af835e1552d2f4ad683d5bd6,5,A great lil spot for a variety of authentic Korean dishes at an unbeatable price! My go to is the japchae and the kimbap!,a year ago,2023-04-24 16:08:44.552258,Classics at a great price! thanks for the review Andrew.,a year ago,2023-04-24 16:08:44.552258,1,42,16,False,,
ChIJzfG-8ahZwokR5FLB4KmxBXI,Woorijip,fa6050c3db6ac434bc74b65b97f8f77f,5,,a year ago,2023-04-24 16:08:45.231844,,,,0,1,18,False,,
ChIJzfG-8ahZwokR5FLB4KmxBXI,Woorijip,6ade9d424adcbd3bc4080be6dcc12c64,5,"Very good, attendant Sabrina very polite",a year ago,2023-04-24 16:08:45.235067,,,,0,21,1,False,"Muito boa, atendente Sabrina muito educada",
ChIJzfG-8ahZwokR5FLB4KmxBXI,Woorijip,e82fd408b7cd5b5d46e7fcb7e5b3d99a,5,You can taste a variety of Korean food at an affordable price. It was clean and well organized and all the food was fresh and delicious.,a year ago,2023-04-24 16:08:45.238739,Thank your for your nice note about Woorijip and appreciating our layout and price.  Please come back again soon.,a year ago,2023-04-24 16:08:45.238739,2,222,4117,True,,
ChIJzfG-8ahZwokR5FLB4KmxBXI,Woorijip,c77b63b019ae9a4f24cafbf4279b8502,5,It s real Korean kimbap!! The appetite that was lost in New York has returned.,a year ago,2023-04-24 16:08:45.242607,"Thank you for your awesome review of our Kimbap, please come back again soon and try all of them!",a year ago,2023-04-24 16:08:45.242607,0,53,16,False,!!,
ChIJzfG-8ahZwokR5FLB4KmxBXI,Woorijip,27a3032f2189220783028885a8c7d70e,4,,a year ago,2023-04-24 16:08:45.246170,,,,0,8,,False,,
ChIJzfG-8ahZwokR5FLB4KmxBXI,Woorijip,cfc72a24ddf505af36908169a44d54fe,4,Food was pretty cheap and you get 8% off for paying cash.,a year ago,2023-04-24 16:08:45.248252,,,,0,50,7,True,,
ChIJzfG-8ahZwokR5FLB4KmxBXI,Woorijip,5ea2e7e0595f77a2d8d83ada080b647c,4,,a year ago,2023-04-24 16:08:45.250707,,,,0,8,4,True,,
ChIJzfG-8ahZwokR5FLB4KmxBXI,Woorijip,eb3169c6167b64b7e65e02846829f3ba,5,Love the idea. I wish the place was bigger so people wont have to fight for a place to sit,a year ago,2023-04-24 16:08:45.252914,"Thanks for your review Momo, please let us know if you have any difficulty next time youre in and wed be more than glad to help you find a table.",a year ago,2023-04-24 16:08:45.252914,0,478,2805,True,,
ChIJzfG-8ahZwokR5FLB4KmxBXI,Woorijip,23e3381f78e00100cb5882b9c002c341,5,Variois kind of delicious foods in reasonable price. It is good to buy the small package of side dishes.,a year ago,2023-04-24 16:08:45.256160,"Hi John, we are proud of our homemade banchan section and glad you have been enjoying it. Thanks for your review!",a year ago,2023-04-24 16:08:45.256160,0,2,22,False,,
ChIJzfG-8ahZwokR5FLB4KmxBXI,Woorijip,7267179fce6ba65aa16193f5daad5997,5,"Probably my new favorite lunch spot. Excellent prices, love the setup, food is quality.  I will be back!",a year ago,2023-04-24 16:08:45.258765,,,,3,2,,False,,
ChIJzfG-8ahZwokR5FLB4KmxBXI,Woorijip,a8529d13cd65e992def418f18e40a9dd,5,,a year ago,2023-04-24 16:08:45.893039,,,,0,33,211,True,,
ChIJzfG-8ahZwokR5FLB4KmxBXI,Woorijip,b10f205df322ec79870bc17ee717acbc,5,Salarymans choice,a year ago,2023-04-24 16:08:45.896199,,,,0,27,7,True,,
ChIJzfG-8ahZwokR5FLB4KmxBXI,Woorijip,d0ffb1bffa2b0da2d1c85c21b62d7f71,5,LOVE IT! The food is really good and quite affordable! Dine in: Yes Outdoor seating: No Takeout: Yes,a year ago,2023-04-24 16:08:45.899100,Appreciate your review Lila! So glad you enjoyed,a year ago,2023-04-24 16:08:45.899100,0,26,28,True,,
