place_name,rating,review_text,published_at_date,prep,sentiment,review_sentiment
Woorijip,5,,2024,,1,0.0
Woorijip,4,,2024,,1,0.0
Woorijip,5,,2024,,1,0.0
Woorijip,5,"This place is like a ray of light when you miss Korean food while traveling... The variety is varied and delicious. However, the interior of the restaurant is very crowded, so take-out is recommended.",2024,place ray light miss korean food travel varieti vari delici interior restaur crowd recommend,1,0.2263
Woorijip,4,Got the kimchi rice with egg and it was just alright. Maybe need to be reheated.,2024,kimchi rice egg alright reheat,1,0.25
Woorijip,5,,2024,,1,0.0
Woorijip,5,"My favorite restaurant in Koreatown. You can pick and choose to make your own meal. They offer a variety of dishes. Good for dining there or takeout. It s a self-serve styled restaurant. You get your food, you pay at the cashier and you go find your own seat. The staff is quite friendly every time I was there. On top of that, it s quite affordable compared to the other Korean restaurants nearby. The only downside is the seating area can be a bit crowded during rushed hours.",2024,favorit restaur koreatown pick choos make meal offer varieti dish good dine takeout serv style restaur food pay cashier find seat staff friendli time top afford compar korean restaur nearbi downsid seat area bit crowd rush hour,1,0.5106
Woorijip,4,Well I was not careful enough and it was a rainy day so I didnt bother...,2024,care raini day didnt bother,1,0.6412
Woorijip,5,This place is a cheap convenient place to grab and go Korea food. The food are surprising really good.,2024,place cheap conveni place grab korea food food surpris good,1,0.4404
Woorijip,5,"Great concept of the grab & go, although the food isn t hot, it s still warm and fresh. They have microwaves to heat up dishes. There was plenty of seating and a good selection of drinks. The prices are reasonable and staff was nice.",2024,great concept grab food isn hot warm fresh microwav heat dish plenti seat good select drink price reason staff nice,1,0.9186
Woorijip,5,,2024,,1,0.0
Woorijip,3,,2024,,0,0.0
Woorijip,5,"Authentic, legit Korean food in K-Town  must go",2024,authent legit korean food town,1,0.0
Woorijip,5,,2024,,1,0.0
Woorijip,5,"Good quality food served in a cafeteria style atmosphere. It s a great place if you are looking for fresh and convenient grab and go meals without having to wait. However, I wish they clearly marked their vegan or vegetarian options - which they have plenty of. Another great thing about this place. Secondly, the prices for these prepackaged takeout dishes are comparable to the neighboring Korean restaurants that provide full service. You would think it would be less pricey here since dishes aren t made to order and customers don t require full service or a lot of space. Just something to think about. Vegetarian options: Vegetable kimbap, seaweed salad, vegetable banchan.",2024,good qualiti food serv cafeteria style atmospher great place fresh conveni grab meal wait mark vegan vegetarian option plenti great thing place price prepackag takeout dish compar neighbor korean restaur provid full servic pricey dish aren made order custom don requir full servic lot space vegetarian option veget kimbap seawe salad veget banchan,1,0.9246
Woorijip,5,"so good, cheap and easy, tons of delicious options, including a lot of vegan/vegetarian options, also fast if needed. two meals worth for $20",2024,good cheap easi ton delici option includ lot vegan vegetarian option fast need meal worth,1,0.5859
Woorijip,3,,2024,,0,0.0
Woorijip,4,"In this Korean bento shop, you can find all the familiar Korean dishes. You can also find a seat after paying the bill. It is crowded during dinner time, but there will be no shortage of seats. Food is salty.",2024,korean bento shop find familiar korean dish find seat pay bill crowd dinner time shortag seat food salti,1,-0.1027
Woorijip,4,"Went in for a quick pick up & go run for my sis & nephew. Literally, I was there for 3 mins tops as I was trying to race to catch the LIRR. But, staff is polite. Food is tasty. I just grabbed like 4 different Kimbaps paid & left to catch my train. The kimbaps are tasty. Its esthetically pleasing as well.  I didnt get to really look around. Most of the shelves were empty so, I cant say how great it is until I come back when theyre fully stocked. I was there a little after 8:30PM last night. They close at 9PM. 4 stars for now.",2024,quick pick run si nephew liter min top race catch lirr staff polit food tasti grab kimbap paid left catch train kimbap tasti esthet pleas didnt shelv empti great back theyr fulli stock pm night close pm star,1,-0.3599
Woorijip,4,,2024,,1,0.0
Woorijip,5,,2024,,1,0.0
Woorijip,5,Best spot for Korean food U pick up a small tray and choose the food u want from the shelves and pay at the counter if u are sitting over there to eat heat up your food Food : 5/5,2024,spot korean food pick small tray choos food shelv pay counter sit eat heat food food,1,-0.1027
Woorijip,4,Decent place for all kinds of home-style Korean dishes. Not necessary super delicious but a great choice to grab a bite fast and healthy.,2024,decent place kind home style korean dish super delici great choic grab bite fast healthi,1,0.9081
Woorijip,5,"Cafeteria style Korean joint that serves delicious, no frills staples. The Japchae with Beef Bulgogi is always good and one of my favorites. I always stop by for take out whenever Im in the area. Not a good place to linger and eat your meal though as it tends to be crowded and people are always looking for a table.",2024,cafeteria style korean joint serv delici frill stapl japcha beef bulgogi good favorit stop im area good place linger eat meal crowd peopl tabl,1,0.5574
Woorijip,4,,2024,,1,0.0
Woorijip,4,,2024,,1,0.0
Woorijip,2,It s kind of a fast pace grab your food and check-out thing. The food looked really tasty but it s not actually that good. Lacking flavor.,2024,kind fast pace grab food check thing food look tasti good lack flavor,-1,0.6124
Woorijip,5,,2024,,1,0.0
Woorijip,5,,2024,,1,0.0
Woorijip,5,"Cafeteria grab and go quick on a tray vibe. Perfect for fast lunch or late night bite, plus its cheap for the amount of food you get and the food is gooood. 10/10 recommend. They charge you a fee for credit card though, so bring cash if you dont want to pay.",2024,cafeteria grab quick tray vibe perfect fast lunch late night bite cheap amount food food gooood recommend charg fee credit card bring cash dont pay,1,0.8441
Woorijip,5,"Meats are all cooked very quickly by the staff, it was so impressive! Loved the galbijiim! William is the best server!",2024,meat cook quickli staff impress love galbijiim william server,1,0.7964
Woorijip,5,"The foods that I got aren t listed. I love their crab cake, Tteok-bokki, shrimp roll and chicken cutlet pan fried kimchi",2024,food aren list love crab cake tteok bokki shrimp roll chicken cutlet pan fri kimchi,1,0.6369
Woorijip,5,"The food variety is wide, the flavors are really good and all of the food is served in plastic containers (like when you order delivery) and its ready to eat. If you feel that the temperature is not warm enough to eat, you can use a microwave. The variety of drinks are also wide, they offer from  juice, to soda and even alcoholic drinks (you need to provide your ID). I recommend this place, its affordable and good; the customer service is also good. The cost of the food depends on your appetite, but its cheap if you eat small portions.",2024,food varieti wide flavor good food serv plastic contain order deliveri readi eat feel temperatur warm eat microwav varieti drink wide offer juic soda alcohol drink provid id recommend place afford good custom servic good cost food depend appetit cheap eat small portion,1,0.9022
Woorijip,5,,2024,,1,0.0
Woorijip,4,"The food is good considering the price and portion size. I wouldnt recommend ordering soju there though, as its much more expensive compared to what you can get at a liquor store its double or even triple the price. Unfortunately, they dont allow BYO either.",2024,food good price portion size wouldnt recommend order soju expens compar liquor store doubl tripl price dont byo,1,0.1999
Woorijip,5,"If you are looking for cheap, healthy, tasty meals, this place is perfect for you There are so many options to choose, all of them tasted good. Nice mix with meat and vegetable and Korean sauces. Also good for take out",2024,cheap healthi tasti meal place perfect option choos tast good nice mix meat veget korean sauc good,1,0.9062
Woorijip,5,"felt so lucky discovering this place! They served to-go dishes, or called  dosirak  in korean. Everything packed in boxes. The menu varies, you can find common korean dishes such as jjapchae, kimchi fried rice, bibimbap, bulgogi, egg rolls, etc. They also have special menu each week. Price mostly range from $5-$10. Very good value of money given the location. Microwaves are provided. The place is always crowded, but the tables are not that many. Recommend: jjapchae! But i will come back to try moreee.",2024,felt lucki discov place serv dish call dosirak korean pack box menu vari find common korean dish jjapcha kimchi fri rice bibimbap bulgogi egg roll special menu week price rang good money locat microwav provid place crowd tabl recommend jjapcha back moree,1,0.7964
Woorijip,5,"Great grab and go place in the heart of K-town. If you re trying to dine in, it can get busy and hard to find a spot to sit. Not the best for large groups.",2024,great grab place heart town dine busi hard find spot sit larg group,1,0.5719
Woorijip,5,"I got food recommendations from the cashier Zhang, and everything was cheap and also delicious! I highly recommend this place.",2024,food recommend cashier zhang cheap delici highli recommend place,1,0.6124
Woorijip,5,,2024,,1,0.0
Woorijip,5,Affordable lunch food with a decently sized seating area. You can heat up food that you purchase in the microwave in the back.,2024,afford lunch food decent size seat area heat food purchas microwav back,1,0.0
Woorijip,1,Food was ok but don t expect any attentive services from servers or manager(i don t think they have any).,2024,food don expect attent servic server manag don,-1,0.0
Woorijip,5,,2024,,1,0.0
Woorijip,2,"The food is good and their selection has expanded, but over the course of the year, prices have increased noticeably and the portions have gotten smaller.",2024,food good select expand year price increas notic portion smaller,-1,0.6369
Woorijip,1,"The food is good. However, this place uses an absurd amount of plastic, everything is in plastic containers, and don t provide a recycling bin for the containers, only a tiny one for cans and bottles. It is an easy fix as well, just put a big recycling bin next to the regular bin. Especially alarming seeing how many people are in the store and throwing out containers straight into the landfills can (yes they are using black plastic bag). If your whole business model is based on selling things in containers and did well, I m certain that you re profitable enough to at least take some accountability for the environment. This hurts the environment so much I can t recommend anyone around me to go and contribute to this damage, even when the food is good. Putting in 1 star hoping to get management s attention",2024,food good place absurd amount plastic plastic contain don provid recycl bin contain tini can bottl easi fix put big recycl bin regular bin alarm peopl store throw contain straight landfil black plastic bag busi model base sell thing contain profit account environ hurt environ recommend contribut damag food good put star hope manag attent,-1,0.8481
Woorijip,5,Cheap & delicious,2024,cheap delici,1,0.0
Woorijip,5,One of my comfort food in NYC. I usually take out. There are a lot of options. Spicy tuna kimbap and tofu soup are great!,2024,comfort food nyc lot option spici tuna kimbap tofu soup great,1,0.765
Woorijip,5,"This casual takeout spot in ktown sells almost all korean bentos under $10 (extra 8% off if you pay in cash)-- utterly unbelievable in the most expensive city in the world. At this price point I really didnt expect much, but they were actually pretty delicious. Most of the bentos are still warm, and you can microwave them at the self-service corner. There are also plenty of seatings for you to enjoy your meal. Inari Sushi $4.5 The assorted rice enveloped inside the tofu pockets hit the sweet spot. This was cheaper and tastier than the inari I bought at Wegmans. Crab Meat Jeon $6.5 Five big pieces of jeon were packed in a box. Each jeon was stuffed with crab meat, scallions and corn. Well seasoned, not too oily. Of course it wasnt comparable to those served in a restaurant, but they were good enough to satisfy your cravings. Banana Milk $2.5",2024,casual takeout spot ktown sell korean bento extra pay cash utterli unbeliev expens citi world price point didnt expect pretti delici bento warm microwav servic corner plenti seat enjoy meal inari sushi assort rice envelop insid tofu pocket hit sweet spot cheaper tastier inari bought wegman crab meat jeon big piec jeon pack box jeon stuf crab meat scallion corn season oili wasnt compar serv restaur good satisfi crave banana milk,1,0.886
Woorijip,5,"Food is just... There, ready all the time. And its good, and cheap.   like this place a lot. Im just sad i didnt know it existed sooner. A great option for a lunch while walking if you can walk through ktown on the way to work.   was full for just under $20. Cashiers are very nice as well. Vegetarian options: All vegetarian options (except for things like white rice and plain veggies) will say (veg) on them.  ts very nice of them to do that.",2024,food readi time good cheap place lot im sad didnt exist sooner great option lunch walk walk ktown work full cashier nice vegetarian option vegetarian option thing white rice plain veggi veg ts nice,1,0.2746
Woorijip,5,The most delicious and affordable restaurant in New York!,2024,delici afford restaur york,1,0.0
Woorijip,5,,2024,,1,0.0
Woorijip,5,,2024,,1,0.0
Woorijip,5,,2024,,1,0.0
Woorijip,5,,2024,,1,0.0
Woorijip,5,Great selection and very reasonable prices for the quality of food that they offer.,2024,great select reason price qualiti food offer,1,0.6249
Woorijip,5,This was my first time in NY and trying this food. I watch a lot of K-dramas and was dying to try some dishes. I Googled Korean  buffets and this place came up. Yet it is not the kind of buffet you would expect. The only thing that is hot is the rice. They are pre-packaged and after paying you use a microwave to warm up. Bags are 5 cents and seating is limited but was very satisfied.,2024,time ny food watch lot drama die dish googl korean buffet place kind buffet expect thing hot rice pre packag pay microwav warm bag cent seat limit satisfi,1,0.0
Woorijip,5,,2024,,1,0.0
Woorijip,5,,2024,,1,0.0
Woorijip,5,,2024,,1,0.0
Woorijip,5,Quick pickup and dining experience!,2024,quick pickup dine experi,1,0.0
Woorijip,5,Good Korean food for rock bottom prices. What else do you need?,2024,good korean food rock bottom price,1,0.4404
Woorijip,5,"My girlfriend and I come here every time we are around the area to get an affordable, home made meal. The food tastes amazing, I wish I could eat this every day! However, sometimes it can be very crowded and hard to walk around",2024,girlfriend time area afford home made meal food tast amaz eat day crowd hard walk,1,-0.1027
Woorijip,5,"Delicious food at a very reasonable price! They have a ton of options of grab and go food, and labeled vegetarian food too. They also have limited seating and microwaves so you can heat up what you bought if you need. I got the japchae, which was so delicious!",2024,delici food reason price ton option grab food label vegetarian food limit seat microwav heat bought japcha delici,1,0.0
Woorijip,3,,2024,,0,0.0
Woorijip,5,"Good food, we got spicy rice cakes, Japense fried chicken, rice, and spice rice cake skewers. Wasn t a long line, and ladies at the counter were nice.",2024,good food spici rice cake japens fri chicken rice spice rice cake skewer wasn long line ladi counter nice,1,0.6908
Woorijip,5,Excellent food,2024,excel food,1,0.4588
Woorijip,5,Good prices for really good food and also great variety,2024,good price good food great varieti,1,0.872
Woorijip,5,,2024,,1,0.0
Woorijip,5,"Amazing to grab something to go. The food is delicious and at a good price. You can also eat on site, but theres not much space.",2024,amaz grab food delici good price eat site space,1,0.4404
Woorijip,5,"During my visit to Woorojip in Korean Town, New York, I was pleasantly surprised by the diverse array of food options and the affordable prices. This establishment offers a unique dining experience where customers can select their desired dishes and pay at the cashier. Woorojip boasts an impressive selection of food, catering to various tastes and preferences. The convenience of having the food neatly packed in plastic boxes allows patrons to easily choose their desired items. This self-serve system adds a sense of freedom and flexibility to the dining experience. The affordability of the food at Woorojip is another noteworthy aspect. Despite the wide range of options available, the prices remain reasonable, making it an ideal destination for those looking for a satisfying meal without breaking the bank. Its refreshing to find a place that offers such quality food at an affordable price point. However, what truly sets Woorojip apart is the exceptional taste of their dishes. Each bite is a burst of flavors that leave a lasting impression. From the traditional Korean delicacies to the international fare, the food at Woorojip is a true delight for the taste buds. The combination of quality ingredients and skilled preparation creates a memorable culinary experience. The self-service system at Woorojip, where you can choose your desired dishes and pay at the cashier, adds to the overall convenience. It allows for a quick and hassle-free dining experience, perfect for those on the go or looking for a casual meal. If youre in search of a place with a great selection of food, affordable prices, and exceptional taste, Woorojip in Korean Town, New York, is the place to be. The self-serve system makes it easy to choose your desired dishes, and the flavors are sure to satisfy your cravings. Dont miss out on this hidden gem that offers a convenient and flavorful feast for all.",2024,visit woorojip korean town york pleasantli surpris divers array food option afford price establish offer uniqu dine experi custom select desir dish pay cashier woorojip boast impress select food cater tast prefer conveni food neatli pack plastic box patron easili choos desir item serv system add sens freedom flexibl dine experi afford food woorojip noteworthi aspect wide rang option price remain reason make ideal destin satisfi meal break bank refresh find place offer qualiti food afford price point set woorojip except tast dish bite burst flavor leav last impress tradit korean delicaci intern fare food woorojip true delight tast bud combin qualiti ingredi skill prepar creat memor culinari experi servic system woorojip choos desir dish pay cashier add conveni quick hassl free dine experi perfect casual meal your search place great select food afford price except tast woorojip korean town york place serv system make easi choos desir dish flavor satisfi crave dont miss hidden gem offer conveni flavor feast,1,0.9857
Woorijip,5,"Huge variety of delicious, inexpensive korean food",2024,huge varieti delici inexpens korean food,1,0.3182
Woorijip,3,"Haven t been in a few years and upon returning today I missed the old steam trays for hot offerings. Now everything is in sealed plastic containers, and there are microwaves for customer use for reheating past the cashiers. Still great selection / tasty food / a bit pricey, but any food that s meant to be crispy goes soggy in the microwave - including the fried shrimp siu mai and the gochujang chicken I had today.",2024,haven year return today miss steam tray hot offer seal plastic contain microwav custom reheat past cashier great select tasti food bit pricey food meant crispi soggi microwav includ fri shrimp siu mai gochujang chicken today,0,0.5423
Woorijip,5,"holy value batman if you miss the kimchi and/or kimchi fried rice here, youre lying to yourself. Food",2024,holi batman miss kimchi kimchi fri rice your lie food,1,-0.1531
Woorijip,3,,2024,,0,0.0
Woorijip,3,,2024,,0,0.0
Woorijip,5,I like stopping by this place for a quick dinner after work. The food is good and there is great variety.,2024,stop place quick dinner work food good great varieti,1,0.7003
Woorijip,5,Delicious and reasonable priced Korean food. Especially loved the Gochujang Chicken   I ll miss it very much!,2024,delici reason price korean food love gochujang chicken ll miss,1,0.5574
Woorijip,5,,2024,,1,0.0
Woorijip,5,Great spot to grab lunch. Food is great and the service is super quick.,2024,great spot grab lunch food great servic super quick,1,0.9201
Woorijip,5,,2024,,1,0.0
Woorijip,4,"It is a nice place, where you eat the food you like, the orange chicken was delicious and the rice, I loved the pink ginger, I wish they had spicy sauces.",2024,nice place eat food orang chicken delici rice love pink ginger spici sauc,1,0.7906
Woorijip,5,Good food for cheaper price than the restaurant In this area and tastes home cooked,2024,good food cheaper price restaur area tast home cook,1,0.4404
Woorijip,5,"Really cool place to get Korean food, recommend it 100%",2024,cool place korean food recommend,1,0.5859
Woorijip,5,"The food was delicious & the staff was very friendly! Ill definitely keep this spot in mind next time Im in town. Dietary restrictions: Unfortunately, allergens are not labeled. However, the staff was able to help us find options for my spouse who has a dairy allergy.",2024,food delici staff friendli ill spot mind time im town dietari restrict allergen label staff find option spous dairi allergi,1,-0.6597
Woorijip,4,,2024,,1,0.0
Woorijip,1,Dude... Change up your map with the operation time. Showed up for nothing again....,2024,dude chang map oper time show,-1,0.0
Woorijip,5,"This is a Korean side dish restaurant style restaurant. After paying, you heat it up in the microwave yourself. Since soft tofu stew, kimchi fried rice, and seafood and green onion pancake all fail, I think it will be delicious no matter what I eat!!!!! The best Korean restaurant with affordable prices and delicious food",2024,korean side dish restaur style restaur pay heat microwav soft tofu stew kimchi fri rice seafood green onion pancak fail delici matter eat korean restaur afford price delici food,1,-0.5859
Woorijip,4,,2024,,1,0.0
Woorijip,5,,2024,,1,0.0
Woorijip,4,,2024,,1,0.0
Woorijip,5,"We had the tofu soup, clear glass noodle kimbop, kimchi tofu with rice. Everything was delicious, freshly made and packed in easy to pick boxes. Would highly recommend if people want to mix and match different menu options, and well under budget.",2024,tofu soup clear glass noodl kimbop kimchi tofu rice delici freshli made pack easi pick box highli recommend peopl mix match menu option budget,1,0.6249
Woorijip,5,The food was delicious! It was affordable and had many options. Definitely a must try in NYC.,2024,food delici afford option nyc,1,0.0
Woorijip,5,"It is the best Korean restaurant in New York ever!! Resonable price! You can buy foods and eat it in the place!! The system where you can buy and eat various foods at a reasonable price is great. Basically, everything tastes delicious!!",2023,korean restaur york reson price buy food eat place system buy eat food reason price great basic tast delici,1,0.6249
Woorijip,3,Used to come here every time passing KTown. It s a bit too crowded now and the prices are up too.,2023,time pass ktown bit crowd price,0,0.0
Woorijip,5,Amazing Korean food place.,2023,amaz korean food place,1,0.0
Woorijip,5,,2023,,1,0.0
Woorijip,3,Fun takeout place. The staff is friendly and helpful. Not the most comfortable seating.,2023,fun takeout place staff friendli help comfort seat,0,0.8176
Woorijip,5,I took 5 different dishes to go. Excellent food!!Easy to heat up. I will be back next time I visit.,2023,dish excel food easi heat back time visit,1,0.4588
Woorijip,5,"Food: 10/10 Service: 9.5/10 Atmosphere: 6/10 My family and I dined in, got take out from this place many times and never were disappointed. The food is always fresh, customer service is great. Atmosphere is always feeling busy and rush. Well it is NYC which is understandable.",2023,food servic atmospher famili dine place time disappoint food fresh custom servic great atmospher feel busi rush nyc understand,1,0.5719
Woorijip,1,The food was fine but this was the first time I have had such terrible customer service over the years that Ive come here. The cashier was very rude and the line wasnt even busy. Very disappointed.,2023,food fine time terribl custom servic year ive cashier rude line wasnt busi disappoint,-1,0.015
