place_name,rating,review_text,published_at_date,prep,sentiment,review_sentiment
Woorijip,4,"Honestly wanted to love this place until we witnessed some discrimination against black people. The cashier who helped us was very nice, but either the owner or the janitor was busy checking peoples receipts asking why their tray is not on the table total bs imo since nobody told us anything about it when checking out. If you look at our table photo, we purchased so many dishes we literally didnt have a place to put tray on the table and the place was really packed. So... Despite how much we enjoyed the concept of the store, I might pass going forward. Also, the street smells so bad probably rotten kimchi",2023,honestli want love place wit discrimin black peopl cashier help nice owner janitor busi check peopl receipt tray tabl total bs imo told check tabl photo purchas dish liter didnt place put tray tabl place pack enjoy concept store pass forward street smell bad rotten kimchi,1,0.7506
Woorijip,5,,2023,,1,0.0
Woorijip,5,,2023,,1,0.0
Woorijip,2,"Good food, but could be better by using whole grains such as brown and black rice. Also, totally racist. They kicked a black patron out just a few minutes after he got his food for not buying anything despite him having a receipt and containers.",2023,good food grain brown black rice total racist kick black patron minut food buy receipt contain,-1,-0.2732
Woorijip,5,"Woorijip is definitely different in comparison to other places we have eaten at. It is kind of similar to a dining hall filled with home cooked meals and honestly we are all for it. We loved the ability to peruse all of our options rather than just looking at them through pictures. Our stopping point was when our tray got too heavy and we could not put anything more on it. Our favorite dish that we got here was the soondubu. Additionally, since everything already comes packaged it is so convenient to take out or eat there! We cannot wait to come back. Literally drooling thinking about our meal here.",2023,woorijip comparison place eaten kind similar dine hall fill home cook meal honestli love abil perus option pictur stop point tray heavi put favorit dish soondubu addit packag conveni eat wait back liter drool think meal,1,0.7506
Woorijip,5,You can get food really easily and just start eating.,2023,food easili start eat,1,0.0
Woorijip,5,The food here is so on point and affordable. Everything is setup like a buffet so you can pick and choose which dishes youd like. Takeout or eat in at their dining area. There is a microwave to heat up your food if needed.,2023,food point afford setup buffet pick choos dish youd takeout eat dine area microwav heat food need,1,0.0
Woorijip,5,Consistently delicious food. Love swinging by Woorijip for a quick meal.,2023,consist delici food love swing woorijip quick meal,1,0.6369
Woorijip,4,Great place to grab soju while you wait for a table for BBQ.,2023,great place grab soju wait tabl bbq,1,0.6249
Woorijip,5,"I had the gochujang chicken and kimchi fried rice here today, and it was very good. I love these sorts of korean grab and go hot meal restaurants, and theres so many choices, and so far theyre 2 for 2, but Ill be back to try other things soon!",2023,gochujang chicken kimchi fri rice today good love sort korean grab hot meal restaur choic theyr ill back thing,1,0.6486
Woorijip,5,Love this place! Affordable and delish food. Staff are friendly too!,2023,love place afford delish food staff friendli,1,0.6369
Woorijip,3,,2023,,0,0.0
Woorijip,4,Quick easy and inexpensive Korean comfort food.,2023,quick easi inexpens korean comfort food,1,0.3612
Woorijip,4,Been a solid take out place for cheap Korean eats since more than a decade,2023,solid place cheap korean eat decad,1,0.1531
Woorijip,5,"This place had the absolute best food, me and my brother had been touring the city and wanted to pickup something really quickly to take back to the hotel and call it a night, the service was friendly and very helpful, definitely going to become a regular once I move to Manhattan !!",2023,place absolut food brother tour citi want pickup quickli back hotel call night servic friendli help regular move manhattan,1,0.4588
Woorijip,2,,2023,,-1,0.0
Woorijip,5,The gochujang chicken was definitely my favorite! Lots of options at affordable prices. Quick and friendly service It really is like a 7-11 in Asia. So many meals available to eat,2023,gochujang chicken favorit lot option afford price quick friendli servic asia meal eat,1,0.0
Woorijip,5,,2023,,1,0.0
Woorijip,5,This has been one of my favorite go-to spots for over 10 years. Ive visited more times than I could count. The food is always delicious and extremely affordable. I love how everything is already packaged so you can choose to dine-in or take-out. This place is always reliable and convenient.,2023,favorit spot year ive visit time count food delici extrem afford love packag choos dine place reliabl conveni,1,0.6369
Woorijip,5,"Food is cheap and since all the food is prepared already, the wait time is super short. The line moves quickly as well. When its lunch time, all the tables are full so go during non-meal times to get a seat. Food was coming out of the kitchen often as well so I know the food is fresh.",2023,food cheap food prepar wait time super short line move quickli lunch time tabl full meal time seat food come kitchen food fresh,1,0.7351
Woorijip,5,Our favorite quick Korean food shop. Its Our House on 32nd St!,2023,favorit quick korean food shop hous st,1,0.0
Woorijip,5,Worth the price!!,2023,worth price,1,0.2263
Woorijip,5,Amaaazing place! Authentic Korean food and affordable for NY. Went here twice during my trip!,2023,amaaaz place authent korean food afford ny trip,1,0.0
Woorijip,5,,2023,,1,0.0
Woorijip,5,,2023,,1,0.0
Woorijip,5,"I love this place. Have been coming here for several years but decided to leave a review bc I was especially impressed by the lunch special boxes this time. I think that these lunch specials are very filling and the prices are so affordable. Mine came with chicken cutlet, pan fried kimchee, crab cakes and a bed of rice. It also comes with miso soup on the side. You can also never go wrong with the bulgogi kimbap. Thank you to woorijip for consistently providing good service and fresh packaged food.",2023,love place come year decid leav review bc impress lunch special box time lunch special fill price afford mine chicken cutlet pan fri kimche crab cake bed rice miso soup side wrong bulgogi kimbap woorijip consist provid good servic fresh packag food,1,0.9274
Woorijip,4,"Given that you dont pay much its pretty alright, especially being a spot for food in NYC. Nice for a quick eats",2023,dont pay pretti alright spot food nyc nice quick eat,1,0.3304
Woorijip,5,,2023,,1,0.0
Woorijip,5,"Was able to get a delicious tofu seafood stew with white rice and a drink for under 10 dollars. It was super yum and very affordable, especially for NYC!",2023,delici tofu seafood stew white rice drink dollar super yum afford nyc,1,0.5994
Woorijip,5,This place is truly amazing. If you love having Korean sides in yiur fridge as much I do this place is a must. Check out with cash to get a discount,2023,place amaz love korean side yiur fridg place check cash discount,1,0.6369
Woorijip,5,very convenient and yummy,2023,conveni yummi,1,0.0
Woorijip,5,This is like going to a Seven Eleven in Asia where the bento boxes of delicious meals can be picked up and devoured on the go or seat and enjoy! The price is very reasonable but the taste lunches above its weight! Excellent food at excellent price!!,2023,eleven asia bento box delici meal pick devour seat enjoy price reason tast lunch weight excel food excel price,1,0.8481
Woorijip,4,,2023,,1,0.0
Woorijip,5,,2023,,1,0.0
Woorijip,5,A treasure-like place I found in New York. The price is reasonable and it feels like home cooking. I was able to taste a variety of different types of Korean food.,2023,treasur place found york price reason feel home cook tast varieti type korean food,1,0.0
Woorijip,5,,2023,,1,0.0
Woorijip,5,The food is good and the price is great,2023,food good price great,1,0.7906
Woorijip,5,"A great spot for casual Korean food with plenty of food options. There are also alcohol/non-alcoholic drinks to go along with your meal. Price range for small appetizers: $4-7, lunch/dinner combo: $6-$12. There are at least 20-30 varieties daily with some seasonal menu items. I was delighted to find the Stir fried octopus with kimchee fried rice. True enough it tasted even better than it look. The octopus was so tender and flavorful. I also bought the spicy pork. It was very tasty but a bit too salty for me. The garlic fried chicken was good but I wish it was less oily. During my visit I noticed the staff regularly sanitize dining tables and seats for the diners. Kudos to the management for ensuring a safe and hygienic environment for everyone visiting! Its an eye opener seeing prepared food constantly strolled on a cart every few minutes from the kitchens doorway to the display rack. The kitchen staff here definitely can cook up a storm of Korean food. My family and I have been coming here for more than a decade. We know Covid has been extremely challenging for restaurant owners and their employees. Thank you for continuing to make delicious Korean food with great quality and striving to make it affordable to everyone!! I truly appreciate the 8% discount offered to diners who pay with Cash. THANKS!!",2023,great spot casual korean food plenti food option alcohol alcohol drink meal price rang small appet lunch dinner combo varieti daili season menu item delight find stir fri octopu kimche fri rice true tast octopu tender flavor bought spici pork tasti bit salti garlic fri chicken good oili visit notic staff regularli sanit dine tabl seat diner kudo manag ensur safe hygien environ visit eye open prepar food constantli stroll cart minut kitchen doorway display rack kitchen staff cook storm korean food famili come decad covid extrem challeng restaur owner employe continu make delici korean food great qualiti strive make afford discount offer diner pay cash,1,0.9686
Woorijip,5,"Fast service, under $8 grab and go, meal boxes. Great deal",2023,fast servic grab meal box great deal,1,0.6249
Woorijip,5,"Im happy I found this place. Such a nice selection of different main dishes and side dishes, portions were good and so affordable. I was also happy to find out that they had my favorite Korean grape juice :) definitely gonna visit again.",2023,im happi found place nice select main dish side dish portion good afford happi find favorit korean grape juic gonna visit,1,0.6908
Woorijip,5,Woorijip is one of our favorite places in Koreatown for takeout. I love their kimchi jeon and kimchi fried rice. Everything is fresh and always delicious. They also have a great selection of Korean beverages. Prices are reasonable as well.,2023,woorijip favorit place koreatown takeout love kimchi jeon kimchi fri rice fresh delici great select korean beverag price reason,1,0.891
Woorijip,5,,2023,,1,0.0
Woorijip,5,Amazing concept. Really liked the food!,2023,amaz concept food,1,0.0
Woorijip,5,,2023,,1,0.0
Woorijip,5,My favorite place for lunch! So many great options to choose from and incredibly great value,2023,favorit place lunch great option choos incred great,1,0.8481
Woorijip,5,,2023,,1,0.0
Woorijip,5,,2023,,1,0.0
Woorijip,4,,2023,,1,0.0
Woorijip,5,"The local Korean spot that has made a place in my inner circles heart. This place is very local so expect the kids coming out of school to head here or those coming out of work as well. If you ever need to get something to eat but dont want to sit down and be served, this is the perfect place for you! The Food does change everyday, and by the hour due to temperature danger zones. So expect something different from morning to night. Woorijip is a cafeteria type of establishment; you pick a tray and load it up with all the goodies your soul and wallet desire. Once done, you could either dine in after paying and heat up the food in their microwave or take out and enjoy it on your couch! If you pay cash, they do currently offer a discount, so I highly suggest doing so! If I lived in Manhattan, I would go here everyday lol. But I do come here at least once a month now!  Bring your closest homies and come here after your early Karaoke session :) Vegetarian options: Items like bok choy and miso soup! Kid-friendliness: Drinks and food the kids would enjoy! Including delicious soda milk",2023,local korean spot made place circl heart place local expect kid come school head come work eat dont sit serv perfect place food chang everyday hour due temperatur danger zone expect morn night woorijip cafeteria type establish pick tray load goodi soul wallet desir dine pay heat food microwav enjoy couch pay cash offer discount highli suggest live manhattan everyday lol month bring closest homi earli karaok session vegetarian option item bok choy miso soup kid friendli drink food kid enjoy includ delici soda milk,1,0.2505
Woorijip,5,Came here three years ago late at night with friends and we grabbed food from a buffet and then we payed by weight. So cheap and so tasty. Will be back anytime I visit Manhattan.,2023,year ago late night friend grab food buffet pay weight cheap tasti back anytim visit manhattan,1,0.4215
Woorijip,5,"You grab and go, very good and fast Korean food.",2023,grab good fast korean food,1,0.4404
Woorijip,5,Good Place for quick take out. Food was okay and price are affordable,2023,good place quick food price afford,1,0.4404
Woorijip,5,"The best in the city! Cheap, immediate pick up and delicious",2023,citi cheap pick delici,1,0.0
Woorijip,5,,2023,,1,0.0
Woorijip,5,Wide variety of freshly made foods at good prices. We have tried multiple dishes and all of them were great. Staff is friendly and they make sure to keep things running clean and smooth. The $10-14 lunch combo is plenty for one person.,2023,wide varieti freshli made food good price multipl dish great staff friendli make thing run clean smooth lunch combo plenti person,1,0.8658
Woorijip,5,Many different variety of food. Great place to get lunch.,2023,varieti food great place lunch,1,0.6249
Woorijip,5,Good value!!!,2023,good,1,0.4404
Woorijip,3,,2023,,0,0.0
Woorijip,5,"Great place. Everything is dished and all u do is take up as much as you like and head to the cashier. Very good prices, delicious food.",2023,great place dish head cashier good price delici food,1,0.7906
Woorijip,5,"Great little place to grab some quick variety of packaged dishes like seafood pancake, takoyaki, eel over rice, Bulgogi, banchan, hot soups, etc. There are high tables and seats for you to dine in after purchase and a cute little microwave in the back (pay to use). They offer 8% off if you pay in cash.",2023,great place grab quick varieti packag dish seafood pancak takoyaki eel rice bulgogi banchan hot soup high tabl seat dine purchas cute microwav back pay offer pay cash,1,0.743
Woorijip,5,A great lil spot for a variety of authentic Korean dishes at an unbeatable price! My go to is the japchae and the kimbap!,2023,great lil spot varieti authent korean dish unbeat price japcha kimbap,1,0.6249
Woorijip,5,,2023,,1,0.0
Woorijip,5,"Very good, attendant Sabrina very polite",2023,good attend sabrina polit,1,0.4404
Woorijip,5,You can taste a variety of Korean food at an affordable price. It was clean and well organized and all the food was fresh and delicious.,2023,tast varieti korean food afford price clean organ food fresh delici,1,0.6124
Woorijip,5,It s real Korean kimbap!! The appetite that was lost in New York has returned.,2023,real korean kimbap appetit lost york return,1,-0.3182
Woorijip,4,,2023,,1,0.0
Woorijip,4,Food was pretty cheap and you get 8% off for paying cash.,2023,food pretti cheap pay cash,1,-0.1027
Woorijip,4,,2023,,1,0.0
Woorijip,5,Love the idea. I wish the place was bigger so people wont have to fight for a place to sit,2023,love idea place bigger peopl wont fight place sit,1,0.7494
Woorijip,5,Variois kind of delicious foods in reasonable price. It is good to buy the small package of side dishes.,2023,varioi kind delici food reason price good buy small packag side dish,1,0.743
Woorijip,5,"Probably my new favorite lunch spot. Excellent prices, love the setup, food is quality.  I will be back!",2023,favorit lunch spot excel price love setup food qualiti back,1,0.802
Woorijip,5,,2023,,1,0.0
Woorijip,5,Salarymans choice,2023,salaryman choic,1,0.0
Woorijip,5,LOVE IT! The food is really good and quite affordable! Dine in: Yes Outdoor seating: No Takeout: Yes,2023,love food good afford dine outdoor seat takeout,1,0.7964
Woorijip,5,Great Korean food at very great prices!,2023,great korean food great price,1,0.8481
Woorijip,5,,2023,,1,0.0
Woorijip,5,"Great cheap place to grab a quick bite in the area. Delicious food. No more buffet bar, but now offers 8% discount when paying by cash.",2023,great cheap place grab quick bite area delici food buffet bar offer discount pay cash,1,0.5719
Woorijip,3,,2023,,0,0.0
Woorijip,5,"Perfect for an inexpensive, hearty meal. Really hits the spot and makes me wish I had the time and energy to make kimbap for myself more often.",2023,perfect inexpens hearti meal hit spot make time energi make kimbap,1,0.5719
Woorijip,5,,2023,,1,0.0
Woorijip,5,,2023,,1,0.0
Woorijip,5,,2023,,1,0.0
Woorijip,5,,2022,,1,0.0
Woorijip,5,,2022,,1,0.0
Woorijip,5,,2022,,1,0.0
Woorijip,5,Inexpensive authentic Korean food!  Hasn t changed in years!  Love it!,2022,inexpens authent korean food hasn chang year love,1,0.6369
Woorijip,5,Love their food!,2022,love food,1,0.6369
Woorijip,5,"nice place in midtown for lunch, affordable prices and acceptable surroundings",2022,nice place midtown lunch afford price accept surround,1,0.6597
Woorijip,4,Korean food to go with affordable price :),2022,korean food afford price,1,0.0
Woorijip,5,"You can choose all the dishes and drinks by yourself. After making your selection, you can queue up to check out and find a seat. There are many dishes and they taste great. The price is affordable. It is very close to the Empire State Building. After you have eaten and drank, you can visit the attractions",2022,choos dish drink make select queue check find seat dish tast great price afford close empir state build eaten drank visit attract,1,0.765
Woorijip,4,A place for quick lunch. All items are already made & waiting in boxes for you to pick up. Took a friend to visit there & she liked the food.,2022,place quick lunch item made wait box pick friend visit food,1,0.4939
Woorijip,5,"Prices are phenomenal, food is good quality, nice service, nice ambiente!",2022,price phenomen food good qualiti nice servic nice ambient,1,0.8176
Woorijip,4,,2022,,1,0.0
Woorijip,5,"Great value, delicious.",2022,great delici,1,0.6249
Woorijip,5,Very cool place to try different types of korean dishes! Well worth the trip to it. Very friendly staff!,2022,cool place type korean dish worth trip friendli staff,1,0.4939
Woorijip,4,This place is awesome. For a single guy that didnt cook its a savior!  Prices are reasonable for the area and service is friendly. I like the Korean crab cakes!,2022,place awesom singl guy didnt cook savior price reason area servic friendli korean crab cake,1,0.0
Woorijip,5,,2022,,1,0.0
Woorijip,5,All kinds of delicious Korean dishes. Delicious Kimchi stew with pork. And all at a price of around 10 euros per person. A great address,2022,kind delici korean dish delici kimchi stew pork price euro person great address,1,0.8176
Woorijip,5,"Every international student/ young professional know this is the best deal for budget dinner, high quality food, and fun vibes! They used to open later and turn into a self service bar with beers in the fridge but now the more a take away dinner place. It s a great place for casual groups or takeaway. BRING CASH to save 8%!",2022,intern student young profession deal budget dinner high qualiti food fun vibe open turn servic bar beer fridg dinner place great place casual group takeaway bring cash save,1,0.9081
Woorijip,4,,2022,,1,0.0
Woorijip,4,,2022,,1,0.0
Woorijip,5,"Give it a try and you wont regret it. Our go to for a quick affordable bite in k-town. Always fresh, delicious and many options to choose from. Pre-packaged fresh cooked balances meals that you can buy and heat in their cute little blue microwaves. Spicy pork combo is my go to and the baked mackerel is best! Full compliance with mask and vaccine requirement. Although very busy and not a typical dine in restaurant, they checked all vaccine cards through the timeframe when it was mandatory.",2022,give wont regret quick afford bite town fresh delici option choos pre packag fresh cook balanc meal buy heat cute blue microwav spici pork combo bake mackerel full complianc mask vaccin requir busi typic dine restaur check vaccin card timefram mandatori,1,0.8373
Woorijip,5,"Good for lunch,",2022,good lunch,1,0.4404
Woorijip,5,,2022,,1,0.0
Woorijip,5,,2022,,1,0.0
Woorijip,4,,2022,,1,0.0
Woorijip,4,Loved this place and the variety they offer. This is one place I can visit almost every day for a week and still not be bored. Definitely a must visit place if you love Korean flavours. The sushi was the only one which was a bit dry and didnt stand up to the others.,2022,love place varieti offer place visit day week bore visit place love korean flavour sushi bit dri didnt stand,1,0.8126
Woorijip,5,"A perfect place for a quick bite. WYSIWYG - what you see is what you get. There are so many varieties. The prices are low compared to normal sit down restaurants. But are they good? I think so. The oysters cooked with eggs were delicious. The ox bone broth soup was yummy. The small side dishes were as good as any Korean places I ate before. The bulgogi was good but not great. The portion is good, but the beef lacked little flavor. Dont expect a freshly made and served dish in a scorching hot stone bowl, but you aint paying 2x the price either. My meal would have easily costed 50% more at other places. I would definitely go back again if I am in the area.",2022,perfect place quick bite wysiwyg varieti price low compar normal sit restaur good oyster cook egg delici ox bone broth soup yummi small side dish good korean place ate bulgogi good great portion good beef lack flavor dont expect freshli made serv dish scorch hot stone bowl aint pay price meal easili cost place back area,1,0.9459
Woorijip,5,,2022,,1,0.0
Woorijip,3,"I ate rice cake skewers and soy chicken... I didnt like it. I dont know if the price is value for money... If you live in New York, it would be nice to buy it easily.",2022,ate rice cake skewer soy chicken didnt dont price money live york nice buy easili,0,0.4215
Woorijip,5,,2022,,1,0.0
Woorijip,5,"Woorjiip is 5 stars all day everyday- my favorite place to get lunch when I am working or just in need of some mid day comfort. Really delicious, home cooked korean food that is super tasty and affordable Always a quick and easy experience to pop in and grab what you want, fast check out 8% discount if you pay in cash! Always super clean inside w plenty of places to sit Lots of drinks to choose from as well as food Lots of options for meat eaters and vegetarians alike My favorites are the japchae, the black miso cod, all the different sauteed vegetables on rotation and the kimbap!",2022,woorjiip star day everyday favorit place lunch work mid day comfort delici home cook korean food super tasti afford quick easi experi pop grab fast check discount pay cash super clean insid plenti place sit lot drink choos food lot option meat eater vegetarian alik favorit japcha black miso cod saute veget rotat kimbap,1,0.9118
Woorijip,5,"Love this place! Basically you buy ready made food (made in house), and you can have a seat, buy a drink, warm the food if needed and chill. One of my favorite stops.",2022,love place basic buy readi made food made hous seat buy drink warm food need chill favorit stop,1,0.5994
Woorijip,5,,2022,,1,0.0
Woorijip,5,"FABULOUS!!!! Its a must for getting all the Korean staple snacks and favorites like kimbap, japchae, seafood or mungbean pancakes, egg omelets, porridge, and bento boxes! They have lots of kimchi, banchan, and Korean beverages too. So much variety and at amazing prices. Everything is now pre-packaged, they removed the hot bar but the essence of this great concept of quick, convenient Korean comfort food is still the best thing on 32nd Street! Staff are fast, efficient and kind.",2022,fabul korean stapl snack favorit kimbap japcha seafood mungbean pancak egg omelet porridg bento box lot kimchi banchan korean beverag varieti amaz price pre packag remov hot bar essenc great concept quick conveni korean comfort food thing street staff fast effici kind,1,0.875
Woorijip,5,,2022,,1,0.0
Woorijip,4,Very convenient place to go. Several vegetarian/pescatarian options here. If you want a hot meal you gotta microwave it inside.,2022,conveni place vegetarian pescatarian option hot meal gotta microwav insid,1,0.0
Woorijip,2,"Ehhh. I ve eaten here two other times and the food has always been cold (obviously it s already prepped), but they should have hot options aside from the soups. The plp at the register are also odd   pacing around.",2022,ehhh ve eaten time food cold prep hot option soup plp regist odd pace,-1,-0.3182
Woorijip,4,,2022,,1,0.0
Woorijip,5,Always good affordable and friendly staff.,2022,good afford friendli staff,1,0.4404
Woorijip,5,,2022,,1,0.0
Woorijip,5,"Came to grab a quick bite and loved the variety of grab and go options here. We tried the kimchi fried rice, spicy pork bulgogi, and egg fried tofu.  All were yummy. Wish we had something like this where I live. So convenient. You can take to go or dine in.",2022,grab quick bite love varieti grab option kimchi fri rice spici pork bulgogi egg fri tofu yummi live conveni dine,1,0.6369
