place_id,place_name,review_id_hash,rating,review_text,published_at,published_at_date,response_from_owner_text,response_from_owner_ago,response_from_owner_date,review_likes_count,total_number_of_reviews_by_reviewer,total_number_of_photos_by_reviewer,is_local_guide,review_translated_text,response_from_owner_translated_text
ChIJo57dmJFZwokRBm37jca0gak,Springbone Kitchen,dda42d5ad9d3f5a48316ee1db1daf208,5,"SO delicious. I had the zucchini and meatballs, liquid gold broth (amazing), and the berry sorbet which was SO GOOD. cant wait to go back, and would highly recommend. Update: chicken and rice is also great, chia pudding is nothing to write home about.",7 years ago,2017-03-04 12:42:30.149477,,,,0,330,129,True,,
ChIJo57dmJFZwokRBm37jca0gak,Springbone Kitchen,cc043088bb99fd1c0fa817274c6117be,3,When this place is good its soooo good but they really need to work on consistency! I go often and it really feels hit or miss depending on whos working there,7 years ago,2017-03-04 12:42:30.152260,,,,0,97,91,True,,
ChIJNSszk7tbwokRoYfgkLSL9bc,Springbone Kitchen,2ee4aef69393bb26702c17a83ca78d5f,5,"My sister and I were visiting the city and we found this place walking.  The food was amazing, it s a great healthy option on the area. The employees were kind enough to give us some samples to tried the broths, and we loved them. Definitely coming back on my next visit to New York.",3 days ago,2024-03-01 12:42:30.706259,,,,0,1,,False,,
ChIJNSszk7tbwokRoYfgkLSL9bc,Springbone Kitchen,4a7ab44c85fc106f88c221bc8e8b9eae,5,The food was amazing and SO delicious! I would highly recommend eating here Food,3 days ago,2024-03-01 12:42:30.709734,,,,0,1,,False,,
ChIJNSszk7tbwokRoYfgkLSL9bc,Springbone Kitchen,a7952f11301eca6beb5546461ec7b0b8,5,Such a delicious and healthy food. We love the banana bread.,3 days ago,2024-03-01 12:42:30.713463,,,,0,2,,False,,
ChIJNSszk7tbwokRoYfgkLSL9bc,Springbone Kitchen,04d09a7b6d38d4d13891185b338460ec,5,"Great service, amazing food Is my go to place whenever I want eat Healthy and delicious Food",3 days ago,2024-03-01 12:42:30.716729,,,,0,1,,False,,
ChIJNSszk7tbwokRoYfgkLSL9bc,Springbone Kitchen,6fc166fb736144cb6bf9dde139ff66fc,5,Great people. Wonderful service.. and amazing food. I come here 2 days a week. Grandmas Chicken is my go to.,4 days ago,2024-02-29 12:42:30.720263,,,,0,1,,False,,
ChIJNSszk7tbwokRoYfgkLSL9bc,Springbone Kitchen,46adf98b51409385894419ef5402516d,5,Great place for healthy food,4 days ago,2024-02-29 12:42:30.723868,,,,0,12,28,True,,
ChIJNSszk7tbwokRoYfgkLSL9bc,Springbone Kitchen,4157ae17585f6915af783e116853ae4c,5,Best place to eat in NYC if you want to eat healthy food! Everything here is good.,4 days ago,2024-02-29 12:42:30.726896,,,,0,2,,False,,
ChIJNSszk7tbwokRoYfgkLSL9bc,Springbone Kitchen,da5c858b285d9559b4fa7937bd1729f3,5,"Vegetarian options: Highly recommend the spicy vegan broth with immunity mix, collagen and golden milk add ins. Food",5 days ago,2024-02-28 12:42:30.730474,,,,0,10,147,True,Food,
ChIJNSszk7tbwokRoYfgkLSL9bc,Springbone Kitchen,87c61bd0838657fc9c17e7cbd3dcc7cf,1,"Food is fine, review is for the delivery ability where they utilize a company called Relay that seems to be unable to contact the restaurant.  Pretty simple order was missing for over an hour and no recourse.",5 days ago,2024-02-28 12:42:30.735617,Hey Max I m sorry to hear about this. Shoot me an email at sam@springbone.com so I can address it. Thank you!,4 days ago,2024-02-29 12:42:30.735617,0,8,,False,,
ChIJNSszk7tbwokRoYfgkLSL9bc,Springbone Kitchen,36bd89de7c11a275553026e7efe249e3,2,,a month ago,2024-02-04 12:42:30.739603,,,,0,,,,,
ChIJNSszk7tbwokRoYfgkLSL9bc,Springbone Kitchen,c7038bf11cedf6705f345f14dce85a25,5,"Ive worked around the cirner for a year and have never ordered from here until today! Grandma s chicken and rice bowl was delicious - if they sold the cashew cream sauce I would buy a bottle of it! Next time, Ill try the soup!",a month ago,2024-02-04 12:42:31.498688,,,,0,135,42,True,,
ChIJNSszk7tbwokRoYfgkLSL9bc,Springbone Kitchen,dfada115edb0a66072ca68efbd159b0f,5,"Dietary restrictions: Paleo, GF, whole 30 Food",2 months ago,2024-01-04 12:42:31.502545,,,,0,2,,False,Food,
ChIJNSszk7tbwokRoYfgkLSL9bc,Springbone Kitchen,af4b37b89e459888c151746be79859d5,5,"Amazing food. We are visiting from Australia and were looking for something fresh, healthy and tasty and this absolutely hit the spot. Highly recommend!",2 months ago,2024-01-04 12:42:31.506187,,,,0,6,,False,,
ChIJNSszk7tbwokRoYfgkLSL9bc,Springbone Kitchen,e0869d9d7514080e4ec0ce128c7f8cb2,5,"I was passing by here around 3 pm and hadnt had lunch so was very excited to see a place basically dedicated to bone broth, as its my favorite meal replacement for times when I am about to accidentally skip a meal (I feel better eating it than a protein bar). It was so cool to be able to just order bone broth in a cup because I never see that anywhere. The customer service was great. When I got to the register, the person behind asked me if I wanted to try anything and offered me several hearty samples. They also offered to combine several flavors, etc. and were very interactive/ helpful. I ended up with the liquid gold beef bone broth and was very satisfied with the choice. I typically buy premade from the grocery store, so a low expectation, but I thought the broth was very light, super flavorful and filling. Enjoyed the broth but more important enjoyed the service.",3 months ago,2023-12-04 12:42:31.509070,,,,0,5,,False,,
ChIJNSszk7tbwokRoYfgkLSL9bc,Springbone Kitchen,84825ec47b304919a191532a7d55b5de,1,,4 months ago,2023-11-04 12:42:31.512069,,,,0,2,1,False,,
ChIJNSszk7tbwokRoYfgkLSL9bc,Springbone Kitchen,ad35eac745cd1a3369028be697d6abb7,5,Seed-oil free makes this top tier,5 months ago,2023-10-04 12:42:31.515163,,,,0,35,7,False,,
ChIJNSszk7tbwokRoYfgkLSL9bc,Springbone Kitchen,ffa50e6599621095a68a3fe902490faf,4,"Custom bowl was delicious, hearty, and healthy! Loved the Brussel sprouts and the kimchi.",5 months ago,2023-10-04 12:42:31.518345,,,,0,66,93,True,,
ChIJNSszk7tbwokRoYfgkLSL9bc,Springbone Kitchen,c8b3e9618502fa94b3e8554322647325,5,,5 months ago,2023-10-04 12:42:31.521876,,,,0,29,161,True,,
ChIJNSszk7tbwokRoYfgkLSL9bc,Springbone Kitchen,baa5025ab089fa1e5a860ce2c532f7ae,5,"Wholesome, healthy food for a pretty good price. I found them through meal pal and will be coming back again.",6 months ago,2023-09-04 12:42:31.525128,,,,1,287,816,True,,
ChIJNSszk7tbwokRoYfgkLSL9bc,Springbone Kitchen,d2da72f09fb23424b9a2dbc7aa1acef8,4,,6 months ago,2023-09-04 12:42:31.529383,,,,0,56,40,True,,
ChIJNSszk7tbwokRoYfgkLSL9bc,Springbone Kitchen,84bf948b1b803b1689a20f3dc2ed7ec5,1,"Ridiculous. Supposed to receive order in 10-25 mins. Call after an hour to inquire. Lady says no one has picked up to deliver. She doesn t know or care when delivery will take place. Her job is done, she says. I advise this lady to get training in customer service. Her attitude is bang out of order. I managed to cancel through Uber.",6 months ago,2023-09-04 12:42:32.314481,,,,0,4,,False,,
ChIJNSszk7tbwokRoYfgkLSL9bc,Springbone Kitchen,02ad4fe9dd7a47c407c7977ca0ac25ce,5,,6 months ago,2023-09-04 12:42:32.317538,,,,0,3,,False,,
ChIJNSszk7tbwokRoYfgkLSL9bc,Springbone Kitchen,39e80cc5a47bdf01dafdf0c369c9c900,5,The chicken bowl is super fresh and healthy. Will be back for sure!,7 months ago,2023-08-04 12:42:32.319727,,,,0,82,6,True,,
ChIJNSszk7tbwokRoYfgkLSL9bc,Springbone Kitchen,e3dce636ef79b70d1bc218a8882334f6,1,"Terrible restaurant. Worst restaurant in the area. Closed, dirty, terrible service",9 months ago,2023-06-04 12:42:32.322987,,,,0,6,,False,,
ChIJNSszk7tbwokRoYfgkLSL9bc,Springbone Kitchen,b8ff67547e9f5936cbfba61356ef423e,5,,10 months ago,2023-05-04 12:42:32.326357,,,,0,136,1,True,,
ChIJNSszk7tbwokRoYfgkLSL9bc,Springbone Kitchen,1727aa7eae1f4dcbaec5d4144667607e,5,"The grain free cookies are delicious, moist and rich. Sure to satisfy your sweet tooth. Three bites and it was outta here! A bit on the expensive side. Definitely a splurge at 3 bucks, but youre worth it!",10 months ago,2023-05-04 12:42:32.328926,,,,0,4,1,False,,
ChIJNSszk7tbwokRoYfgkLSL9bc,Springbone Kitchen,ab5c6268d6df5911169f0ca569ba9cd3,5,Best lunch option at work!,10 months ago,2023-05-04 12:42:32.331599,,,,0,4,,False,,
ChIJNSszk7tbwokRoYfgkLSL9bc,Springbone Kitchen,9a75a8cb1bb2ce19361a35dbf550613b,5,Love the food and service here!!,10 months ago,2023-05-04 12:42:32.334275,,,,0,3,,False,,
ChIJNSszk7tbwokRoYfgkLSL9bc,Springbone Kitchen,61a770cc1443d5d8ca78889cbf223653,5,The most yummy ever. Love this place!,10 months ago,2023-05-04 12:42:32.337175,,,,0,5,,False,,
ChIJNSszk7tbwokRoYfgkLSL9bc,Springbone Kitchen,8573ab7708e32298562438fbb5e883d1,5,,10 months ago,2023-05-04 12:42:32.339713,,,,0,,,,,
ChIJNSszk7tbwokRoYfgkLSL9bc,Springbone Kitchen,bbe6ede32a01993637f9e8af106724e9,5,Love springbone!!!,10 months ago,2023-05-04 12:42:33.082206,,,,0,2,,False,,
ChIJNSszk7tbwokRoYfgkLSL9bc,Springbone Kitchen,8bb4cfa3dcde17b830b85010bfeaba06,5,,10 months ago,2023-05-04 12:42:33.085109,,,,0,,,,,
ChIJNSszk7tbwokRoYfgkLSL9bc,Springbone Kitchen,1c6b9916e97de3e3b1fb306147d9d55d,4,I love how this store is formatted and the options look so healthy & nutrient dense,11 months ago,2023-04-04 12:42:33.087589,,,,0,2,,False,,
ChIJNSszk7tbwokRoYfgkLSL9bc,Springbone Kitchen,535ba913afd8d72a242bb32f67e39d1b,5,,11 months ago,2023-04-04 12:42:33.090247,,,,0,3,,False,,
ChIJNSszk7tbwokRoYfgkLSL9bc,Springbone Kitchen,67ca988546839698365c5d5ecc3180cc,5,,11 months ago,2023-04-04 12:42:33.092590,,,,0,1,,False,,
ChIJNSszk7tbwokRoYfgkLSL9bc,Springbone Kitchen,f985c497f9f9c16cffe422c2dfaea083,5,,11 months ago,2023-04-04 12:42:33.095482,,,,0,1,,False,,
ChIJNSszk7tbwokRoYfgkLSL9bc,Springbone Kitchen,cfb07213b07f3232c3d754077e72c73d,5,"Dietary restrictions: Perfect for gluten free, whole 30.",11 months ago,2023-04-04 12:42:33.098134,,,,0,1,,False,,
ChIJNSszk7tbwokRoYfgkLSL9bc,Springbone Kitchen,2493103a9db9ad8e31f05c958ce22ea5,5,Loved the cookie,11 months ago,2023-04-04 12:42:33.100965,,,,0,1,,False,,
ChIJNSszk7tbwokRoYfgkLSL9bc,Springbone Kitchen,2a83b3cf7e64a3220aa4e2c399040c97,5,"Dietary restrictions: Everything is gluten free, I have serious sweet tooth prob!    staff is super friendly",11 months ago,2023-04-04 12:42:33.104793,,,,0,4,,False,,
ChIJNSszk7tbwokRoYfgkLSL9bc,Springbone Kitchen,491f8f3c02796d31c338a2054ba45f96,5,,11 months ago,2023-04-04 12:42:33.108519,,,,0,4,,False,,
ChIJNSszk7tbwokRoYfgkLSL9bc,Springbone Kitchen,ea5185a3690db86b7ad78afc969ae9e5,5,love it!,11 months ago,2023-04-04 12:42:33.912934,,,,0,1,,False,,
ChIJNSszk7tbwokRoYfgkLSL9bc,Springbone Kitchen,6ea0bdc64dffb3c1d2fc97c0cac0c763,5,Truly the kindest and sweetest team. The food is great too.,11 months ago,2023-04-04 12:42:33.915605,,,,0,16,3,False,,
ChIJNSszk7tbwokRoYfgkLSL9bc,Springbone Kitchen,1388c4f632cfd36322edc5902a96fa3e,5,Great! Vegetarian options: N/A Dietary restrictions: N/A,11 months ago,2023-04-04 12:42:33.918159,,,,0,1,,False,,
ChIJNSszk7tbwokRoYfgkLSL9bc,Springbone Kitchen,b2e3f1600cdac5daf547dd938660254b,5,"A quick, healthy lunch spot on FiDi!",11 months ago,2023-04-04 12:42:33.920820,,,,0,36,4,True,,
ChIJNSszk7tbwokRoYfgkLSL9bc,Springbone Kitchen,b2f69307b823f3d2a91b05891e739e97,5,,11 months ago,2023-04-04 12:42:33.923497,,,,0,4,,False,,
ChIJNSszk7tbwokRoYfgkLSL9bc,Springbone Kitchen,d5d8a2361cc3a41ee9be978140bacb34,5,"Love having a healthy paleo friendly option so close by in fidi. I appreciate having a place that cares so much about the ingredients. Have gotten the grandmas chicken bowl, immunity broth and cookies and they are all delicious.",11 months ago,2023-04-04 12:42:33.925839,,,,0,1,,False,,
ChIJNSszk7tbwokRoYfgkLSL9bc,Springbone Kitchen,391653f4762a6ccfe15a67f94a38e682,5,,11 months ago,2023-04-04 12:42:33.928707,,,,0,,,,,
ChIJNSszk7tbwokRoYfgkLSL9bc,Springbone Kitchen,0256e161ddc475fd3aab48f7eb5cc9fe,5,Healthiest food in FiDi. I always get the Bad Hombre when I get the afternoon hangries. It is delicious soup and a beautiful tribute to my favorite chicos!,11 months ago,2023-04-04 12:42:33.930948,,,,0,7,4,False,,
ChIJNSszk7tbwokRoYfgkLSL9bc,Springbone Kitchen,a0d08a02af4bfe233f1ac405ac7875cd,5,,11 months ago,2023-04-04 12:42:33.934010,,,,0,1,1,False,,
ChIJNSszk7tbwokRoYfgkLSL9bc,Springbone Kitchen,dde2b2d5794e8d163b71d77c7d449844,5,Delicious food and friendly staff :),11 months ago,2023-04-04 12:42:33.936254,,,,0,3,,False,,
ChIJNSszk7tbwokRoYfgkLSL9bc,Springbone Kitchen,d58640d2139a565b72e13f825b60c4c9,5,really good broth!! could not believe it had mushroom,11 months ago,2023-04-04 12:42:34.640690,,,,0,21,90,False,,
ChIJNSszk7tbwokRoYfgkLSL9bc,Springbone Kitchen,9bbe618afcc4e085e59f7bfe753ed145,5,"The food here is so tasty and comforting. It s the kind of food that nourishes your body and soul. I got the roasted veggie bowl with chicken and every part of the dish was delicious. The vegetables were hearty and flavorful; the chicken was juicy and perfectly cooked; the bone broth quinoa was amazing; and the sauces added depth to all of the flavors. I also had an order of the chicken bone broth and that was outstanding! The best tasting chicken bone broth I ve had - it was full bodied and the natural flavor of the chicken shines through. For dessert, I tried their chocolate chip cookie and it was the perfect way to cap off a truly delicious meal as it was soft, a bit chewy and just the right amount of sweet. On top of it all, the service was super friendly and the people were very helpful and attentive. Highly recommend this place!",11 months ago,2023-04-04 12:42:34.643393,,,,0,26,76,True,,
ChIJNSszk7tbwokRoYfgkLSL9bc,Springbone Kitchen,af75c5da6218ccb9209d7c7dd05999e3,5,Broth is deliciiious! I tried the ginger garlic and the classic chicken broth and I loved both. The person at the register was patient and super nice. I will definitely come back to buy the frozen broth to keep home :),11 months ago,2023-04-04 12:42:34.646360,,,,0,16,2,False,,
ChIJNSszk7tbwokRoYfgkLSL9bc,Springbone Kitchen,53cf1b35cab5b5b445a35c2b94f19cb3,4,"Very good, especially for people Who cant eat gluten. 100% gluten free",11 months ago,2023-04-04 12:42:34.649134,,,,0,1,,False,,
ChIJNSszk7tbwokRoYfgkLSL9bc,Springbone Kitchen,76d343c0f03f5ae38a33676153dd66fe,5,Delicious healthy food!,11 months ago,2023-04-04 12:42:34.651596,,,,0,6,,False,,
ChIJNSszk7tbwokRoYfgkLSL9bc,Springbone Kitchen,ab9f24728f14a75d6e1192648e453266,5,"Cool healthy spot. I don t know what it is about this place but every bowl is delicious and hearty! You can taste the freshness and the quality of ingredients on the first bite. They straight up serve a variety of broths in a cup and as interesting as it sounds it s worth a try. I felt invigorated after drinking the immunity broth which consisted of chicken broth, ginger and vitamin C. Grandma bowl and Mexican bowl are my favs. I especially love the free range grilled chicken in both bowls. They really got the secret sauce. Workers at the front are also super friendly and helpful!",a year ago,2023-03-04 12:42:34.654530,,,,5,116,303,True,,
ChIJNSszk7tbwokRoYfgkLSL9bc,Springbone Kitchen,f2147071f73f8ccae08e56130cce55c5,5,,a year ago,2023-03-04 12:42:34.657192,,,,0,9,,False,,
ChIJNSszk7tbwokRoYfgkLSL9bc,Springbone Kitchen,78e2bab59899a90382c164d9e05b0581,5,,a year ago,2023-03-04 12:42:34.660096,,,,0,,,,,
ChIJNSszk7tbwokRoYfgkLSL9bc,Springbone Kitchen,e12ba979b1298d662adf4bb770cd7d9c,5,,a year ago,2023-03-04 12:42:34.662515,,,,0,,,,,
ChIJNSszk7tbwokRoYfgkLSL9bc,Springbone Kitchen,a9466f2c4dee5feb71cfbc10d39e4e99,5,,a year ago,2023-03-04 12:42:34.664991,,,,0,,,,,
ChIJNSszk7tbwokRoYfgkLSL9bc,Springbone Kitchen,a66c8bd7a2976f1319a6abec6c62e42d,5,Awesomeeee,a year ago,2023-03-04 12:42:35.462716,,,,0,1,,False,,
ChIJNSszk7tbwokRoYfgkLSL9bc,Springbone Kitchen,3e4e35e5670ca585d43e3d542cbff2e4,5,Go to place for me and my favorite colleague! Love the grandma chicken and rice and the Mexican bowl. The immunity broth is also really good.,a year ago,2023-03-04 12:42:35.467649,,,,0,1,,False,,
ChIJNSszk7tbwokRoYfgkLSL9bc,Springbone Kitchen,ea2ac4416b6c677d8feef96a5d599907,5,,a year ago,2023-03-04 12:42:35.473791,,,,0,,,,,
ChIJNSszk7tbwokRoYfgkLSL9bc,Springbone Kitchen,eb4ba854ce3056a8f3a782deb6f7e5d5,5,Love brittany! She took care of me and explained everything . I ll be back !,a year ago,2023-03-04 12:42:35.477270,,,,0,8,2,False,,
ChIJNSszk7tbwokRoYfgkLSL9bc,Springbone Kitchen,463bed179384da1693677f3bc7fb6343,5,AMAZINGGG,a year ago,2023-03-04 12:42:35.480694,,,,0,2,,False,,
ChIJNSszk7tbwokRoYfgkLSL9bc,Springbone Kitchen,6917916fa282cc6c30b827f280054d63,5,"Warm, low calorie, quick",a year ago,2023-03-04 12:42:35.484233,,,,1,37,20,False,,
ChIJNSszk7tbwokRoYfgkLSL9bc,Springbone Kitchen,7dc89a4d2a359fb0e9b7dd67bdc60792,5,,a year ago,2023-03-04 12:42:35.488277,,,,0,1,,False,,
ChIJNSszk7tbwokRoYfgkLSL9bc,Springbone Kitchen,06e4e9883ae1328aa3f5cbcdd633308b,5,Great people!! Great service!!! The music is always on point. Food is super yummy.,a year ago,2023-03-04 12:42:35.490544,,,,1,2,,False,,
ChIJNSszk7tbwokRoYfgkLSL9bc,Springbone Kitchen,b2269814fe72097bfc3594919eca5bb1,5,"Food is good, service is great. I had a small issue with my order and the staff went above and beyond to make it right, starting with a personal call and working to make it better.",a year ago,2023-03-04 12:42:35.494977,,,,1,21,7,False,,
ChIJNSszk7tbwokRoYfgkLSL9bc,Springbone Kitchen,b24bf55d65f7f996b749c5855a1148e0,5,BEST SERVICE,a year ago,2023-03-04 12:42:35.498995,,,,1,2,,False,,
ChIJNSszk7tbwokRoYfgkLSL9bc,Springbone Kitchen,f0930f77e96cbd3843033d4fe7f272ca,5,Very nice staff,a year ago,2023-03-04 12:42:36.228281,,,,1,5,,False,,
ChIJNSszk7tbwokRoYfgkLSL9bc,Springbone Kitchen,58762bba0bd2eac585eb3511c788cc1d,5,,a year ago,2023-03-04 12:42:36.231379,,,,0,8,,False,,
ChIJNSszk7tbwokRoYfgkLSL9bc,Springbone Kitchen,dfef3cf2819c7a62c22f68fcab586df0,5,"Delicious, healthy, affordable. What else could you ask for?",a year ago,2023-03-04 12:42:36.233625,,,,1,2,,False,,
ChIJNSszk7tbwokRoYfgkLSL9bc,Springbone Kitchen,6066b1a89cb4730ed10819e6b1ef2b61,5,,a year ago,2023-03-04 12:42:36.236363,,,,0,1,,False,,
ChIJNSszk7tbwokRoYfgkLSL9bc,Springbone Kitchen,90baf82b242b2bf37891a2719d55ec52,5,Love the bad hombre!,a year ago,2023-03-04 12:42:36.239145,,,,1,1,,False,,
ChIJNSszk7tbwokRoYfgkLSL9bc,Springbone Kitchen,a1861b5f9840f77a96a53b7968eb4d13,5,"Homey, comforting and super delicious! Vegetarian options: Great veggie broths!",a year ago,2023-03-04 12:42:36.241684,,,,1,2,4,False,,
ChIJNSszk7tbwokRoYfgkLSL9bc,Springbone Kitchen,f95f97e8f7cdcab5ec6c92ebf388de46,5,"Love their Grandmas Chicken and Rice, and service is always friendly and fast.",a year ago,2023-03-04 12:42:36.244699,,,,1,1,,False,,
ChIJNSszk7tbwokRoYfgkLSL9bc,Springbone Kitchen,050b1ce096e4909c1ea8b51d8e5c87d3,5,Love this place! Delicious bone broth and met all my dietary needs for sweets. Stop by for a healthy lunch or dinner after work. Vegetarian options: Veggie bone broth Dietary restrictions: Vegan and gluten free,a year ago,2023-03-04 12:42:36.247550,,,,1,8,49,False,,
ChIJNSszk7tbwokRoYfgkLSL9bc,Springbone Kitchen,62549f7e519a80842564ea02b843dbd5,5,Love the kale Caesar with chicken!,a year ago,2023-03-04 12:42:36.250208,,,,1,4,,False,,
ChIJNSszk7tbwokRoYfgkLSL9bc,Springbone Kitchen,9c658fadbb8a1708b7fb052efb17dc7c,5,Best service!!!,a year ago,2023-03-04 12:42:36.252987,,,,1,1,,False,,
ChIJNSszk7tbwokRoYfgkLSL9bc,Springbone Kitchen,169118a26298ff78c283cd4a45339449,5,I love this place Vegetarian options: I love love this place.,a year ago,2023-03-04 12:42:37.021874,,,,1,9,,False,,
ChIJNSszk7tbwokRoYfgkLSL9bc,Springbone Kitchen,402e146178f11423a661a1694dbdb26b,5,Good place to eat,a year ago,2023-03-04 12:42:37.024805,,,,1,28,,True,,
ChIJNSszk7tbwokRoYfgkLSL9bc,Springbone Kitchen,d500d8c4d0cb0391a30e54867e1f86a5,5,Delicious food and friendly people,a year ago,2023-03-04 12:42:37.028346,,,,1,2,,False,,
ChIJNSszk7tbwokRoYfgkLSL9bc,Springbone Kitchen,54b4815de15aa49758792b64af2656d5,5,Quick & efficient :) lovely staff,a year ago,2023-03-04 12:42:37.031176,,,,1,4,,False,,
ChIJNSszk7tbwokRoYfgkLSL9bc,Springbone Kitchen,eb0f20d40b4df5afbb50498b892218fd,5,,a year ago,2023-03-04 12:42:37.033954,,,,0,3,2,False,,
ChIJNSszk7tbwokRoYfgkLSL9bc,Springbone Kitchen,5c8e1b57e86c8064c8b7cdcbe5d12b4e,5,"Great place, food is delicious, fresh and fast Vegetarian options: Vegetarian and vegan options Dietary restrictions: Dairy and gluten free options",a year ago,2023-03-04 12:42:37.036257,,,,1,3,,False,,
ChIJNSszk7tbwokRoYfgkLSL9bc,Springbone Kitchen,008dcd3d38a0afeeb595b46045415071,5,Love their chicken broth!,a year ago,2023-03-04 12:42:37.039135,,,,1,8,7,True,,
ChIJNSszk7tbwokRoYfgkLSL9bc,Springbone Kitchen,8f78f7a6d05be8ac4604900c0a27e22e,5,Broth is simple and healthy and hot. Just as it should be.,a year ago,2023-03-04 12:42:37.041877,,,,1,38,22,True,,
ChIJNSszk7tbwokRoYfgkLSL9bc,Springbone Kitchen,61b90916013102cf7e6c90bbe169dede,1,"I found a paper strip that says  parsley  in my vegan shakshuka and I kept biting something in my food which was grainy. Thought I ordered shakshuka, turns out it was a fortune cookie with no luck.",a year ago,2023-03-04 12:42:37.045540,Hi Theo I m so sorry about that. I have spoken with the team to make sure that doesn t happen again.  Please send me an email at sam@springbone.com so I can issue you a credit. Thank you for letting us know!,a year ago,2023-03-04 12:42:37.045540,1,2,2,False,,
ChIJNSszk7tbwokRoYfgkLSL9bc,Springbone Kitchen,6136b8d72d039f8383b57913f891e150,1,I placed an order for delivery and it never arrived nor could I reach the restaurant through their phone number. If you are looking to eat here DO NOT order online. Youll only run into problems...,a year ago,2023-03-04 12:42:37.048585,Hi Jessie I m so sorry to hear about your order not arriving. Would you mind sending me an email at sam@springbone.com with your order info so I can make sure you get a refund for your order? Thank you!,a year ago,2023-03-04 12:42:37.048585,0,1,,False,,
